achievement_game_url,achievement_url,achievement_name,achievement_desc,achievement_earned,achievement_score,ta_score,ta_ratio
https://www.trueachievements.com/game/Halo-Infinite/achievements,https://www.trueachievements.com/a346520/party-bus-achievement,Party Bus,"Earned ""Mount Up"" in a Razorback in a matchmade game.",25 Nov 21,(10),54,5.44
https://www.trueachievements.com/game/Halo-Infinite/achievements,https://www.trueachievements.com/a346531/multiclass-racer-achievement,Multi-class Racer,Drove 4 unique vehicles in a game,24 Nov 21,(10),22,2.21
https://www.trueachievements.com/game/Halo-Infinite/achievements,https://www.trueachievements.com/a346533/one-shot-top-mid-achievement,"One Shot, Top Mid","Marked an enemy located at ""Top Mid"" in a matchmade game.",24 Nov 21,(10),27,2.75
https://www.trueachievements.com/game/Halo-Infinite/achievements,https://www.trueachievements.com/a346541/straight-to-the-bank-achievement,Straight to the Bank,Deposited 5 Power Seeds in a Stockpile game in a matchmade game.,24 Nov 21,(25),78,3.12
https://www.trueachievements.com/game/Halo-Infinite/achievements,https://www.trueachievements.com/a346525/kebab-achievement,Kebab,Destroyed an enemy vehicle with the Skewer in a matchmade game.,24 Nov 21,(10),17,1.78
https://www.trueachievements.com/game/Halo-Infinite/achievements,https://www.trueachievements.com/a346502/limited-addition-achievement,Limited Addition,Completed a Limited Time Challenge.,24 Nov 21,(10),14,1.49
https://www.trueachievements.com/game/Halo-Infinite/achievements,https://www.trueachievements.com/a346534/enemies-everywhere-achievement,Enemies Everywhere!,Marked 3+ enemies at once in a matchmade game.,20 Nov 21,(10),26,2.68
https://www.trueachievements.com/game/Halo-Infinite/achievements,https://www.trueachievements.com/a346505/get-the-popcorn-achievement,Get the Popcorn,Viewed a clip in theater.,20 Nov 21,(5),10,2.13
https://www.trueachievements.com/game/Halo-Infinite/achievements,https://www.trueachievements.com/a346523/brutality-achievement,Brutality,Killed an enemy with melee using a bladed weapon in a matchmade game.,19 Nov 21,(10),14,1.47
https://www.trueachievements.com/game/Halo-Infinite/achievements,https://www.trueachievements.com/a346532/they-see-me-rollin-achievement,They See Me Rollin',Spectated an ally that is driving a Warthog or Razorback in a matchmade game.,19 Nov 21,(5),10,2.09
https://www.trueachievements.com/game/Halo-Infinite/achievements,https://www.trueachievements.com/a346506/customary-achievement,Customary,Played a custom game.,19 Nov 21,(5),8,1.7
https://www.trueachievements.com/game/Halo-Infinite/achievements,https://www.trueachievements.com/a346524/sick-burn-achievement,Sick Burn,Killed an enemy with the Ravager's charged shot in a matchmade game.,19 Nov 21,(10),22,2.24
https://www.trueachievements.com/game/Halo-Infinite/achievements,https://www.trueachievements.com/a346535/natural-formation-location-sensation-achievement,Natural Formation Location Sensation,Gained access to a loot cave in a matchmade game.,19 Nov 21,(10),21,2.17
https://www.trueachievements.com/game/Halo-Infinite/achievements,https://www.trueachievements.com/a346528/secret-stash-achievement,Secret Stash,Placed an item in the Razorback's storage in a matchmade game.,18 Nov 21,(5),15,3.09
https://www.trueachievements.com/game/Halo-Infinite/achievements,https://www.trueachievements.com/a346508/sparring-partners-achievement,Sparring Partners,Changed any training mode option.,18 Nov 21,(10),22,2.27
https://www.trueachievements.com/game/Halo-Infinite/achievements,https://www.trueachievements.com/a346507/getting-strong-now-achievement,Getting Strong Now,Launched into Training Mode for the first time.,18 Nov 21,(10),19,1.92
https://www.trueachievements.com/game/Halo-Infinite/achievements,https://www.trueachievements.com/a346510/deadeye-achievement,Deadeye,Earned 3 stars in a Weapon Drill.,18 Nov 21,(10),21,2.19
https://www.trueachievements.com/game/Halo-Infinite/achievements,https://www.trueachievements.com/a346509/sharpshooter-achievement,Sharpshooter,Completed a Weapon Drill.,18 Nov 21,(5),8,1.66
https://www.trueachievements.com/game/Halo-Infinite/achievements,https://www.trueachievements.com/a346512/doing-your-part-achievement,Doing Your Part,Completed the Tutorial.,18 Nov 21,(20),34,1.73
https://www.trueachievements.com/game/Halo-Infinite/achievements,https://www.trueachievements.com/a346513/just-the-two-of-us-achievement,Just the Two of Us,Accessed your Personal AI.,18 Nov 21,(5),8,1.69
https://www.trueachievements.com/game/Halo-Infinite/achievements,https://www.trueachievements.com/a346517/slaying-with-style-achievement,Slaying with Style,Earned a Mythic Medal in a matchmade game.,18 Nov 21,(50),82,1.65
https://www.trueachievements.com/game/Halo-Infinite/achievements,https://www.trueachievements.com/a346522/peekers-disadvantage-achievement,Peeker's Disadvantage,"""Back Smacked"" an enemy who was zoomed in with a scoped weapon in a matchmade game.",18 Nov 21,(10),16,1.6
https://www.trueachievements.com/game/Halo-Infinite/achievements,https://www.trueachievements.com/a346530/do-you-even-gift-achievement,Do You Even Gift?,Dropped a Power Weapon for an ally in a matchmade game.,18 Nov 21,(10),26,2.67
https://www.trueachievements.com/game/Halo-Infinite/achievements,https://www.trueachievements.com/a346529/bomb-returned-achievement,Bomb Returned,Repelled an enemy grenade with the Repulsor in a matchmade game.,18 Nov 21,(10),18,1.89
https://www.trueachievements.com/game/Halo-Infinite/achievements,https://www.trueachievements.com/a346498/humble-beginnings-achievement,Humble Beginnings,Completed one level in a Battle Pass.,18 Nov 21,(5),6,1.23
https://www.trueachievements.com/game/Halo-Infinite/achievements,https://www.trueachievements.com/a346516/peak-performance-achievement,Peak Performance,"Earned 2,000 score in a matchmade game.",18 Nov 21,(25),31,1.26
https://www.trueachievements.com/game/Halo-Infinite/achievements,https://www.trueachievements.com/a346540/control-freak-achievement,Control Freak,Assisted in capturing all zones that lead to a score in a Total Control game.,18 Nov 21,(25),49,1.96
https://www.trueachievements.com/game/Halo-Infinite/achievements,https://www.trueachievements.com/a346501/we-have-a-job-for-you-achievement,We Have a Job For You,Completed a Weekly Challenge.,18 Nov 21,(5),5,1.18
https://www.trueachievements.com/game/Halo-Infinite/achievements,https://www.trueachievements.com/a346500/clocking-in-achievement,Clocking In,Completed a Daily Challenge.,18 Nov 21,(5),5,1.1
https://www.trueachievements.com/game/Halo-Infinite/achievements,https://www.trueachievements.com/a346425/passion-for-fashion-achievement,Passion for Fashion,Wore a new armor customization item.,18 Nov 21,(5),5,1.18
https://www.trueachievements.com/game/Halo-Infinite/achievements,https://www.trueachievements.com/a346496/reporting-for-duty-achievement,Reporting for Duty,Changed your Spartan Tag.,18 Nov 21,(5),6,1.27
https://www.trueachievements.com/game/Halo-Infinite/achievements,https://www.trueachievements.com/a346494/which-one-of-us-is-the-machine-achievement,Which One of Us is the Machine?,Got and equip a new AI.,18 Nov 21,(5),6,1.24
https://www.trueachievements.com/game/Halo-Infinite/achievements,https://www.trueachievements.com/a346497/im-ready-how-bout-you-achievement,"I'm Ready, How 'Bout You?",Changed your Spartan's look in the Customize menu.,18 Nov 21,(5),5,1.15
https://www.trueachievements.com/game/Halo-Infinite/achievements,https://www.trueachievements.com/a346495/that-thing-on-the-left-is-the-brake-achievement,That Thing on the Left is the Brake,Test drove a new vehicle customization.,18 Nov 21,(5),7,1.46
https://www.trueachievements.com/game/Halo-Infinite/achievements,https://www.trueachievements.com/a346424/need-a-weapon-achievement,"""Need a Weapon?""",Tried out a new weapon customization item.,18 Nov 21,(5),6,1.32
https://www.trueachievements.com/game/Disgaea-4-Complete-Plus/achievements,https://www.trueachievements.com/a309034/welcome-to-disgaea-4-complete-achievement,Welcome to Disgaea 4 Complete+!,Begins with a New Game Start a new game by selecting...New Game.,15 Oct 20,(10),10,1.0
https://www.trueachievements.com/game/Yakuza-0-Windows/achievements,https://www.trueachievements.com/a294271/talk-of-the-town-achievement,Talk of the Town,"Get over 1,000 fans in any area.",13 Oct 20,(15),45,3.03
https://www.trueachievements.com/game/Yakuza-0-Windows/achievements,https://www.trueachievements.com/a294256/the-big-reveal-achievement,The Big Reveal,Complete Chapter 10.,13 Oct 20,(15),36,2.44
https://www.trueachievements.com/game/Yakuza-0-Windows/achievements,https://www.trueachievements.com/a294254/when-it-all-goes-wrong-achievement,When It All Goes Wrong,Complete Chapter 8.,13 Oct 20,(15),35,2.38
https://www.trueachievements.com/game/Yakuza-0-Windows/achievements,https://www.trueachievements.com/a294270/a-host-of-hostesses-achievement,A Host of Hostesses,Get started with Cabaret Club Czar.,12 Oct 20,(15),34,2.29
https://www.trueachievements.com/game/Yakuza-0-Windows/achievements,https://www.trueachievements.com/a294252/time-to-say-goodbye-achievement,Time to Say Goodbye,Complete Chapter 6.,11 Oct 20,(15),33,2.24
https://www.trueachievements.com/game/Yakuza-0-Windows/achievements,https://www.trueachievements.com/a294280/make-it-rain-achievement,Make It Rain,Throw away money on the street.,11 Oct 20,(15),35,2.38
https://www.trueachievements.com/game/Drake-Hollow/achievements,https://www.trueachievements.com/a302437/ignored-the-call-achievement,Ignored the Call,"Ignore the call for help, and return to your normal life.",11 Oct 20,(10),23,2.3
https://www.trueachievements.com/game/Yakuza-0-Windows/achievements,https://www.trueachievements.com/a294266/president-kiryu-achievement,President Kiryu,Get started with Real Estate Royale.,11 Oct 20,(15),32,2.16
https://www.trueachievements.com/game/Yakuza-0-Windows/achievements,https://www.trueachievements.com/a294297/call-me-achievement,Call Me,Go on a date with a girl you met at the telephone club.,11 Oct 20,(15),52,3.49
https://www.trueachievements.com/game/Final-Fantasy-XV/achievements,https://www.trueachievements.com/a226593/quadruple-threat-achievement,Quadruple Threat,Equipped four weapon slots.,24 Sep 20,(10),11,1.11
https://www.trueachievements.com/game/Final-Fantasy-XV/achievements,https://www.trueachievements.com/a226619/angling-rookie-achievement,Angling Rookie,Improved fishing level for the first time.,24 Sep 20,(10),13,1.39
https://www.trueachievements.com/game/Final-Fantasy-XV/achievements,https://www.trueachievements.com/a226587/cooking-rookie-achievement,Cooking Rookie,Improved cooking level for the first time.,24 Sep 20,(10),12,1.25
https://www.trueachievements.com/game/Final-Fantasy-XV/achievements,https://www.trueachievements.com/a226589/photo-rookie-achievement,Photo Rookie,Improved photography level for the first time.,24 Sep 20,(10),11,1.11
https://www.trueachievements.com/game/Final-Fantasy-XV/achievements,https://www.trueachievements.com/a226583/spinning-a-yarn-i-achievement,Spinning a Yarn I,Completed first sidequest.,24 Sep 20,(10),11,1.15
https://www.trueachievements.com/game/Final-Fantasy-XV/achievements,https://www.trueachievements.com/a226584/high-five-for-justice-achievement,High Five for Justice!,Played JUSTICE MONSTERS FIVE for the first time.,24 Sep 20,(10),13,1.38
https://www.trueachievements.com/game/Final-Fantasy-XV/achievements,https://www.trueachievements.com/a226588/learners-permit-achievement,Learner's Permit,Drove the Regalia.,24 Sep 20,(10),10,1.09
https://www.trueachievements.com/game/Final-Fantasy-XV/achievements,https://www.trueachievements.com/a226595/blind-spot-achievement,Blind Spot,Performed first blindside link.,24 Sep 20,(10),10,1.03
https://www.trueachievements.com/game/Final-Fantasy-XV/achievements,https://www.trueachievements.com/a226596/brotherinarms-achievement,Brother-in-Arms,Issued first ally command.,24 Sep 20,(10),10,1.06
https://www.trueachievements.com/game/Final-Fantasy-XV/achievements,https://www.trueachievements.com/a226591/just-hangin-around-achievement,Just Hangin' Around,Performed first point-warp suspension.,24 Sep 20,(10),10,1.05
https://www.trueachievements.com/game/Final-Fantasy-XV/achievements,https://www.trueachievements.com/a226590/noct-you-like-a-hurricane-achievement,Noct You Like a Hurricane,Initiated first link-strike after parrying an attack.,24 Sep 20,(10),11,1.1
https://www.trueachievements.com/game/Final-Fantasy-XV/achievements,https://www.trueachievements.com/a226597/new-power-achievement,New Power,Learned first ability.,24 Sep 20,(10),10,1.09
https://www.trueachievements.com/game/Final-Fantasy-XV/achievements,https://www.trueachievements.com/a226598/insomnias-waking-nightmare-achievement,Insomnia's Waking Nightmare,Completed the Prologue.,24 Sep 20,(10),10,1.0
https://www.trueachievements.com/game/Yakuza-0-Windows/achievements,https://www.trueachievements.com/a294250/a-matter-of-life-or-death-achievement,A Matter of Life or Death,Complete Chapter 4.,23 Sep 20,(15),30,2.05
https://www.trueachievements.com/game/Yakuza-0-Windows/achievements,https://www.trueachievements.com/a294248/new-allies-new-foes-achievement,"New Allies, New Foes",Complete Chapter 2.,21 Sep 20,(15),26,1.77
https://www.trueachievements.com/game/Yakuza-0-Windows/achievements,https://www.trueachievements.com/a294276/tell-me-a-story-achievement,Tell Me a Story,Complete 10 substories.,21 Sep 20,(15),28,1.91
https://www.trueachievements.com/game/Yakuza-0-Windows/achievements,https://www.trueachievements.com/a294283/i-did-it-for-the-achievement-achievement,...I Did It for the Achievement,Watch a racy video.,21 Sep 20,(15),31,2.12
https://www.trueachievements.com/game/Yakuza-0-Windows/achievements,https://www.trueachievements.com/a294282/who-ya-gonna-call-achievement,Who Ya Gonna Call?,Pick up a telephone card.,21 Sep 20,(15),24,1.62
https://www.trueachievements.com/game/Yakuza-0-Windows/achievements,https://www.trueachievements.com/a294289/a-wise-investment-achievement,A Wise Investment,Purchase ten or more abilities.,21 Sep 20,(15),23,1.58
https://www.trueachievements.com/game/Yakuza-0-Windows/achievements,https://www.trueachievements.com/a294291/whip-it-good-achievement,Whip It Good,Get five or more play bonuses fighting a single enemy.,20 Sep 20,(15),19,1.32
https://www.trueachievements.com/game/Yakuza-0-Windows/achievements,https://www.trueachievements.com/a294247/nostalgic-for-the-80s-achievement,Nostalgic for the 80s,Visit Kamurocho in December 1988.,20 Sep 20,(15),15,1.0
https://www.trueachievements.com/game/Crackdown-3/achievements,https://www.trueachievements.com/a267511/proof-of-life-achievement,Proof Of Life,Collect your first Agent DNA Orb.,20 Sep 20,(5),6,1.27
https://www.trueachievements.com/game/Crackdown-3/achievements,https://www.trueachievements.com/a267520/jailbreaker-achievement,Jailbreaker,Complete a Prisoner Hardpoint.,20 Sep 20,(5),5,1.13
https://www.trueachievements.com/game/Crackdown-3/achievements,https://www.trueachievements.com/a267497/riding-in-style-achievement,Riding In Style,Obtain the Agency Vehicle.,20 Sep 20,(10),12,1.29
https://www.trueachievements.com/game/Crackdown-3/achievements,https://www.trueachievements.com/a267509/just-getting-started-achievement,Just Getting Started,Advance any Skill to Level 2.,20 Sep 20,(5),5,1.16
https://www.trueachievements.com/game/Crackdown-3/achievements,https://www.trueachievements.com/a267476/permanent-pink-slip-achievement,Permanent Pink Slip,"Terminate Wilhelm Berg, TerraNova's Manpower boss.",20 Sep 20,(10),10,1.04
https://www.trueachievements.com/game/Crackdown-3/achievements,https://www.trueachievements.com/a267498/foot-in-the-door-achievement,Foot In The Door,Unlock your first Supply Point.,20 Sep 20,(5),5,1.01
https://www.trueachievements.com/game/Crackdown-3/achievements,https://www.trueachievements.com/a267479/agentsfightback-achievement,#AgentsFightBack,Clear out your first enemy asset.,20 Sep 20,(5),5,1.0
https://www.trueachievements.com/game/Phantasy-Star-Online-2/achievements,https://www.trueachievements.com/a294391/turned-into-an-archer-wielding-flames-achievement,Turned Into an Archer Wielding Flames,Rangers are awesome! Heh heh! Let's make pincushions out of every last little enemy!,03 Jun 20,(35),104,2.98
https://www.trueachievements.com/game/Phantasy-Star-Online-2/achievements,https://www.trueachievements.com/a294396/shining-intense-and-brilliant-achievement,"Shining, intense, and brilliant!","Did you watch me on stage!? ...Huh, you couldn't really see me because of my invisibility power?",02 Jun 20,(35),113,3.24
https://www.trueachievements.com/game/Phantasy-Star-Online-2/achievements,https://www.trueachievements.com/a294398/chrome-dragon-the-ravening-tyrant-achievement,"Chrome Dragon, the Ravening Tyrant","There are no assailants to be found. For here, there are only victims.",02 Jun 20,(35),70,2.01
https://www.trueachievements.com/game/Phantasy-Star-Online-2/achievements,https://www.trueachievements.com/a294387/fang-banser-assassin-of-the-secret-forest-achievement,"Fang Banser, Assassin of the Secret Forest","""King of Beasts"" refers to those who would first sic others on the enemy before themselves.",31 May 20,(35),77,2.2
https://www.trueachievements.com/game/Phantasy-Star-Online-2/achievements,https://www.trueachievements.com/a294399/thats-amazingly-bad-luck-youve-got-there-achievement,That's Amazingly Bad Luck You've Got There,"Think about it this way: At least this means you have meseta to burn, right?",31 May 20,(50),100,2.0
https://www.trueachievements.com/game/Phantasy-Star-Online-2/achievements,https://www.trueachievements.com/a294397/falz-hyunal-the-jet-black-beacon-achievement,"Falz Hyunal, the Jet Black Beacon","If one who fights humans take a human form, isn't it because human forms are the strongest to take?",31 May 20,(50),119,2.38
https://www.trueachievements.com/game/Phantasy-Star-Online-2/achievements,https://www.trueachievements.com/a294389/dark-ragne-predator-of-the-abyss-achievement,"Dark Ragne, Predator of the Abyss","As far as this immensely spacious universe, are they pests, or are they beneficial insects?",31 May 20,(35),52,1.49
https://www.trueachievements.com/game/Phantasy-Star-Online-2/achievements,https://www.trueachievements.com/a294386/quartz-dragon-ruler-of-the-wild-blue-skies-achievement,"Quartz Dragon, Ruler of the Wild Blue Skies","In its insolence, it personally killed our noble dragons!",30 May 20,(35),62,1.78
https://www.trueachievements.com/game/Phantasy-Star-Online-2/achievements,https://www.trueachievements.com/a294388/the-superdreadnought-big-varder-achievement,"The Superdreadnought, Big Varder","As always, big launchers on big warships are the stuff of dreams! Although no idea who made it...",30 May 20,(35),60,1.72
https://www.trueachievements.com/game/Phantasy-Star-Online-2/achievements,https://www.trueachievements.com/a294381/thank-you-please-come-again-achievement,"Thank You, Please Come Again!","The will to never retreat, a spirit that never wavers, and an unbreakable asset.",30 May 20,(35),59,1.68
https://www.trueachievements.com/game/Phantasy-Star-Online-2/achievements,https://www.trueachievements.com/a294404/gigur-gunnegam-the-demon-of-the-frozen-ice-achievement,"Gigur Gunnegam, the Demon of the Frozen Ice","If a divine punishment awaits him, then let him have it!",30 May 20,(35),64,1.83
https://www.trueachievements.com/game/Phantasy-Star-Online-2/achievements,https://www.trueachievements.com/a294382/you-made-the-difference-achievement,You Made the Difference!,Release the power that you kindled!,30 May 20,(35),67,1.93
https://www.trueachievements.com/game/Phantasy-Star-Online-2/achievements,https://www.trueachievements.com/a294401/bar-lodos-conqueror-of-the-raging-currents-achievement,"Bar Lodos, Conqueror of the Raging Currents",Placid seas can hardly forge experienced sailors. Every crisis is an opportunity!,29 May 20,(35),59,1.69
https://www.trueachievements.com/game/Phantasy-Star-Online-2/achievements,https://www.trueachievements.com/a294385/vol-dragon-the-supreme-ruler-of-purgatory-achievement,"Vol Dragon, the Supreme Ruler of Purgatory",May it perish in the fires of the volcano it was dunked in!,29 May 20,(35),46,1.31
https://www.trueachievements.com/game/Phantasy-Star-Online-2/achievements,https://www.trueachievements.com/a294403/found-the-lillipan-achievement,Found the Lillipan!,"""Lin... (they found me)!""",29 May 20,(50),112,2.25
https://www.trueachievements.com/game/Phantasy-Star-Online-2/achievements,https://www.trueachievements.com/a294379/on-an-endless-adventure-once-again-achievement,"On an Endless Adventure, Once Again!",Our adventure is just beginning! We're counting on you for the next quest!,29 May 20,(35),44,1.26
https://www.trueachievements.com/game/Phantasy-Star-Online-2/achievements,https://www.trueachievements.com/a294380/pse-burst-achievement,PSE BURST!,The rising pillar of light is a sign of benediction! Now the real battle begins!,28 May 20,(35),49,1.42
https://www.trueachievements.com/game/Munchkin-Quacked-Quest/achievements,https://www.trueachievements.com/a286717/oh-shiny-achievement,"Oh, shiny!",Unlock your first card,28 Nov 19,(20),24,1.24
https://www.trueachievements.com/game/Munchkin-Quacked-Quest/achievements,https://www.trueachievements.com/a286729/now-you-get-it-achievement,Now you get it!,Win your first game,28 Nov 19,(20),26,1.33
https://www.trueachievements.com/game/Munchkin-Quacked-Quest/achievements,https://www.trueachievements.com/a286715/slowmotion-bullet-dodger-achievement,Slow-motion bullet dodger,Finish a room without taking any damage,28 Nov 19,(30),47,1.59
https://www.trueachievements.com/game/Munchkin-Quacked-Quest/achievements,https://www.trueachievements.com/a286716/last-munchkin-standing-achievement,Last Munchkin Standing,Be the only one alive in a room,28 Nov 19,(20),21,1.05
https://www.trueachievements.com/game/Munchkin-Quacked-Quest/achievements,https://www.trueachievements.com/a286709/thats-mine-achievement,That's mine!,Tackle 25 fellow Munchkins,28 Nov 19,(20),31,1.58
https://www.trueachievements.com/game/Munchkin-Quacked-Quest/achievements,https://www.trueachievements.com/a286719/true-munchkin-achievement,True Munchkin,Equip every loot slot during a single Dungeon run,28 Nov 19,(20),22,1.1
https://www.trueachievements.com/game/Munchkin-Quacked-Quest/achievements,https://www.trueachievements.com/a286712/wheres-the-fun-in-that-achievement,Where's the fun in that!,Finish a trap layout without taking any damage from traps,28 Nov 19,(30),55,1.86
https://www.trueachievements.com/game/RAGE-2-Windows/achievements,https://www.trueachievements.com/a288123/the-enemy-of-my-enemy-achievement,The Enemy Of My Enemy,Kill an enemy that is trying to kill an enemy,16 Nov 19,(30),35,1.16
https://www.trueachievements.com/game/RAGE-2-Windows/achievements,https://www.trueachievements.com/a288131/the-ranger-achievement,The Ranger,Complete mission: The Ranger,16 Nov 19,(10),10,1.05
https://www.trueachievements.com/game/RAGE-2-Windows/achievements,https://www.trueachievements.com/a288110/unloaded-achievement,Unloaded,Shoot 70 bullets within 16 seconds using the Assault Rifle,16 Nov 19,(15),19,1.27
https://www.trueachievements.com/game/ReCore/achievements,https://www.trueachievements.com/a221924/workbench-apprentice-achievement,Workbench Apprentice,Crafted a Part,14 Nov 19,(30),32,1.08
https://www.trueachievements.com/game/ReCore/achievements,https://www.trueachievements.com/a221925/end-of-the-beginning-achievement,End of the Beginning,Completed the Granite Steps,14 Nov 19,(30),31,1.05
https://www.trueachievements.com/game/ReCore/achievements,https://www.trueachievements.com/a221926/ding-achievement,Ding!,Leveled Up a Corebot,14 Nov 19,(10),10,1.0
https://www.trueachievements.com/game/ReCore/achievements,https://www.trueachievements.com/a221928/rapid-removal-achievement,Rapid Removal,Performed an instant extract,14 Nov 19,(30),30,1.02
https://www.trueachievements.com/game/ReCore/achievements,https://www.trueachievements.com/a221927/yoink-achievement,Yoink!,Extracted a Core from an enemy,14 Nov 19,(10),10,1.01
https://www.trueachievements.com/game/ReCore/achievements,https://www.trueachievements.com/a221947/juggler-achievement,Juggler,Achieved a Combo of 20,14 Nov 19,(10),12,1.23
https://www.trueachievements.com/game/Dead-Rising-4-Windows/achievements,https://www.trueachievements.com/a227085/zombie-destruction-achievement,Zombie Destruction,"Kill 5,000 zombies",07 Nov 19,(10),18,1.86
https://www.trueachievements.com/game/Dead-Rising-4-Windows/achievements,https://www.trueachievements.com/a227062/idol-worship-achievement,Idol Worship,Find the Frank West Statue. Didn't there used to be more of these?,07 Nov 19,(30),142,4.76
https://www.trueachievements.com/game/Dead-Rising-4-Windows/achievements,https://www.trueachievements.com/a227047/invasion-on-main-street-achievement,Invasion on Main Street,Completed Case 2 of the Story,07 Nov 19,(20),36,1.83
https://www.trueachievements.com/game/Dead-Rising-4-Windows/achievements,https://www.trueachievements.com/a227056/ccccombo-achievement,C-C-C-Combo!!,Get a Hit Streak over 200 then use a Skill Move,07 Nov 19,(10),13,1.39
https://www.trueachievements.com/game/Dead-Rising-4-Windows/achievements,https://www.trueachievements.com/a227055/building-a-new-you-achievement,Building a New You,Spend 25 total Skill Points,07 Nov 19,(10),17,1.72
https://www.trueachievements.com/game/Dead-Rising-4-Windows/achievements,https://www.trueachievements.com/a227043/door-crasher-special-achievement,Door Crasher Special,Completed Case 1 of the Story,07 Nov 19,(15),22,1.47
https://www.trueachievements.com/game/Dead-Rising-4-Windows/achievements,https://www.trueachievements.com/a227058/fashionista-achievement,Fashionista,Try on 100 different clothing items,07 Nov 19,(20),48,2.44
