achievement_game_url,achievement_url,achievement_name,achievement_desc,achievement_earned,achievement_score,ta_score,ta_ratio
https://www.trueachievements.com/game/Saints-Row-The-Third/achievements,https://www.trueachievements.com/a156951/porkchop-sandwiches-achievement,Porkchop Sandwiches,Completed all instances of Trail Blazing.,Offline,(20),,"Porkchop Sandwiches
Completed all instances of Trail Blazing."
https://www.trueachievements.com/game/Saints-Row-The-Third/achievements,https://www.trueachievements.com/a156959/shake-and-bake-achievement,Shake and Bake,"Completed your first Challenge, it was a Challenge, right?",Offline,(10),,"Shake and Bake
Completed your first Challenge, it was a Challenge, right?"
https://www.trueachievements.com/game/Saints-Row-The-Third/achievements,https://www.trueachievements.com/a156953/tank-you-very-much-achievement,Tank You Very Much,Completed all instances of Tank Mayhem.,Offline,(20),,"Tank You Very Much
Completed all instances of Tank Mayhem."
https://www.trueachievements.com/game/Saints-Row-The-Third/achievements,https://www.trueachievements.com/a156927/the-welcome-wagon-achievement,The Welcome Wagon,"Completed 'I'm Free - Free Falling', landed safely in Steelport with a 9.0 from the Belgians.",Offline,(15),,"The Welcome Wagon
Completed 'I'm Free - Free Falling', landed safely in Steelport with a 9.0 from the Belgians."
https://www.trueachievements.com/game/Saints-Row-The-Third/achievements,https://www.trueachievements.com/a156935/titanic-effort-achievement,Titanic Effort,"Completed Act 2 and destroyed the Thermopylae, but fight is not over yet.",Offline,(40),,"Titanic Effort
Completed Act 2 and destroyed the Thermopylae, but fight is not over yet."
https://www.trueachievements.com/game/Saints-Row-The-Third/achievements,https://www.trueachievements.com/a156938/too-close-to-the-son-achievement,Too Close to the Son,"Completed Act 3 in one way, Cyrus Temple is a dead man.",Offline,(30),,"Too Close to the Son
Completed Act 3 in one way, Cyrus Temple is a dead man."
https://www.trueachievements.com/game/Saints-Row-The-Third/achievements,https://www.trueachievements.com/a156930/tower-defense-achievement,Tower Defense,"Completed Act 1, killed Phillipe Loren, and kept the Tower.",Offline,(20),,"Tower Defense
Completed Act 1, killed Phillipe Loren, and kept the Tower."
https://www.trueachievements.com/game/Saints-Row-The-Third/achievements,https://www.trueachievements.com/a156946/tune-in-drop-off-achievement,"Tune In, Drop Off",Completed all instances of Trafficking.,Offline,(20),,"Tune In, Drop Off
Completed all instances of Trafficking."
https://www.trueachievements.com/game/Saints-Row-The-Third/achievements,https://www.trueachievements.com/a156929/were-takin-over-achievement,We're Takin' Over,Completed all of Pierce's City Takeover Introduction missions.,Offline,(20),,"We're Takin' Over
Completed all of Pierce's City Takeover Introduction missions."
https://www.trueachievements.com/game/Saints-Row-The-Third/achievements,https://www.trueachievements.com/a156949/your-backseat-smells-funny-achievement,Your Backseat Smells Funny,Completed all instances of Escort.,Offline,(20),,"Your Backseat Smells Funny
Completed all instances of Escort."
https://www.trueachievements.com/game/Saints-Row-The-Third/achievements,https://www.trueachievements.com/a156943/youre-the-best-achievement,You're the Best...,Took control of the entire Carver Island district for the Saints.,Offline,(25),,"You're the Best...
Took control of the entire Carver Island district for the Saints."
https://www.trueachievements.com/game/Catherine/achievements,https://www.trueachievements.com/a153173/bomberlamb-achievement,Bomberlamb,Hit 15 blocks with a single explosion. (Golden Playhouse),Offline,(20),,"Bomberlamb
Hit 15 blocks with a single explosion. (Golden Playhouse)"
https://www.trueachievements.com/game/Catherine/achievements,https://www.trueachievements.com/a153149/crossing-the-courtyard-achievement,Crossing the Courtyard,Conquer Stage 5.,Offline,(15),,"Crossing the Courtyard
Conquer Stage 5."
https://www.trueachievements.com/game/Catherine/achievements,https://www.trueachievements.com/a153174/i-can-fly-achievement,I Can Fly!,Jump on a Spring Block 3 times in a row. (Golden Playhouse),Offline,(30),,"I Can Fly!
Jump on a Spring Block 3 times in a row. (Golden Playhouse)"
https://www.trueachievements.com/game/Catherine/achievements,https://www.trueachievements.com/a153147/let-my-sheep-go-achievement,Let My Sheep Go,Conquer Stage 3.,Offline,(10),,"Let My Sheep Go
Conquer Stage 3."
https://www.trueachievements.com/game/Catherine/achievements,https://www.trueachievements.com/a153152/making-legends-achievement,Making Legends,Conquer Stage 8.,Offline,(20),,"Making Legends
Conquer Stage 8."
https://www.trueachievements.com/game/Catherine/achievements,https://www.trueachievements.com/a153148/no-one-expects-the-achievement,No One Expects the...,Conquer Stage 4.,Offline,(10),,"No One Expects the...
Conquer Stage 4."
https://www.trueachievements.com/game/Catherine/achievements,https://www.trueachievements.com/a153151/path-to-the-altar-achievement,Path to the Altar,Conquer Stage 7.,Offline,(20),,"Path to the Altar
Conquer Stage 7."
https://www.trueachievements.com/game/Catherine/achievements,https://www.trueachievements.com/a153169/play-it-again-vince-achievement,"Play It Again, Vince...",Use the jukebox to change the music.,Offline,(5),,"Play It Again, Vince...
Use the jukebox to change the music."
https://www.trueachievements.com/game/Catherine/achievements,https://www.trueachievements.com/a153146/push-it-to-the-limit-achievement,Push It to the Limit!,Push 5 blocks at once. (Golden Playhouse),Offline,(10),,"Push It to the Limit!
Push 5 blocks at once. (Golden Playhouse)"
https://www.trueachievements.com/game/Catherine/achievements,https://www.trueachievements.com/a153143/the-great-escape-achievement,The Great Escape,Conquer Stage 2.,Offline,(5),,"The Great Escape
Conquer Stage 2."
https://www.trueachievements.com/game/Catherine/achievements,https://www.trueachievements.com/a153145/the-nightmares-have-just-begun-achievement,The Nightmares Have Just Begun.,Conquer Stage 1.,Offline,(5),,"The Nightmares Have Just Begun.
Conquer Stage 1."
https://www.trueachievements.com/game/Catherine/achievements,https://www.trueachievements.com/a153150/what-time-is-it-achievement,What Time is It?,Conquer Stage 6.,Offline,(15),,"What Time is It?
Conquer Stage 6."
https://www.trueachievements.com/game/Catherine/achievements,https://www.trueachievements.com/a153180/you-dont-have-to-go-home-achievement,You Don't Have To Go Home...,Stay in the bar until all the other customers leave.,Offline,(5),,"You Don't Have To Go Home...
Stay in the bar until all the other customers leave."
https://www.trueachievements.com/game/Rock-Band-3/achievements,https://www.trueachievements.com/a67389/best-name-ever-achievement,Best. Name. Ever.,Renamed your band.,Offline,(5),,"Best. Name. Ever.
Renamed your band."
https://www.trueachievements.com/game/Rock-Band-3/achievements,https://www.trueachievements.com/a67387/downloader-achievement,Downloader,Played a downloaded song.,Offline,(20),,"Downloader
Played a downloaded song."
https://www.trueachievements.com/game/Rock-Band-3/achievements,https://www.trueachievements.com/a67409/guitar-apprentice-achievement,Guitar Apprentice,5 Starred on Easy Guitar (or 3 Starred on a higher difficulty) 25 Rock Band 3 songs.,Offline,(20),,"Guitar Apprentice
5 Starred on Easy Guitar (or 3 Starred on a higher difficulty) 25 Rock Band 3 songs."
https://www.trueachievements.com/game/Rock-Band-3/achievements,https://www.trueachievements.com/a67386/guitar-perfectionist-achievement,Guitar Perfectionist,Got 100% accuracy on Expert Guitar.,Offline,(25),,"Guitar Perfectionist
Got 100% accuracy on Expert Guitar."
https://www.trueachievements.com/game/Rock-Band-3/achievements,https://www.trueachievements.com/a67400/hell-defrosted-achievement,Hell Defrosted,"Won all rewards on the ""Hell Freezes Over"" Road Challenge.",Offline,(25),,"Hell Defrosted
Won all rewards on the ""Hell Freezes Over"" Road Challenge."
https://www.trueachievements.com/game/Rock-Band-3/achievements,https://www.trueachievements.com/a67398/hometown-threwdown-achievement,Hometown Threwdown,"Completed the ""Hometown Throwdown"" Road Challenge.",Offline,(20),,"Hometown Threwdown
Completed the ""Hometown Throwdown"" Road Challenge."
https://www.trueachievements.com/game/Rock-Band-3/achievements,https://www.trueachievements.com/a67403/party-animal-achievement,Party Animal,"Completed the ""Total Debauchery"" Road Challenge.",Offline,(20),,"Party Animal
Completed the ""Total Debauchery"" Road Challenge."
https://www.trueachievements.com/game/Rock-Band-3/achievements,https://www.trueachievements.com/a67426/pro-keyboardist-achievement,Pro Keyboardist,Hit at least 90% of the notes in 3 songs on Expert Pro Keys.,Offline,(15),,"Pro Keyboardist
Hit at least 90% of the notes in 3 songs on Expert Pro Keys."
https://www.trueachievements.com/game/Rock-Band-3/achievements,https://www.trueachievements.com/a67428/pro-keys-to-the-max-achievement,Pro Keys to the Max,Max out your Score Multiplier meter on Pro Keys.,Offline,(15),,"Pro Keys to the Max
Max out your Score Multiplier meter on Pro Keys."
https://www.trueachievements.com/game/Rock-Band-3/achievements,https://www.trueachievements.com/a67399/real-noreaster-achievement,Real Nor'easter,"Completed ""The Wicked Awesome Tour"".",Offline,(20),,"Real Nor'easter
Completed ""The Wicked Awesome Tour""."
https://www.trueachievements.com/game/Rock-Band-3/achievements,https://www.trueachievements.com/a67391/selfmade-dude-or-lady-achievement,Self-Made Dude or Lady,Created a Character.,Offline,(5),,"Self-Made Dude or Lady
Created a Character."
https://www.trueachievements.com/game/Rock-Band-3/achievements,https://www.trueachievements.com/a67390/tune-up-achievement,Tune Up,Calibrated your audio/video setup for the optimal Rock Band 3 experience.,Offline,(4),,"Tune Up
Calibrated your audio/video setup for the optimal Rock Band 3 experience."
https://www.trueachievements.com/game/Rock-Band-3/achievements,https://www.trueachievements.com/a67401/wilderness-survival-achievement,Wilderness Survival,"Complete the ""Through the Wilderness, Eh?"" Road Challenge.",Offline,(20),,"Wilderness Survival
Complete the ""Through the Wilderness, Eh?"" Road Challenge."
https://www.trueachievements.com/game/NBA-2K14-Xbox-360/achievements,https://www.trueachievements.com/a179797/dubdub-achievement,Dub-Dub,Record two double doubles with any teammates in the same non-simulated game.,Offline,(20),,"Dub-Dub
Record two double doubles with any teammates in the same non-simulated game."
https://www.trueachievements.com/game/NBA-2K14-Xbox-360/achievements,https://www.trueachievements.com/a179802/giveth-and-taketh-away-achievement,Giveth and Taketh Away,Record 10 or more rebounds and assists with any player in a non-simulated game.,Offline,(20),,"Giveth and Taketh Away
Record 10 or more rebounds and assists with any player in a non-simulated game."
https://www.trueachievements.com/game/NBA-2K14-Xbox-360/achievements,https://www.trueachievements.com/a179815/greatness-achieved-achievement,Greatness Achieved,Complete LeBron: Path to Greatness.,Offline,(20),,"Greatness Achieved
Complete LeBron: Path to Greatness."
https://www.trueachievements.com/game/NBA-2K14-Xbox-360/achievements,https://www.trueachievements.com/a179803/hold-the-fat-lady-achievement,Hold the Fat Lady,Start the 4th period losing by 10 or more points and win with any team in a non-simulated game.,Offline,(20),,"Hold the Fat Lady
Start the 4th period losing by 10 or more points and win with any team in a non-simulated game."
https://www.trueachievements.com/game/NBA-2K14-Xbox-360/achievements,https://www.trueachievements.com/a179799/its-raining-achievement,It's Raining,Make 15 or more 3-pointers with any team in a non-simulated game.,Offline,(20),,"It's Raining
Make 15 or more 3-pointers with any team in a non-simulated game."
https://www.trueachievements.com/game/NBA-2K14-Xbox-360/achievements,https://www.trueachievements.com/a179800/men-of-steal-achievement,Men of Steal,Record 10 or more steals with any team in a non-simulated game.,Offline,(20),,"Men of Steal
Record 10 or more steals with any team in a non-simulated game."
https://www.trueachievements.com/game/NBA-2K14-Xbox-360/achievements,https://www.trueachievements.com/a179778/smothering-achievement,Smothering,Hold the opposing team's FG% below 40% with any team in a non-simulated game.,Offline,(20),,"Smothering
Hold the opposing team's FG% below 40% with any team in a non-simulated game."
https://www.trueachievements.com/game/NBA-2K14-Xbox-360/achievements,https://www.trueachievements.com/a179805/the-closer-achievement,The Closer,Hold the opposing team to zero points in the final two minutes of a non-simulated game.,Offline,(20),,"The Closer
Hold the opposing team to zero points in the final two minutes of a non-simulated game."
https://www.trueachievements.com/game/NBA-2K14-Xbox-360/achievements,https://www.trueachievements.com/a179796/tripdub-achievement,Trip-Dub,Record a triple double with any player in a non-simulated game.,Offline,(20),,"Trip-Dub
Record a triple double with any player in a non-simulated game."
https://www.trueachievements.com/game/NBA-2K14-Xbox-360/achievements,https://www.trueachievements.com/a179804/wire-to-wire-achievement,Wire to Wire,Do not allow your opponent to lead the game at any point with any team in a non-simulated game.,Offline,(20),,"Wire to Wire
Do not allow your opponent to lead the game at any point with any team in a non-simulated game."
https://www.trueachievements.com/game/NBA-2K12/achievements,https://www.trueachievements.com/a155389/men-of-steal-achievement,Men of Steal,"Record 10 or more steals with any team, in a non-simulated game.",Offline,(20),,"Men of Steal
Record 10 or more steals with any team, in a non-simulated game."
https://www.trueachievements.com/game/NBA-2K12/achievements,https://www.trueachievements.com/a155377/my-player-of-the-game-achievement,My Player of the Game,Be named Player of the Game (in an NBA game) in My Player mode.,Offline,(20),,"My Player of the Game
Be named Player of the Game (in an NBA game) in My Player mode."
https://www.trueachievements.com/game/NBA-2K12/achievements,https://www.trueachievements.com/a155391/smothering-achievement,Smothering,"Hold the opposing team's FG% below 40% with any team, in a non-simulated game.",Offline,(20),,"Smothering
Hold the opposing team's FG% below 40% with any team, in a non-simulated game."
https://www.trueachievements.com/game/NBA-2K12/achievements,https://www.trueachievements.com/a155390/swat-and-swipe-achievement,Swat and Swipe,"Record at least 5 blocks and 5 steals with any team, in a non-simulated game.",Offline,(20),,"Swat and Swipe
Record at least 5 blocks and 5 steals with any team, in a non-simulated game."
https://www.trueachievements.com/game/NBA-2K12/achievements,https://www.trueachievements.com/a155388/block-party-achievement,Block Party,"Record 10 or more blocks with any team, in a non-simulated game.",Offline,(20),,"Block Party
Record 10 or more blocks with any team, in a non-simulated game."
https://www.trueachievements.com/game/NBA-2K12/achievements,https://www.trueachievements.com/a155380/my-big-eighto-achievement,My Big Eight-O,Earn an 80 overall rating in My Player mode.,Offline,(20),,"My Big Eight-O
Earn an 80 overall rating in My Player mode."
https://www.trueachievements.com/game/NBA-2K12/achievements,https://www.trueachievements.com/a155378/my-every-day-player-achievement,My Every Day Player,Become a starter in the NBA in My Player Mode.,Offline,(20),,"My Every Day Player
Become a starter in the NBA in My Player Mode."
https://www.trueachievements.com/game/NBA-2K12/achievements,https://www.trueachievements.com/a155394/wire-to-wire-achievement,Wire to Wire,"Do not allow your opponent to lead the game at any point with any team, in a non-simulated game.",Offline,(20),,"Wire to Wire
Do not allow your opponent to lead the game at any point with any team, in a non-simulated game."
https://www.trueachievements.com/game/Grand-Theft-Auto-V-Xbox-360/achievements,https://www.trueachievements.com/a179384/a-fair-days-pay-achievement,A Fair Day's Pay,It's time for a little getaway.,Offline,(10),,"A Fair Day's Pay
It's time for a little getaway."
https://www.trueachievements.com/game/Grand-Theft-Auto-V-Xbox-360/achievements,https://www.trueachievements.com/a179383/a-friendship-resurrected-achievement,A Friendship Resurrected,With friends like this who needs enemies?,Offline,(10),,"A Friendship Resurrected
With friends like this who needs enemies?"
https://www.trueachievements.com/game/Grand-Theft-Auto-V-Xbox-360/achievements,https://www.trueachievements.com/a179407/altruist-acolyte-achievement,Altruist Acolyte,You delivered an unsuspecting victim to the Altruist Cult.,Offline,(5),,"Altruist Acolyte
You delivered an unsuspecting victim to the Altruist Cult."
https://www.trueachievements.com/game/Grand-Theft-Auto-V-Xbox-360/achievements,https://www.trueachievements.com/a179389/blitzed-achievement,Blitzed,You performed a classic blitz play.,Offline,(20),,"Blitzed
You performed a classic blitz play."
https://www.trueachievements.com/game/Grand-Theft-Auto-V-Xbox-360/achievements,https://www.trueachievements.com/a179387/diamond-hard-achievement,Diamond Hard,You cleaned out Vangelico to pay back Martin Madrazo.,Offline,(20),,"Diamond Hard
You cleaned out Vangelico to pay back Martin Madrazo."
https://www.trueachievements.com/game/Grand-Theft-Auto-V-Xbox-360/achievements,https://www.trueachievements.com/a179406/out-of-your-depth-achievement,Out of Your Depth,You needed a bigger boat... or ANY boat!,Offline,(5),,"Out of Your Depth
You needed a bigger boat... or ANY boat!"
https://www.trueachievements.com/game/Grand-Theft-Auto-V-Xbox-360/achievements,https://www.trueachievements.com/a179410/pimp-my-sidearm-achievement,Pimp My Sidearm,You fully modded a weapon.,Offline,(10),,"Pimp My Sidearm
You fully modded a weapon."
https://www.trueachievements.com/game/Grand-Theft-Auto-V-Xbox-360/achievements,https://www.trueachievements.com/a179390/small-town-big-job-achievement,"Small Town, Big Job",You made a big impression at the Paleto Bay Chicken Festival.,Offline,(20),,"Small Town, Big Job
You made a big impression at the Paleto Bay Chicken Festival."
https://www.trueachievements.com/game/Grand-Theft-Auto-V-Xbox-360/achievements,https://www.trueachievements.com/a179388/subversive-achievement,Subversive,You stole an experimental super weapon from Merryweather... and gave it back.,Offline,(20),,"Subversive
You stole an experimental super weapon from Merryweather... and gave it back."
https://www.trueachievements.com/game/Grand-Theft-Auto-V-Xbox-360/achievements,https://www.trueachievements.com/a179385/the-moment-of-truth-achievement,The Moment of Truth,You have uncovered the truth about Brad.,Offline,(10),,"The Moment of Truth
You have uncovered the truth about Brad."
https://www.trueachievements.com/game/Grand-Theft-Auto-V-Xbox-360/achievements,https://www.trueachievements.com/a179386/to-live-or-die-in-los-santos-achievement,To Live or Die in Los Santos,Completed the final mission.,Offline,(40),,"To Live or Die in Los Santos
Completed the final mission."
https://www.trueachievements.com/game/Grand-Theft-Auto-V-Xbox-360/achievements,https://www.trueachievements.com/a179409/trading-pure-alpha-achievement,Trading Pure Alpha,You made a profit over your total investments in the stock market.,Offline,(10),,"Trading Pure Alpha
You made a profit over your total investments in the stock market."
https://www.trueachievements.com/game/Madden-NFL-16-Xbox-360/achievements,https://www.trueachievements.com/a203256/peyton-manning-legacy-award-achievement,Peyton Manning Legacy Award,"Using a created player, coach, or owner - surpass a legacy score of 20,000.",Offline,(100),,"Peyton Manning Legacy Award
Using a created player, coach, or owner - surpass a legacy score of 20,000."
https://www.trueachievements.com/game/Madden-NFL-16-Xbox-360/achievements,https://www.trueachievements.com/a203255/walter-payton-legacy-award-achievement,Walter Payton Legacy Award,"Using a created player, coach, or owner - surpass a legacy score of 15,450.",17 Jan 16,(50),,"Walter Payton Legacy Award
Using a created player, coach, or owner - surpass a legacy score of 15,450."
https://www.trueachievements.com/game/Madden-NFL-16-Xbox-360/achievements,https://www.trueachievements.com/a203254/darrelle-revis-legacy-award-achievement,Darrelle Revis Legacy Award,"Using a created player, coach, or owner - surpass a legacy score of 9,500.",27 Dec 15,(30),,"Darrelle Revis Legacy Award
Using a created player, coach, or owner - surpass a legacy score of 9,500."
https://www.trueachievements.com/game/Madden-NFL-16-Xbox-360/achievements,https://www.trueachievements.com/a203253/marshawn-lynch-legacy-award-achievement,Marshawn Lynch Legacy Award,"Using a created player, coach, or owner - surpass a legacy score of 6,500.",14 Nov 15,(25),,"Marshawn Lynch Legacy Award
Using a created player, coach, or owner - surpass a legacy score of 6,500."
https://www.trueachievements.com/game/Madden-NFL-16-Xbox-360/achievements,https://www.trueachievements.com/a203252/ndamukong-suh-legacy-award-achievement,Ndamukong Suh Legacy Award,"Using a created player, coach, or owner - surpass a legacy score of 3,600.",09 Nov 15,(10),,"Ndamukong Suh Legacy Award
Using a created player, coach, or owner - surpass a legacy score of 3,600."
https://www.trueachievements.com/game/Madden-NFL-16-Xbox-360/achievements,https://www.trueachievements.com/a203232/college-influence-achievement,College Influence,"Score a TD on an option play (no SuperSim, Skill Trainer, Practice, or Co-Op).",08 Nov 15,(25),,"College Influence
Score a TD on an option play (no SuperSim, Skill Trainer, Practice, or Co-Op)."
https://www.trueachievements.com/game/The-Evil-Within-Xbox-360/achievements,https://www.trueachievements.com/a190618/first-step-into-darkness-achievement,First Step into Darkness,Completed the game on Casual difficulty.,01 Nov 15,(30),,"First Step into Darkness
Completed the game on Casual difficulty."
https://www.trueachievements.com/game/The-Evil-Within-Xbox-360/achievements,https://www.trueachievements.com/a190617/one-of-the-many-achievement,One of the Many,Defeated the ultimate evil within.,01 Nov 15,(45),,"One of the Many
Defeated the ultimate evil within."
https://www.trueachievements.com/game/The-Evil-Within-Xbox-360/achievements,https://www.trueachievements.com/a190634/one-man-army-achievement,One Man Army,Killed 400 enemies.,01 Nov 15,(35),,"One Man Army
Killed 400 enemies."
https://www.trueachievements.com/game/The-Evil-Within-Xbox-360/achievements,https://www.trueachievements.com/a190650/entry-level-electrician-achievement,Entry Level Electrician,Powered up all electrical equipment simultaneously in the subway in Chapter 14.,01 Nov 15,(15),,"Entry Level Electrician
Powered up all electrical equipment simultaneously in the subway in Chapter 14."
https://www.trueachievements.com/game/The-Evil-Within-Xbox-360/achievements,https://www.trueachievements.com/a190616/slither-into-oblivion-achievement,Slither into Oblivion,Removed an invisible enemy from the equation.,01 Nov 15,(25),,"Slither into Oblivion
Removed an invisible enemy from the equation."
https://www.trueachievements.com/game/The-Evil-Within-Xbox-360/achievements,https://www.trueachievements.com/a190624/my-best-friend-achievement,My Best Friend,Completely upgraded one weapon.,01 Nov 15,(10),,"My Best Friend
Completely upgraded one weapon."
https://www.trueachievements.com/game/The-Evil-Within-Xbox-360/achievements,https://www.trueachievements.com/a190615/arachnophobia-achievement,Arachnophobia,Outran a gigantic threat in the city.,31 Oct 15,(15),,"Arachnophobia
Outran a gigantic threat in the city."
https://www.trueachievements.com/game/The-Evil-Within-Xbox-360/achievements,https://www.trueachievements.com/a190614/the-first-not-the-last-achievement,"The First, Not the Last",Ended a monstrosity in the underground garage.,31 Oct 15,(40),,"The First, Not the Last
Ended a monstrosity in the underground garage."
https://www.trueachievements.com/game/The-Evil-Within-Xbox-360/achievements,https://www.trueachievements.com/a190633/krimson-pd-fury-achievement,Krimson PD Fury,Killed 200 enemies.,31 Oct 15,(20),,"Krimson PD Fury
Killed 200 enemies."
https://www.trueachievements.com/game/The-Evil-Within-Xbox-360/achievements,https://www.trueachievements.com/a190631/burn-baby-burn-achievement,"Burn, Baby, Burn!",Killed 5 enemies with a torch.,31 Oct 15,(10),,"Burn, Baby, Burn!
Killed 5 enemies with a torch."
https://www.trueachievements.com/game/Madden-NFL-16-Xbox-360/achievements,https://www.trueachievements.com/a203243/accomplished-achievement,Accomplished,Complete a MUT set.,26 Oct 15,(15),,"Accomplished
Complete a MUT set."
https://www.trueachievements.com/game/The-Evil-Within-Xbox-360/achievements,https://www.trueachievements.com/a190613/whats-in-the-box-achievement,What's In The Box?!,Escaped the Keeper beneath the catacombs.,21 Oct 15,(20),,"What's In The Box?!
Escaped the Keeper beneath the catacombs."
https://www.trueachievements.com/game/The-Evil-Within-Xbox-360/achievements,https://www.trueachievements.com/a190612/two-on-two-achievement,Two on Two,Took out both guardians before the church.,14 Oct 15,(25),,"Two on Two
Took out both guardians before the church."
https://www.trueachievements.com/game/The-Evil-Within-Xbox-360/achievements,https://www.trueachievements.com/a190611/old-flame-achievement,Old Flame,Finished off a shrieking beast.,10 Oct 15,(20),,"Old Flame
Finished off a shrieking beast."
