achievement_game_url,achievement_url,achievement_name,achievement_desc,achievement_earned,achievement_score,ta_score,ta_ratio
https://www.trueachievements.com/game/WWE-2K14/achievements,https://www.trueachievements.com/a180787/epic-match-achievement,Epic Match,Defeat the Streak - Kick out of a Pin from Undertaker 5 times in a single match.,03 Apr 14,(50),,"Epic Match
Defeat the Streak - Kick out of a Pin from Undertaker 5 times in a single match."
https://www.trueachievements.com/game/WWE-2K14/achievements,https://www.trueachievements.com/a180797/the-universe-era-achievement,The Universe Era,Complete chapter 5 in 30 Years of WrestleMania.,28 Mar 14,(15),,"The Universe Era
Complete chapter 5 in 30 Years of WrestleMania."
https://www.trueachievements.com/game/WWE-2K14/achievements,https://www.trueachievements.com/a180798/wrestlemania-achievement,WrestleMania!,Complete all historical objectives in 30 Years of WrestleMania.,28 Mar 14,(30),,"WrestleMania!
Complete all historical objectives in 30 Years of WrestleMania."
https://www.trueachievements.com/game/WWE-2K14/achievements,https://www.trueachievements.com/a180796/ruthless-aggression-achievement,Ruthless Aggression,Complete chapter 4 in 30 Years of WrestleMania.,27 Mar 14,(15),,"Ruthless Aggression
Complete chapter 4 in 30 Years of WrestleMania."
https://www.trueachievements.com/game/WWE-2K14/achievements,https://www.trueachievements.com/a180795/the-attitude-era-achievement,The Attitude Era,Complete chapter 3 in 30 Years of WrestleMania.,27 Mar 14,(15),,"The Attitude Era
Complete chapter 3 in 30 Years of WrestleMania."
https://www.trueachievements.com/game/WWE-2K14/achievements,https://www.trueachievements.com/a180802/final-impact-achievement,Final impact,30 Years of WM - WM 17 - The Rock vs. Stone Cold - Hit a critically damaged Rock with a chair.,27 Mar 14,(15),,"Final impact
30 Years of WM - WM 17 - The Rock vs. Stone Cold - Hit a critically damaged Rock with a chair."
https://www.trueachievements.com/game/WWE-2K14/achievements,https://www.trueachievements.com/a180794/a-new-generation-achievement,A New Generation,Complete chapter 2 in 30 Years of WrestleMania.,27 Mar 14,(15),,"A New Generation
Complete chapter 2 in 30 Years of WrestleMania."
https://www.trueachievements.com/game/WWE-2K14/achievements,https://www.trueachievements.com/a180801/but-he-still-didnt-give-up-achievement,But he still didn't give up!,30 Years of WM - Complete all of the Hidden Objectives in WM13.,27 Mar 14,(15),,"But he still didn't give up!
30 Years of WM - Complete all of the Hidden Objectives in WM13."
https://www.trueachievements.com/game/WWE-2K14/achievements,https://www.trueachievements.com/a180773/comeback-achievement,Comeback!,Successfully perform a Comeback Move (Single player).,27 Mar 14,(20),,"Comeback!
Successfully perform a Comeback Move (Single player)."
https://www.trueachievements.com/game/WWE-2K14/achievements,https://www.trueachievements.com/a180800/sudden-death-achievement,Sudden death,30 Years of WM - WM 12 - Bret Hart vs. HBK - Reach the time limit with no winner.,27 Mar 14,(15),,"Sudden death
30 Years of WM - WM 12 - Bret Hart vs. HBK - Reach the time limit with no winner."
https://www.trueachievements.com/game/WWE-2K14/achievements,https://www.trueachievements.com/a180793/hulkamania-runs-wild-achievement,Hulkamania Runs Wild,Complete chapter 1 in 30 Years of WrestleMania.,26 Mar 14,(15),,"Hulkamania Runs Wild
Complete chapter 1 in 30 Years of WrestleMania."
https://www.trueachievements.com/game/WWE-2K14/achievements,https://www.trueachievements.com/a180799/for-all-hulkamaniacs-achievement,For All Hulkamaniacs,30 Years of WM - WM 9 - Hogan vs. Yokozuna - Win the match.,26 Mar 14,(15),,"For All Hulkamaniacs
30 Years of WM - WM 9 - Hogan vs. Yokozuna - Win the match."
https://www.trueachievements.com/game/WWE-2K14/achievements,https://www.trueachievements.com/a180777/reached-the-ropes-achievement,Reached the ropes!,Crawl to the ropes during a submission (Single player).,26 Mar 14,(30),,"Reached the ropes!
Crawl to the ropes during a submission (Single player)."
https://www.trueachievements.com/game/WWE-2K14/achievements,https://www.trueachievements.com/a180767/watch-out-achievement,Watch out!,Successfully reverse a Finisher (Single player).,26 Mar 14,(20),,"Watch out!
Successfully reverse a Finisher (Single player)."
https://www.trueachievements.com/game/Call-of-Duty-Ghosts-Xbox-360/achievements,https://www.trueachievements.com/a180978/homecoming-achievement,Homecoming,"Defend LA. (Complete ""Homecoming"" on any difficulty.)",23 Mar 14,(10),,"Homecoming
Defend LA. (Complete ""Homecoming"" on any difficulty.)"
https://www.trueachievements.com/game/Call-of-Duty-Ghosts-Xbox-360/achievements,https://www.trueachievements.com/a180979/go-ugly-early-achievement,Go Ugly Early,A-10 strafe 50 enemies.,23 Mar 14,(10),,"Go Ugly Early
A-10 strafe 50 enemies."
https://www.trueachievements.com/game/Call-of-Duty-Ghosts-Xbox-360/achievements,https://www.trueachievements.com/a180976/struck-down-achievement,Struck Down,"Find Ajax. (Complete ""Struck Down"" on any difficulty.)",23 Mar 14,(10),,"Struck Down
Find Ajax. (Complete ""Struck Down"" on any difficulty.)"
https://www.trueachievements.com/game/Call-of-Duty-Ghosts-Xbox-360/achievements,https://www.trueachievements.com/a180974/no-mans-land-achievement,No Man's Land,"Make it to San Diego. (Complete ""No Man's Land"" on any difficulty.)",23 Mar 14,(10),,"No Man's Land
Make it to San Diego. (Complete ""No Man's Land"" on any difficulty.)"
https://www.trueachievements.com/game/Call-of-Duty-Ghosts-Xbox-360/achievements,https://www.trueachievements.com/a180970/brave-new-world-achievement,Brave New World,"Rendez-vous in Fort Santa Monica. (Complete ""Brave New World"" on any difficulty.)",23 Mar 14,(10),,"Brave New World
Rendez-vous in Fort Santa Monica. (Complete ""Brave New World"" on any difficulty.)"
https://www.trueachievements.com/game/Call-of-Duty-Ghosts-Xbox-360/achievements,https://www.trueachievements.com/a180971/liberty-wall-achievement,Liberty Wall,Take down both attack helicopters in Brave New World.,23 Mar 14,(10),,"Liberty Wall
Take down both attack helicopters in Brave New World."
https://www.trueachievements.com/game/Call-of-Duty-Ghosts-Xbox-360/achievements,https://www.trueachievements.com/a180972/ghost-stories-achievement,Ghost Stories,"Escape. (Complete ""Ghost Stories"" on any difficulty.)",23 Mar 14,(5),,"Ghost Stories
Escape. (Complete ""Ghost Stories"" on any difficulty.)"
https://www.trueachievements.com/game/Call-of-Duty-Ghosts-Xbox-360/achievements,https://www.trueachievements.com/a180973/spatial-awareness-achievement,Spatial Awareness,Kill your first enemy in the Call of Duty Ghosts campaign.,23 Mar 14,(10),,"Spatial Awareness
Kill your first enemy in the Call of Duty Ghosts campaign."
https://www.trueachievements.com/game/NBA-2K12/achievements,https://www.trueachievements.com/a155382/immortality-achievement,Immortality,Make the Hall of Fame in My Player mode.,08 Mar 14,(30),,"Immortality
Make the Hall of Fame in My Player mode."
https://www.trueachievements.com/game/NBA-2K12/achievements,https://www.trueachievements.com/a155416/wrote-my-legend-achievement,Wrote My Legend,Complete all 15 of the NBA's Greatest challenges.,17 Dec 13,(30),,"Wrote My Legend
Complete all 15 of the NBA's Greatest challenges."
https://www.trueachievements.com/game/NBA-2K12/achievements,https://www.trueachievements.com/a155415/left-my-mark-achievement,Left My Mark,Complete 10 of the NBA's Greatest challenges.,16 Dec 13,(15),,"Left My Mark
Complete 10 of the NBA's Greatest challenges."
https://www.trueachievements.com/game/NBA-2K12/achievements,https://www.trueachievements.com/a155369/made-my-name-achievement,Made My Name,Complete 5 of the NBA's Greatest challenges.,12 Dec 13,(15),,"Made My Name
Complete 5 of the NBA's Greatest challenges."
https://www.trueachievements.com/game/Grand-Theft-Auto-V-Xbox-360/achievements,https://www.trueachievements.com/a179414/off-the-plane-achievement,Off the Plane,You completed the GTA Online Introduction.,23 Nov 13,(5),,"Off the Plane
You completed the GTA Online Introduction."
https://www.trueachievements.com/game/Grand-Theft-Auto-V-Xbox-360/achievements,https://www.trueachievements.com/a179402/red-mist-achievement,Red Mist,You completed all Rampages.,15 Oct 13,(20),,"Red Mist
You completed all Rampages."
https://www.trueachievements.com/game/Grand-Theft-Auto-V-Xbox-360/achievements,https://www.trueachievements.com/a179392/the-big-one-achievement,The Big One!,This ain't no dream no more.,15 Oct 13,(20),,"The Big One!
This ain't no dream no more."
https://www.trueachievements.com/game/Grand-Theft-Auto-V-Xbox-360/achievements,https://www.trueachievements.com/a179391/the-government-gimps-achievement,The Government Gimps,You recovered sensitive information from a highly defended federal building.,14 Oct 13,(20),,"The Government Gimps
You recovered sensitive information from a highly defended federal building."
https://www.trueachievements.com/game/Tiger-Woods-PGA-TOUR-11/achievements,https://www.trueachievements.com/a63319/stay-focused-achievement,Stay Focused,Use Focus to hit a 375 yard long drive,27 Sep 13,(15),,"Stay Focused
Use Focus to hit a 375 yard long drive"
https://www.trueachievements.com/game/Grand-Theft-Auto-V-Xbox-360/achievements,https://www.trueachievements.com/a179382/welcome-to-los-santos-achievement,Welcome to Los Santos,You repo'd a car and raced it through the heart of a sun-soaked metropolis.,19 Sep 13,(10),,"Welcome to Los Santos
You repo'd a car and raced it through the heart of a sun-soaked metropolis."
https://www.trueachievements.com/game/Call-of-Duty-Black-Ops-II/achievements,https://www.trueachievements.com/a171211/i-dont-think-they-exist-achievement,I Don't Think They Exist,"In TranZit, kill one of the denizens of the forest while it is latched onto you.",13 Sep 13,(10),,"I Don't Think They Exist
In TranZit, kill one of the denizens of the forest while it is latched onto you."
https://www.trueachievements.com/game/Saints-Row-2/achievements,https://www.trueachievements.com/a26519/a-brighter-future-achievement,A Brighter Future,Defeated the Ultor Corporation epilogue,26 Aug 13,(80),,"A Brighter Future
Defeated the Ultor Corporation epilogue"
https://www.trueachievements.com/game/Saints-Row-2/achievements,https://www.trueachievements.com/a26481/brothers-keeper-achievement,Brother's Keeper,Defeated the Brotherhood,25 Aug 13,(40),,"Brother's Keeper
Defeated the Brotherhood"
https://www.trueachievements.com/game/Saints-Row-2/achievements,https://www.trueachievements.com/a26501/wheres-my-car-achievement,Where's My Car?,Delivered all the cars to the chop shops,24 Aug 13,(10),,"Where's My Car?
Delivered all the cars to the chop shops"
https://www.trueachievements.com/game/Saints-Row-2/achievements,https://www.trueachievements.com/a26480/seppuku-achievement,Seppuku,Defeated the Ronin,22 Aug 13,(40),,"Seppuku
Defeated the Ronin"
https://www.trueachievements.com/game/Saints-Row-2/achievements,https://www.trueachievements.com/a26482/remind-me-of-the-babe-achievement,Remind Me of the Babe,Defeated the Sons of Samedi,22 Aug 13,(40),,"Remind Me of the Babe
Defeated the Sons of Samedi"
https://www.trueachievements.com/game/Saints-Row-2/achievements,https://www.trueachievements.com/a26526/love-thy-neighbor-achievement,Love Thy Neighbor,Grabbed 50 human shields,22 Aug 13,(5),,"Love Thy Neighbor
Grabbed 50 human shields"
https://www.trueachievements.com/game/Saints-Row-2/achievements,https://www.trueachievements.com/a26525/going-the-distance-achievement,Going the Distance,"Threw someone a long, long way",22 Aug 13,(5),,"Going the Distance
Threw someone a long, long way"
https://www.trueachievements.com/game/Saints-Row-2/achievements,https://www.trueachievements.com/a26485/demolition-man-achievement,Demolition Man,Completed all levels of Demolition Derby,19 Aug 13,(15),,"Demolition Man
Completed all levels of Demolition Derby"
https://www.trueachievements.com/game/Saints-Row-2/achievements,https://www.trueachievements.com/a26479/welcome-back-achievement,Welcome Back,Completed the Saints Revival prologue,19 Aug 13,(5),,"Welcome Back
Completed the Saints Revival prologue"
https://www.trueachievements.com/game/Saints-Row-2/achievements,https://www.trueachievements.com/a26527/soprano-achievement,Soprano,Sung along to the radio,17 Aug 13,(10),,"Soprano
Sung along to the radio"
https://www.trueachievements.com/game/Saints-Row-2/achievements,https://www.trueachievements.com/a26505/surfs-up-achievement,Surf's Up,Got 3 gold stars in Vehicle Surfing,13 Aug 13,(5),,"Surf's Up
Got 3 gold stars in Vehicle Surfing"
https://www.trueachievements.com/game/Catherine/achievements,https://www.trueachievements.com/a153171/welcome-to-the-colosseum-achievement,Welcome to the Colosseum,Unlock the Colosseum mode.,10 Aug 13,(10),,"Welcome to the Colosseum
Unlock the Colosseum mode."
https://www.trueachievements.com/game/Catherine/achievements,https://www.trueachievements.com/a153158/starting-a-new-life-achievement,Starting a New Life,View the true Lover ending.,10 Aug 13,(10),,"Starting a New Life
View the true Lover ending."
https://www.trueachievements.com/game/Catherine/achievements,https://www.trueachievements.com/a153153/true-freedom-achievement,True Freedom!,Conquer Stage 9.,10 Aug 13,(30),,"True Freedom!
Conquer Stage 9."
https://www.trueachievements.com/game/Catherine/achievements,https://www.trueachievements.com/a153177/beer-baron-achievement,Beer Baron,Listen to all the beer factoids.,10 Aug 13,(10),,"Beer Baron
Listen to all the beer factoids."
https://www.trueachievements.com/game/Catherine/achievements,https://www.trueachievements.com/a153163/read-all-about-it-achievement,Read All About It!,Get Justin out of his jam.,10 Aug 13,(10),,"Read All About It!
Get Justin out of his jam."
https://www.trueachievements.com/game/Catherine/achievements,https://www.trueachievements.com/a153179/whisky-wiseman-achievement,Whisky Wiseman,Listen to all the whisky minutiae.,10 Aug 13,(10),,"Whisky Wiseman
Listen to all the whisky minutiae."
https://www.trueachievements.com/game/Catherine/achievements,https://www.trueachievements.com/a153178/cocktail-connoisseur-achievement,Cocktail Connoisseur,Listen to all the cocktail trivia.,10 Aug 13,(10),,"Cocktail Connoisseur
Listen to all the cocktail trivia."
https://www.trueachievements.com/game/FIFA-13/achievements,https://www.trueachievements.com/a168061/maxed-out-achievement,Maxed Out,Reach the daily limit of XP in the EA SPORTS Football Club,17 Jul 13,(10),,"Maxed Out
Reach the daily limit of XP in the EA SPORTS Football Club"
https://www.trueachievements.com/game/Harms-Way/achievements,https://www.trueachievements.com/a78335/justin-carpenter-achievement-achievement,Justin Carpenter Achievement,Just look at credits,25 Jun 13,(10),,"Justin Carpenter Achievement
Just look at credits"
https://www.trueachievements.com/game/Harms-Way/achievements,https://www.trueachievements.com/a78337/missilefest-achievement,Missile-Fest,Get the missile launcher for the first time,25 Jun 13,(10),,"Missile-Fest
Get the missile launcher for the first time"
https://www.trueachievements.com/game/Harms-Way/achievements,https://www.trueachievements.com/a78336/minefest-achievement,Mine-Fest,Deploy mines for the first time,25 Jun 13,(10),,"Mine-Fest
Deploy mines for the first time"
https://www.trueachievements.com/game/Harms-Way/achievements,https://www.trueachievements.com/a78331/first-blood-achievement,First Blood,Wreck an opponent as a shooter,25 Jun 13,(20),,"First Blood
Wreck an opponent as a shooter"
https://www.trueachievements.com/game/Harms-Way/achievements,https://www.trueachievements.com/a78338/one-shot-kill-achievement,One shot kill,Hit the windshield of a driver,25 Jun 13,(30),,"One shot kill
Hit the windshield of a driver"
https://www.trueachievements.com/game/Harms-Way/achievements,https://www.trueachievements.com/a78333/flat-tire-achievement,Flat Tire,Hit the tires of a driver,25 Jun 13,(20),,"Flat Tire
Hit the tires of a driver"
https://www.trueachievements.com/game/Harms-Way/achievements,https://www.trueachievements.com/a78332/first-win-achievement,First Win,Win a game in Single Player,25 Jun 13,(30),,"First Win
Win a game in Single Player"
https://www.trueachievements.com/game/Harms-Way/achievements,https://www.trueachievements.com/a78334/get-wrecked-achievement,Get Wrecked,Wreck your vehicle,25 Jun 13,(10),,"Get Wrecked
Wreck your vehicle"
https://www.trueachievements.com/game/Call-of-Duty-2/achievements,https://www.trueachievements.com/a10580/veteran-of-rommels-last-stand-achievement,Veteran of Rommel's Last Stand,Finished Rommel's Last Stand mission on Veteran difficulty,14 Jun 13,(60),,"Veteran of Rommel's Last Stand
Finished Rommel's Last Stand mission on Veteran difficulty"
https://www.trueachievements.com/game/Call-of-Duty-2/achievements,https://www.trueachievements.com/a10581/veteran-of-the-tank-squadrons-achievement,Veteran of The Tank Squadrons,Finished The Tank Squadrons mission on Veteran difficulty,14 Jun 13,(60),,"Veteran of The Tank Squadrons
Finished The Tank Squadrons mission on Veteran difficulty"
https://www.trueachievements.com/game/Call-of-Duty-2/achievements,https://www.trueachievements.com/a10582/veteran-of-el-alamein-achievement,Veteran of El Alamein,Finished The Battle of El Alamein mission on Veteran difficulty,13 Jun 13,(60),,"Veteran of El Alamein
Finished The Battle of El Alamein mission on Veteran difficulty"
https://www.trueachievements.com/game/Call-of-Duty-2/achievements,https://www.trueachievements.com/a10583/veteran-of-fortress-stalingrad-achievement,Veteran of Fortress Stalingrad,Finished Fortress Stalingrad mission on Veteran difficulty,12 Jun 13,(60),,"Veteran of Fortress Stalingrad
Finished Fortress Stalingrad mission on Veteran difficulty"
https://www.trueachievements.com/game/Call-of-Duty-2/achievements,https://www.trueachievements.com/a10584/veteran-of-stalingrad-42-achievement,Veteran of Stalingrad '42,"Finished ""Not One Step Backwards!"" mission on Veteran difficulty",09 Jun 13,(60),,"Veteran of Stalingrad '42
Finished ""Not One Step Backwards!"" mission on Veteran difficulty"
https://www.trueachievements.com/game/Call-of-Duty-2/achievements,https://www.trueachievements.com/a10585/veteran-of-the-winter-war-achievement,Veteran of the Winter War,Finished The Winter War on Veteran difficulty,07 Jun 13,(60),,"Veteran of the Winter War
Finished The Winter War on Veteran difficulty"
https://www.trueachievements.com/game/Call-of-Duty-2/achievements,https://www.trueachievements.com/a10587/completed-training-achievement,Completed Training,Completed Basic Training,07 Jun 13,(50),,"Completed Training
Completed Basic Training"
https://www.trueachievements.com/game/FIFA-13/achievements,https://www.trueachievements.com/a168055/wheeling-and-dealing-achievement,Wheeling and Dealing,Complete a Player + cash deal in Career,03 Jun 13,(15),,"Wheeling and Dealing
Complete a Player + cash deal in Career"
https://www.trueachievements.com/game/FIFA-13/achievements,https://www.trueachievements.com/a168052/for-country-achievement,For Country,Become manager of an international team,02 Jun 13,(20),,"For Country
Become manager of an international team"
https://www.trueachievements.com/game/Smash-Court-Tennis-3/achievements,https://www.trueachievements.com/a25171/pro-tour--sponsorship-achievement,Pro Tour - Sponsorship,Congratulations! You have received your first sponsorship in Pro Tour Mode!,30 May 13,(15),,"Pro Tour - Sponsorship
Congratulations! You have received your first sponsorship in Pro Tour Mode!"
https://www.trueachievements.com/game/Dishonored/achievements,https://www.trueachievements.com/a168816/dishonored-achievement,Dishonored,You escaped Coldridge Prison,08 Apr 13,(5),,"Dishonored
You escaped Coldridge Prison"
https://www.trueachievements.com/game/WWE-SmackDown-vs-RAW-2010/achievements,https://www.trueachievements.com/a38161/developmental-graduate-achievement,Developmental Graduate,Complete the TRAINING CHECKLIST.,07 Apr 13,(50),,"Developmental Graduate
Complete the TRAINING CHECKLIST."
https://www.trueachievements.com/game/WWE-SmackDown-vs-RAW-2010/achievements,https://www.trueachievements.com/a38171/an-original-design-achievement,An Original Design,Create an original image using the PAINT TOOL.,31 Mar 13,(15),,"An Original Design
Create an original image using the PAINT TOOL."
https://www.trueachievements.com/game/WWE-SmackDown-vs-RAW-2010/achievements,https://www.trueachievements.com/a38163/check-out-the-new-threads-achievement,Check Out the New Threads,Create ALTERNATE ATTIRE for a CREATED SUPERSTAR and new THREADS for a WWE SUPERSTAR.,31 Mar 13,(15),,"Check Out the New Threads
Create ALTERNATE ATTIRE for a CREATED SUPERSTAR and new THREADS for a WWE SUPERSTAR."
https://www.trueachievements.com/game/WWE-SmackDown-vs-RAW-2010/achievements,https://www.trueachievements.com/a38160/face-on-the-big-screen-achievement,Face on the Big Screen,Convert a HIGHLIGHT REEL into an entrance movie.,31 Mar 13,(15),,"Face on the Big Screen
Convert a HIGHLIGHT REEL into an entrance movie."
https://www.trueachievements.com/game/WWE-SmackDown-vs-RAW-2010/achievements,https://www.trueachievements.com/a38150/story-designer-achievement,Story Designer,Create an original story using WWE STORY DESIGNER Mode.,31 Mar 13,(20),,"Story Designer
Create an original story using WWE STORY DESIGNER Mode."
https://www.trueachievements.com/game/WWE-SmackDown-vs-RAW-2010/achievements,https://www.trueachievements.com/a38152/2010-hall-of-fame-nominee-achievement,2010 Hall of Fame Nominee,Induct a Superstar into the HALL OF FAME.,31 Mar 13,(100),,"2010 Hall of Fame Nominee
Induct a Superstar into the HALL OF FAME."
https://www.trueachievements.com/game/WWE-SmackDown-vs-RAW-2010/achievements,https://www.trueachievements.com/a38153/a-showman-like-no-other-achievement,A Showman Like No Other,Have a total of 20 or more 5-star rated matches in your overall match history.,31 Mar 13,(50),,"A Showman Like No Other
Have a total of 20 or more 5-star rated matches in your overall match history."
https://www.trueachievements.com/game/WWE-SmackDown-vs-RAW-2010/achievements,https://www.trueachievements.com/a38173/technical-wizardry-achievement,Technical Wizardry,Succeed at a cumulative total of 100 reversals (single player only).,31 Mar 13,(100),,"Technical Wizardry
Succeed at a cumulative total of 100 reversals (single player only)."
https://www.trueachievements.com/game/WWE-SmackDown-vs-RAW-2010/achievements,https://www.trueachievements.com/a38162/career-growth-achievement,Career Growth,Increase the overall rating of a CREATED SUPERSTAR character to a 90 or above.,30 Mar 13,(50),,"Career Growth
Increase the overall rating of a CREATED SUPERSTAR character to a 90 or above."
https://www.trueachievements.com/game/WWE-SmackDown-vs-RAW-2010/achievements,https://www.trueachievements.com/a38169/shoulders-to-the-mat-achievement,Shoulders to the Mat,Win 50 matches by pinfall (single player only).,30 Mar 13,(20),,"Shoulders to the Mat
Win 50 matches by pinfall (single player only)."
https://www.trueachievements.com/game/WWE-SmackDown-vs-RAW-2010/achievements,https://www.trueachievements.com/a38158/created-superstar-story-achievement,Created Superstar Story,Complete the CREATE A SUPERSTAR story in ROAD TO WRESTLEMANIA mode.,30 Mar 13,(20),,"Created Superstar Story
Complete the CREATE A SUPERSTAR story in ROAD TO WRESTLEMANIA mode."
https://www.trueachievements.com/game/WWE-SmackDown-vs-RAW-2010/achievements,https://www.trueachievements.com/a38159/nothing-more-to-collect-achievement,Nothing More to Collect,Unlock all the playable characters and bonus items.,30 Mar 13,(100),,"Nothing More to Collect
Unlock all the playable characters and bonus items."
https://www.trueachievements.com/game/WWE-SmackDown-vs-RAW-2010/achievements,https://www.trueachievements.com/a38165/ask-him-ref-achievement,Ask Him Ref!,Win 10 matches by submission (single player only).,30 Mar 13,(20),,"Ask Him Ref!
Win 10 matches by submission (single player only)."
https://www.trueachievements.com/game/WWE-SmackDown-vs-RAW-2010/achievements,https://www.trueachievements.com/a38170/a-grappling-machine-achievement,A Grappling Machine,"In one match, perform all 16 STRONG GRAPPLE moves on your opponent (single player only).",30 Mar 13,(20),,"A Grappling Machine
In one match, perform all 16 STRONG GRAPPLE moves on your opponent (single player only)."
https://www.trueachievements.com/game/WWE-SmackDown-vs-RAW-2010/achievements,https://www.trueachievements.com/a38164/finisher-of-the-year-candidate-achievement,Finisher of the Year Candidate,"Create a dive finisher, in Create A Finisher mode, and use it in a match (single player only).",30 Mar 13,(20),,"Finisher of the Year Candidate
Create a dive finisher, in Create A Finisher mode, and use it in a match (single player only)."
https://www.trueachievements.com/game/WWE-SmackDown-vs-RAW-2010/achievements,https://www.trueachievements.com/a38151/new-superstar-initiative-achievement,New Superstar Initiative,Create a SUPERSTAR in CREATE A SUPERSTAR Mode.,28 Mar 13,(15),,"New Superstar Initiative
Create a SUPERSTAR in CREATE A SUPERSTAR Mode."
https://www.trueachievements.com/game/WWE-SmackDown-vs-RAW-2010/achievements,https://www.trueachievements.com/a38172/intermediate-technician-achievement,Intermediate Technician,Succeed at a cumulative total of 50 reversals (single player only).,28 Mar 13,(20),,"Intermediate Technician
Succeed at a cumulative total of 50 reversals (single player only)."
https://www.trueachievements.com/game/WWE-SmackDown-vs-RAW-2010/achievements,https://www.trueachievements.com/a38157/brand-warfare-story-achievement,Brand Warfare Story,Complete the BRAND WARFARE story in ROAD TO WRESTLEMANIA mode.,27 Mar 13,(20),,"Brand Warfare Story
Complete the BRAND WARFARE story in ROAD TO WRESTLEMANIA mode."
