achievement_game_url,achievement_url,achievement_name,achievement_desc,achievement_earned,achievement_score,ta_score,ta_ratio
https://www.trueachievements.com/game/NBA-2K12/achievements,https://www.trueachievements.com/a155374/check-achievement,Check!,Complete all 3 in-game objectives in My Player mode.,28 Feb 12,(15),,"Check!
Complete all 3 in-game objectives in My Player mode."
https://www.trueachievements.com/game/NBA-2K12/achievements,https://www.trueachievements.com/a155408/birthday-achievement,Birthday,Create-a-Player.,24 Feb 12,(10),,"Birthday
Create-a-Player."
https://www.trueachievements.com/game/NBA-2K12/achievements,https://www.trueachievements.com/a155370/a-2k-to-call-my-own-achievement,A 2K to Call My Own,Create a My2K Account.,24 Feb 12,(25),,"A 2K to Call My Own
Create a My2K Account."
https://www.trueachievements.com/game/Fable-3/achievements,https://www.trueachievements.com/a66437/you-cant-bring-me-down-achievement,You Can't Bring Me Down,"You got all the way to the end without being knocked out. Well, there was that time in the desert...",24 Feb 12,(50),,"You Can't Bring Me Down
You got all the way to the end without being knocked out. Well, there was that time in the desert..."
https://www.trueachievements.com/game/Fable-3/achievements,https://www.trueachievements.com/a66424/for-albion-achievement,For Albion!,You killed the Crawler and ended the greatest threat ever to loom over Albion. You are a legend.,24 Feb 12,(80),,"For Albion!
You killed the Crawler and ended the greatest threat ever to loom over Albion. You are a legend."
https://www.trueachievements.com/game/Fable-3/achievements,https://www.trueachievements.com/a66460/tough-love-achievement,Tough Love,"You had to make a lot of difficult and unpopular decisions, but they were the right ones.",24 Feb 12,(10),,"Tough Love
You had to make a lot of difficult and unpopular decisions, but they were the right ones."
https://www.trueachievements.com/game/Fable-3/achievements,https://www.trueachievements.com/a66423/the-ruler-of-albion-achievement,The Ruler of Albion,You led a revolution and now the throne is yours. How will history judge your rule?,05 Feb 12,(80),,"The Ruler of Albion
You led a revolution and now the throne is yours. How will history judge your rule?"
https://www.trueachievements.com/game/Fable-3/achievements,https://www.trueachievements.com/a66422/distant-friends-achievement,Distant Friends,You convinced the Aurorans to to join your cause. It's time for a revolution!,05 Feb 12,(20),,"Distant Friends
You convinced the Aurorans to to join your cause. It's time for a revolution!"
https://www.trueachievements.com/game/Fable-3/achievements,https://www.trueachievements.com/a66434/if-it-bleeds-we-can-kill-it-achievement,"If It Bleeds, We Can Kill It","You're a one-Hero army. A pure massacring machine. A total killing-- well, you get the idea.",05 Feb 12,(20),,"If It Bleeds, We Can Kill It
You're a one-Hero army. A pure massacring machine. A total killing-- well, you get the idea."
https://www.trueachievements.com/game/Fable-3/achievements,https://www.trueachievements.com/a66450/barrel-of-laughs-achievement,Barrel of Laughs,You annihilated 30 enemies using explosive barrels. Isn't it nice how conveniently placed they are?,05 Feb 12,(10),,"Barrel of Laughs
You annihilated 30 enemies using explosive barrels. Isn't it nice how conveniently placed they are?"
https://www.trueachievements.com/game/Fable-3/achievements,https://www.trueachievements.com/a66433/gunning-for-glory-achievement,Gunning For Glory,Few have ever put the trigger to such bloody use.,05 Feb 12,(20),,"Gunning For Glory
Few have ever put the trigger to such bloody use."
https://www.trueachievements.com/game/Fable-3/achievements,https://www.trueachievements.com/a66421/the-resistance-achievement,The Resistance,"The people of Bowerstone are behind you, ready to stand up against your brother.",05 Feb 12,(50),,"The Resistance
The people of Bowerstone are behind you, ready to stand up against your brother."
https://www.trueachievements.com/game/Fable-3/achievements,https://www.trueachievements.com/a66425/save-the-princess-achievement,Save The Princess!,You rescued a piece of cardboard and gained valuable insight into the game development process.,05 Feb 12,(10),,"Save The Princess!
You rescued a piece of cardboard and gained valuable insight into the game development process."
https://www.trueachievements.com/game/Fable-3/achievements,https://www.trueachievements.com/a66426/ghost-brothers-achievement,Ghost Brothers,"Not even death can put squabbling siblings to rest, but at least they're safely back with Mother.",05 Feb 12,(10),,"Ghost Brothers
Not even death can put squabbling siblings to rest, but at least they're safely back with Mother."
https://www.trueachievements.com/game/Fable-3/achievements,https://www.trueachievements.com/a66420/swift-justice-achievement,Swift Justice,Major Swift and his men have joined your cause. How can you fail with that moustache on your side?,05 Feb 12,(20),,"Swift Justice
Major Swift and his men have joined your cause. How can you fail with that moustache on your side?"
https://www.trueachievements.com/game/FIFA-12/achievements,https://www.trueachievements.com/a154921/precision-tackler-achievement,Precision Tackler,Obtain a successful tackle percentage of 80% with a minimum of 5 tackles in a game,07 Jan 12,(15),,"Precision Tackler
Obtain a successful tackle percentage of 80% with a minimum of 5 tackles in a game"
https://www.trueachievements.com/game/Modern-Warfare-3/achievements,https://www.trueachievements.com/a157684/brag-rags-achievement,Brag Rags,Earn 1 star in Special Ops Mission Mode.,03 Jan 12,(10),,"Brag Rags
Earn 1 star in Special Ops Mission Mode."
https://www.trueachievements.com/game/Batman-Arkham-City/achievements,https://www.trueachievements.com/a155681/conundrum-achievement,Conundrum,Rescue the first hostage from Riddler,30 Dec 11,(20),,"Conundrum
Rescue the first hostage from Riddler"
https://www.trueachievements.com/game/Batman-Arkham-City/achievements,https://www.trueachievements.com/a155677/bargaining-chip-achievement,Bargaining Chip,Reunite the separated couple,30 Dec 11,(15),,"Bargaining Chip
Reunite the separated couple"
https://www.trueachievements.com/game/Batman-Arkham-City/achievements,https://www.trueachievements.com/a155669/exit-stage-right-achievement,Exit Stage Right,All the world is a stage,28 Dec 11,(50),,"Exit Stage Right
All the world is a stage"
https://www.trueachievements.com/game/Batman-Arkham-City/achievements,https://www.trueachievements.com/a155668/freefall-achievement,Freefall,Don't look down,28 Dec 11,(25),,"Freefall
Don't look down"
https://www.trueachievements.com/game/Batman-Arkham-City/achievements,https://www.trueachievements.com/a155667/ghost-train-achievement,Ghost Train,Fight for survival,28 Dec 11,(25),,"Ghost Train
Fight for survival"
https://www.trueachievements.com/game/Batman-Arkham-City/achievements,https://www.trueachievements.com/a155666/hide-and-seek-achievement,Hide And Seek,A deadly game of hide and seek,28 Dec 11,(25),,"Hide And Seek
A deadly game of hide and seek"
https://www.trueachievements.com/game/Batman-Arkham-City/achievements,https://www.trueachievements.com/a155665/sandstorm-achievement,Sandstorm,We are legion,28 Dec 11,(25),,"Sandstorm
We are legion"
https://www.trueachievements.com/game/Batman-Arkham-City/achievements,https://www.trueachievements.com/a155664/lost-and-found-achievement,Lost And Found,Uncover the secret of Arkham City,28 Dec 11,(10),,"Lost And Found
Uncover the secret of Arkham City"
https://www.trueachievements.com/game/Batman-Arkham-City/achievements,https://www.trueachievements.com/a155653/iq-test-achievement,IQ Test,Solve the first riddle,28 Dec 11,(10),,"IQ Test
Solve the first riddle"
https://www.trueachievements.com/game/Batman-Arkham-City/achievements,https://www.trueachievements.com/a155663/wrecking-ball-achievement,Wrecking Ball,Stop the unstoppable,28 Dec 11,(25),,"Wrecking Ball
Stop the unstoppable"
https://www.trueachievements.com/game/Batman-Arkham-City/achievements,https://www.trueachievements.com/a155662/gladiator-achievement,Gladiator,Last man standing,28 Dec 11,(10),,"Gladiator
Last man standing"
https://www.trueachievements.com/game/Batman-Arkham-City/achievements,https://www.trueachievements.com/a155661/communication-breakdown-achievement,Communication Breakdown,Clear the airwaves,27 Dec 11,(10),,"Communication Breakdown
Clear the airwaves"
https://www.trueachievements.com/game/Batman-Arkham-City/achievements,https://www.trueachievements.com/a155678/ar-knight-achievement,AR Knight,Complete all augmented reality training exercises,27 Dec 11,(25),,"AR Knight
Complete all augmented reality training exercises"
https://www.trueachievements.com/game/Batman-Arkham-City/achievements,https://www.trueachievements.com/a155654/ring-ring-achievement,Ring Ring,Answer a ringing phone,27 Dec 11,(5),,"Ring Ring
Answer a ringing phone"
https://www.trueachievements.com/game/Batman-Arkham-City/achievements,https://www.trueachievements.com/a155655/onearmed-bandit-achievement,One-Armed Bandit,Hammer the point home,27 Dec 11,(10),,"One-Armed Bandit
Hammer the point home"
https://www.trueachievements.com/game/Modern-Warfare-3/achievements,https://www.trueachievements.com/a157664/scout-leader-achievement,Scout Leader,Collect 46 Intel Items.,24 Dec 11,(35),,"Scout Leader
Collect 46 Intel Items."
https://www.trueachievements.com/game/Modern-Warfare-3/achievements,https://www.trueachievements.com/a157672/nein-achievement,Nein,"Kill 9 enemies with A-10 strafing runs in ""Scorched Earth.""",24 Dec 11,(20),,"Nein
Kill 9 enemies with A-10 strafing runs in ""Scorched Earth."""
https://www.trueachievements.com/game/Modern-Warfare-3/achievements,https://www.trueachievements.com/a157671/menage-a-trois-achievement,Menage a Trois,"Destroy 3 tanks with a single 105mm shot in ""Iron Lady.""",24 Dec 11,(20),,"Menage a Trois
Destroy 3 tanks with a single 105mm shot in ""Iron Lady."""
https://www.trueachievements.com/game/Modern-Warfare-3/achievements,https://www.trueachievements.com/a157670/danger-close-achievement,Danger Close,"Take down a chopper with an AC-130 smoke grenade in ""Bag and Drag.""",24 Dec 11,(20),,"Danger Close
Take down a chopper with an AC-130 smoke grenade in ""Bag and Drag."""
https://www.trueachievements.com/game/Modern-Warfare-3/achievements,https://www.trueachievements.com/a157663/informant-achievement,Informant,Collect 22 Intel Items.,24 Dec 11,(20),,"Informant
Collect 22 Intel Items."
https://www.trueachievements.com/game/Modern-Warfare-3/achievements,https://www.trueachievements.com/a157668/for-whom-the-shell-tolls-achievement,For Whom the Shell Tolls,"Destroy all targets during the mortar sequence with only 4 shells in ""Back on the Grid.""",24 Dec 11,(20),,"For Whom the Shell Tolls
Destroy all targets during the mortar sequence with only 4 shells in ""Back on the Grid."""
https://www.trueachievements.com/game/Modern-Warfare-3/achievements,https://www.trueachievements.com/a157667/flight-attendant-achievement,Flight Attendant,"Kill all 5 enemies during the zero-g sequence in ""Turbulence.""",24 Dec 11,(20),,"Flight Attendant
Kill all 5 enemies during the zero-g sequence in ""Turbulence."""
https://www.trueachievements.com/game/Modern-Warfare-3/achievements,https://www.trueachievements.com/a157666/what-goes-up-achievement,What Goes Up,"Destroy all the choppers with only the UGV's grenade launcher in ""Persona Non Grata.""",24 Dec 11,(20),,"What Goes Up
Destroy all the choppers with only the UGV's grenade launcher in ""Persona Non Grata."""
https://www.trueachievements.com/game/Modern-Warfare-3/achievements,https://www.trueachievements.com/a157661/strike-achievement,Strike!,Kill 5 enemies with a single grenade in Single Player or Special Ops.,24 Dec 11,(20),,"Strike!
Kill 5 enemies with a single grenade in Single Player or Special Ops."
https://www.trueachievements.com/game/Modern-Warfare-3/achievements,https://www.trueachievements.com/a157665/this-is-my-boomstick-achievement,This Is My Boomstick,"Kill 30 enemies with the XM25 in ""Black Tuesday.""",24 Dec 11,(20),,"This Is My Boomstick
Kill 30 enemies with the XM25 in ""Black Tuesday."""
https://www.trueachievements.com/game/Modern-Warfare-3/achievements,https://www.trueachievements.com/a157660/the-best-of-the-best-achievement,The Best of the Best,Complete the campaign on Hardened or Veteran difficulty.,23 Dec 11,(100),,"The Best of the Best
Complete the campaign on Hardened or Veteran difficulty."
https://www.trueachievements.com/game/Modern-Warfare-3/achievements,https://www.trueachievements.com/a157658/this-is-the-end-achievement,This is the End,"Complete ""Scorched Earth"", ""Down the Rabbit Hole"", and ""Dust to Dust"" on Veteran difficulty.",23 Dec 11,(25),,"This is the End
Complete ""Scorched Earth"", ""Down the Rabbit Hole"", and ""Dust to Dust"" on Veteran difficulty."
https://www.trueachievements.com/game/Modern-Warfare-3/achievements,https://www.trueachievements.com/a157657/the-darkest-hour-achievement,The Darkest Hour,"Complete ""Eye of the Storm"", ""Blood Brothers"", and ""Stronghold"" on Veteran difficulty.",23 Dec 11,(25),,"The Darkest Hour
Complete ""Eye of the Storm"", ""Blood Brothers"", and ""Stronghold"" on Veteran difficulty."
https://www.trueachievements.com/game/Modern-Warfare-3/achievements,https://www.trueachievements.com/a157656/city-of-lights-achievement,City of Lights,"Complete ""Bag and Drag"" and ""Iron Lady"" on Veteran difficulty.",23 Dec 11,(25),,"City of Lights
Complete ""Bag and Drag"" and ""Iron Lady"" on Veteran difficulty."
https://www.trueachievements.com/game/Modern-Warfare-3/achievements,https://www.trueachievements.com/a157655/payback-achievement,Payback,"Complete ""Mind the Gap"", ""Goalpost"", and ""Return to Sender"" on Veteran difficulty.",23 Dec 11,(25),,"Payback
Complete ""Mind the Gap"", ""Goalpost"", and ""Return to Sender"" on Veteran difficulty."
https://www.trueachievements.com/game/Modern-Warfare-3/achievements,https://www.trueachievements.com/a157669/kill-box-achievement,Kill Box,"Kill 20 enemies with the Chopper Gunner in a single run in ""Return to Sender.""",23 Dec 11,(20),,"Kill Box
Kill 20 enemies with the Chopper Gunner in a single run in ""Return to Sender."""
https://www.trueachievements.com/game/Modern-Warfare-3/achievements,https://www.trueachievements.com/a157654/out-of-the-frying-pan-achievement,Out of the Frying Pan,"Complete ""Persona Non Grata"", ""Turbulence"", and ""Back on the Grid"" on Veteran difficulty.",22 Dec 11,(25),,"Out of the Frying Pan
Complete ""Persona Non Grata"", ""Turbulence"", and ""Back on the Grid"" on Veteran difficulty."
https://www.trueachievements.com/game/Modern-Warfare-3/achievements,https://www.trueachievements.com/a157653/the-big-apple-achievement,The Big Apple,"Complete ""Black Tuesday"" and ""Hunter Killer"" on Veteran difficulty.",22 Dec 11,(25),,"The Big Apple
Complete ""Black Tuesday"" and ""Hunter Killer"" on Veteran difficulty."
https://www.trueachievements.com/game/Modern-Warfare-3/achievements,https://www.trueachievements.com/a157659/who-dares-wins-achievement,Who Dares Wins,Complete the campaign on any difficulty.,22 Dec 11,(40),,"Who Dares Wins
Complete the campaign on any difficulty."
https://www.trueachievements.com/game/Modern-Warfare-3/achievements,https://www.trueachievements.com/a157652/diamond-in-the-rough-achievement,Diamond in the Rough,"Rescue the Russian President. Complete ""Down the Rabbit Hole"" on any difficulty.",22 Dec 11,(10),,"Diamond in the Rough
Rescue the Russian President. Complete ""Down the Rabbit Hole"" on any difficulty."
https://www.trueachievements.com/game/Modern-Warfare-3/achievements,https://www.trueachievements.com/a157651/bad-first-date-achievement,Bad First Date,"Find the girl. Complete ""Scorched Earth"" on any difficulty.",22 Dec 11,(10),,"Bad First Date
Find the girl. Complete ""Scorched Earth"" on any difficulty."
https://www.trueachievements.com/game/Modern-Warfare-3/achievements,https://www.trueachievements.com/a157650/storm-the-castle-achievement,Storm the Castle,"Discover Makarov's next move. Complete ""Stronghold"" on any difficulty.",22 Dec 11,(10),,"Storm the Castle
Discover Makarov's next move. Complete ""Stronghold"" on any difficulty."
https://www.trueachievements.com/game/Modern-Warfare-3/achievements,https://www.trueachievements.com/a157649/requiem-achievement,Requiem,"Escape the city. Complete ""Blood Brothers"" on any difficulty.",22 Dec 11,(10),,"Requiem
Escape the city. Complete ""Blood Brothers"" on any difficulty."
https://www.trueachievements.com/game/Modern-Warfare-3/achievements,https://www.trueachievements.com/a157648/vive-la-revolution-achievement,Vive la Revolution!,"Reach the church. Complete ""Eye of the Storm"" on any difficulty.",22 Dec 11,(10),,"Vive la Revolution!
Reach the church. Complete ""Eye of the Storm"" on any difficulty."
https://www.trueachievements.com/game/Modern-Warfare-3/achievements,https://www.trueachievements.com/a157647/well-always-have-paris-achievement,We'll Always Have Paris,"Escape Paris with Volk. Complete ""Iron Lady"" on any difficulty.",22 Dec 11,(10),,"We'll Always Have Paris
Escape Paris with Volk. Complete ""Iron Lady"" on any difficulty."
https://www.trueachievements.com/game/Modern-Warfare-3/achievements,https://www.trueachievements.com/a157646/back-seat-driver-achievement,Back Seat Driver,"Track down Volk. Complete ""Bag and Drag"" on any difficulty.",22 Dec 11,(10),,"Back Seat Driver
Track down Volk. Complete ""Bag and Drag"" on any difficulty."
https://www.trueachievements.com/game/Modern-Warfare-3/achievements,https://www.trueachievements.com/a157640/carpe-diem-achievement,Carpe Diem,"Escape the mountain safe house. Complete ""Persona Non Grata"" on any difficulty.",22 Dec 11,(10),,"Carpe Diem
Escape the mountain safe house. Complete ""Persona Non Grata"" on any difficulty."
https://www.trueachievements.com/game/Modern-Warfare-3/achievements,https://www.trueachievements.com/a157639/wet-work-achievement,Wet Work,"Take back New York Harbor. Complete ""Hunter Killer"" on any difficulty.",22 Dec 11,(10),,"Wet Work
Take back New York Harbor. Complete ""Hunter Killer"" on any difficulty."
https://www.trueachievements.com/game/Modern-Warfare-3/achievements,https://www.trueachievements.com/a157638/too-big-to-fail-achievement,Too Big to Fail,"Destroy the Jamming Tower. Complete ""Black Tuesday"" on any difficulty.",22 Dec 11,(10),,"Too Big to Fail
Destroy the Jamming Tower. Complete ""Black Tuesday"" on any difficulty."
https://www.trueachievements.com/game/Modern-Warfare-3/achievements,https://www.trueachievements.com/a157637/back-in-the-fight-achievement,Back in the Fight,Start the Single Player Campaign on any difficulty.,21 Dec 11,(5),,"Back in the Fight
Start the Single Player Campaign on any difficulty."
https://www.trueachievements.com/game/FIFA-12/achievements,https://www.trueachievements.com/a154935/eas-fc-youth-academy-achievement,EAS FC Youth Academy,Reach level 5 in the EA SPORTS Football Club,10 Dec 11,(10),,"EAS FC Youth Academy
Reach level 5 in the EA SPORTS Football Club"
https://www.trueachievements.com/game/FIFA-12/achievements,https://www.trueachievements.com/a154922/megged-achievement,Megged,Successfully dribble the ball through a defender's legs,10 Dec 11,(30),,"Megged
Successfully dribble the ball through a defender's legs"
https://www.trueachievements.com/game/FIFA-12/achievements,https://www.trueachievements.com/a154933/warrior-achievement,Warrior,Score a goal after suffering a non-contact injury with a player,17 Nov 11,(20),,"Warrior
Score a goal after suffering a non-contact injury with a player"
https://www.trueachievements.com/game/FIFA-12/achievements,https://www.trueachievements.com/a154929/ruud-boy-achievement,Ruud Boy,Score a goal on a volley,22 Oct 11,(15),,"Ruud Boy
Score a goal on a volley"
https://www.trueachievements.com/game/Call-of-Duty-Black-Ops/achievements,https://www.trueachievements.com/a71848/in-the-money-achievement,In The Money,"Finish 5 Wager Matches ""in the money.""",20 Oct 11,(20),,"In The Money
Finish 5 Wager Matches ""in the money."""
https://www.trueachievements.com/game/Rock-Band-3/achievements,https://www.trueachievements.com/a67433/tambourine-master-achievement,Tambourine Master,Hit 100% of the notes in a percussion section.,14 May 11,(10),,"Tambourine Master
Hit 100% of the notes in a percussion section."
https://www.trueachievements.com/game/FIFA-11/achievements,https://www.trueachievements.com/a66708/record-holder-achievement,Record Holder,Get your name on any Career Mode Leaderboard,10 May 11,(25),,"Record Holder
Get your name on any Career Mode Leaderboard"
https://www.trueachievements.com/game/Mortal-Kombat/achievements,https://www.trueachievements.com/a149364/tower-apprentice-achievement,Tower Apprentice,Complete 25 Tower missions,03 May 11,(10),,"Tower Apprentice
Complete 25 Tower missions"
https://www.trueachievements.com/game/Mortal-Kombat/achievements,https://www.trueachievements.com/a149331/back-in-time-achievement,Back In Time...,Complete Story Mode 100%,28 Apr 11,(20),,"Back In Time...
Complete Story Mode 100%"
https://www.trueachievements.com/game/Mortal-Kombat/achievements,https://www.trueachievements.com/a149370/quantease-achievement,Quan-Tease,"Unlock Hidden Fighter ""Quan Chi""",28 Apr 11,(20),,"Quan-Tease
Unlock Hidden Fighter ""Quan Chi"""
https://www.trueachievements.com/game/Mortal-Kombat/achievements,https://www.trueachievements.com/a149354/cold-fusion-achievement,Cold Fusion,"Unlock Hidden Fighter ""Cyber Sub-Zero""",28 Apr 11,(20),,"Cold Fusion
Unlock Hidden Fighter ""Cyber Sub-Zero"""
https://www.trueachievements.com/game/Portal-2/achievements,https://www.trueachievements.com/a149567/team-building-achievement,Team Building,Complete all test chambers in the Team Building co-op course,26 Apr 11,(10),,"Team Building
Complete all test chambers in the Team Building co-op course"
https://www.trueachievements.com/game/Portal-2/achievements,https://www.trueachievements.com/a149566/high-five-achievement,High Five,Celebrate your cooperative calibration success,26 Apr 11,(5),,"High Five
Celebrate your cooperative calibration success"
https://www.trueachievements.com/game/Mortal-Kombat/achievements,https://www.trueachievements.com/a149348/there-will-be-blood-achievement,There Will Be Blood!,Spill 10000 pints of blood,26 Apr 11,(40),,"There Will Be Blood!
Spill 10000 pints of blood"
https://www.trueachievements.com/game/Mortal-Kombat/achievements,https://www.trueachievements.com/a149328/license-to-kill-achievement,License to Kill,Complete Fatality Trainer,21 Apr 11,(20),,"License to Kill
Complete Fatality Trainer"
https://www.trueachievements.com/game/Mortal-Kombat/achievements,https://www.trueachievements.com/a149329/a-for-effort-achievement,A For Effort,Complete Tutorial Mode,21 Apr 11,(10),,"A For Effort
Complete Tutorial Mode"
https://www.trueachievements.com/game/Mortal-Kombat/achievements,https://www.trueachievements.com/a149366/tag-youre-it-achievement,"Tag, You're It!",Perform and land a Tag Combo,21 Apr 11,(10),,"Tag, You're It!
Perform and land a Tag Combo"
https://www.trueachievements.com/game/Mortal-Kombat/achievements,https://www.trueachievements.com/a149325/block-this-achievement,Block This!,Perform a 10-hit combo with any fighter,21 Apr 11,(10),,"Block This!
Perform a 10-hit combo with any fighter"
https://www.trueachievements.com/game/Mortal-Kombat/achievements,https://www.trueachievements.com/a149327/fatality-achievement,Fatality!,Perform a Fatality!,21 Apr 11,(5),,"Fatality!
Perform a Fatality!"
https://www.trueachievements.com/game/NCAA-Football-11/achievements,https://www.trueachievements.com/a63357/air-raid-achievement,Air Raid,Score 35+ points in a game running an Air Raid offense (excludes co-op).,28 Mar 11,(25),,"Air Raid
Score 35+ points in a game running an Air Raid offense (excludes co-op)."
https://www.trueachievements.com/game/Bulletstorm/achievements,https://www.trueachievements.com/a147223/violent-melody-achievement,Violent Melody,Complete the Campaign on Normal Difficulty,24 Mar 11,(30),,"Violent Melody
Complete the Campaign on Normal Difficulty"
https://www.trueachievements.com/game/Bulletstorm/achievements,https://www.trueachievements.com/a147222/destructive-beat-achievement,Destructive Beat,Complete the Campaign on Very Easy or Easy Difficulty,24 Mar 11,(20),,"Destructive Beat
Complete the Campaign on Very Easy or Easy Difficulty"
https://www.trueachievements.com/game/Bulletstorm/achievements,https://www.trueachievements.com/a147239/stowaway-achievement,Stowaway,Catch a ride,24 Mar 11,(15),,"Stowaway
Catch a ride"
https://www.trueachievements.com/game/Bulletstorm/achievements,https://www.trueachievements.com/a147238/armed-and-dangerous-achievement,Armed and dangerous,"Grow as a person, experience betrayal. Again.",23 Mar 11,(15),,"Armed and dangerous
Grow as a person, experience betrayal. Again."
https://www.trueachievements.com/game/Bulletstorm/achievements,https://www.trueachievements.com/a147237/grilled-meat-achievement,Grilled Meat,Prepare a big meal using an improvised electric stove,23 Mar 11,(15),,"Grilled Meat
Prepare a big meal using an improvised electric stove"
https://www.trueachievements.com/game/Bulletstorm/achievements,https://www.trueachievements.com/a147236/minced-meat-achievement,Minced Meat,Take out the Mall's biggest customer,11 Mar 11,(15),,"Minced Meat
Take out the Mall's biggest customer"
https://www.trueachievements.com/game/Bulletstorm/achievements,https://www.trueachievements.com/a147249/big-cheese-achievement,Big Cheese,Perform 50% of the Single Player Skillshots,11 Mar 11,(30),,"Big Cheese
Perform 50% of the Single Player Skillshots"
https://www.trueachievements.com/game/Bulletstorm/achievements,https://www.trueachievements.com/a147235/weed-killer-achievement,Weed Killer,Tidy up the back yard,05 Mar 11,(15),,"Weed Killer
Tidy up the back yard"
