achievement_game_url,achievement_url,achievement_name,achievement_desc,achievement_earned,achievement_score,ta_score,ta_ratio
https://www.trueachievements.com/game/Batman-Arkham-Asylum/achievements,https://www.trueachievements.com/a35460/conundrum-cracker-achievement,Conundrum Cracker,Solve 55% of Riddler challenges,Offline,(20),,"Conundrum Cracker
Solve 55% of Riddler challenges"
https://www.trueachievements.com/game/Batman-Arkham-Asylum/achievements,https://www.trueachievements.com/a35503/crocodile-tears-achievement,Crocodile Tears,Venture into Killer Croc's lair and come out alive,Offline,(50),,"Crocodile Tears
Venture into Killer Croc's lair and come out alive"
https://www.trueachievements.com/game/Batman-Arkham-Asylum/achievements,https://www.trueachievements.com/a35461/double-trouble-achievement,Double Trouble,Defeat two Titan Henchmen at once,Offline,(25),,"Double Trouble
Defeat two Titan Henchmen at once"
https://www.trueachievements.com/game/Batman-Arkham-Asylum/achievements,https://www.trueachievements.com/a35489/freakshow-rodeo-achievement,Freakshow Rodeo,Ride Titan henchman and knock down 10 thugs (any play mode),Offline,(10),,"Freakshow Rodeo
Ride Titan henchman and knock down 10 thugs (any play mode)"
https://www.trueachievements.com/game/Batman-Arkham-Asylum/achievements,https://www.trueachievements.com/a35464/freeflow-combo-20-achievement,Freeflow Combo 20,Complete a combo of 20 moves (any play mode),Offline,(10),,"Freeflow Combo 20
Complete a combo of 20 moves (any play mode)"
https://www.trueachievements.com/game/Batman-Arkham-Asylum/achievements,https://www.trueachievements.com/a35462/mystery-solver-achievement,Mystery Solver,Solve 40% of Riddler challenges,Offline,(20),,"Mystery Solver
Solve 40% of Riddler challenges"
https://www.trueachievements.com/game/Batman-Arkham-Asylum/achievements,https://www.trueachievements.com/a35504/poisoned-ivy-achievement,Poisoned Ivy,Defeat the giant Titan Ivy plant,Offline,(50),,"Poisoned Ivy
Defeat the giant Titan Ivy plant"
https://www.trueachievements.com/game/Batman-Arkham-Asylum/achievements,https://www.trueachievements.com/a35459/resist-the-fear-achievement,Resist The Fear,Conquer the effects of the Scarecrow's fear gas,Offline,(50),,"Resist The Fear
Conquer the effects of the Scarecrow's fear gas"
https://www.trueachievements.com/game/Batman-Arkham-Asylum/achievements,https://www.trueachievements.com/a35473/ropeadopeadope-achievement,Rope-A-Dope-A-Dope,String up one henchman and drop him to surprise a second (any play mode),Offline,(10),,"Rope-A-Dope-A-Dope
String up one henchman and drop him to surprise a second (any play mode)"
https://www.trueachievements.com/game/Batman-Arkham-Asylum/achievements,https://www.trueachievements.com/a35463/solitary-confinement-achievement,Solitary Confinement,Capture and lock up Harley Quinn,Offline,(25),,"Solitary Confinement
Capture and lock up Harley Quinn"
https://www.trueachievements.com/game/BioShock-2/achievements,https://www.trueachievements.com/a61172/escape-achievement,Escape,Escaped Rapture.,Offline,(100),,"Escape
Escaped Rapture."
https://www.trueachievements.com/game/BioShock-2/achievements,https://www.trueachievements.com/a61173/heading-to-the-surface-achievement,Heading to the Surface,Headed to the surface on the side of Sinclair's escape pod.,Offline,(25),,"Heading to the Surface
Headed to the surface on the side of Sinclair's escape pod."
https://www.trueachievements.com/game/Mafia-II/achievements,https://www.trueachievements.com/a61570/sharp-suiter-achievement,Sharp Suiter,Buy your first luxury suit.,Offline,(10),,"Sharp Suiter
Buy your first luxury suit."
https://www.trueachievements.com/game/Mafia-II/achievements,https://www.trueachievements.com/a61546/chasing-the-dragon-achievement,Chasing the Dragon,Complete Chapter 12.,Offline,(40),,"Chasing the Dragon
Complete Chapter 12."
https://www.trueachievements.com/game/Mafia-II/achievements,https://www.trueachievements.com/a61552/checking-out-achievement,Checking Out,Complete Chapter 10.,Offline,(40),,"Checking Out
Complete Chapter 10."
https://www.trueachievements.com/game/Mafia-II/achievements,https://www.trueachievements.com/a61545/chop-chop-achievement,Chop Chop!,Complete Chapter 13.,Offline,(40),,"Chop Chop!
Complete Chapter 13."
https://www.trueachievements.com/game/Mafia-II/achievements,https://www.trueachievements.com/a61548/end-of-the-rainbow-achievement,End of the Rainbow,Settle the score with the Irish once and for all.,Offline,(10),,"End of the Rainbow
Settle the score with the Irish once and for all."
https://www.trueachievements.com/game/Mafia-II/achievements,https://www.trueachievements.com/a61538/finish-him-achievement,Finish Him,Finish what you started.,Offline,(50),,"Finish Him
Finish what you started."
https://www.trueachievements.com/game/Mafia-II/achievements,https://www.trueachievements.com/a61553/hey-joe-achievement,Hey Joe,Clean up after Joe.,Offline,(10),,"Hey Joe
Clean up after Joe."
https://www.trueachievements.com/game/Mafia-II/achievements,https://www.trueachievements.com/a61539/made-man-achievement,Made Man,Finish the story on Medium difficulty level or higher.,Offline,(50),,"Made Man
Finish the story on Medium difficulty level or higher."
https://www.trueachievements.com/game/Mafia-II/achievements,https://www.trueachievements.com/a61554/man-of-honor-achievement,Man of Honor,Complete Chapter 9.,Offline,(30),,"Man of Honor
Complete Chapter 9."
https://www.trueachievements.com/game/Mafia-II/achievements,https://www.trueachievements.com/a61541/men-at-work-achievement,Men at Work,Complete Chapter 14.,Offline,(50),,"Men at Work
Complete Chapter 14."
https://www.trueachievements.com/game/Mafia-II/achievements,https://www.trueachievements.com/a61547/our-good-friend-achievement,Our Good Friend,Complete Chapter 11.,Offline,(20),,"Our Good Friend
Complete Chapter 11."
https://www.trueachievements.com/game/Mafia-II/achievements,https://www.trueachievements.com/a61542/out-for-justice-achievement,Out for Justice,Learn what it means to be a Scaletta.,Offline,(30),,"Out for Justice
Learn what it means to be a Scaletta."
https://www.trueachievements.com/game/Mafia-II/achievements,https://www.trueachievements.com/a61544/the-mafia-never-forgets-achievement,The Mafia Never Forgets,Pay a visit to an old friend.,Offline,(10),,"The Mafia Never Forgets
Pay a visit to an old friend."
https://www.trueachievements.com/game/Mafia-II/achievements,https://www.trueachievements.com/a61550/wake-up-call-achievement,Wake Up Call,Help Leo out of a tricky situation without getting caught.,Offline,(10),,"Wake Up Call
Help Leo out of a tricky situation without getting caught."
https://www.trueachievements.com/game/Guitar-Hero-Warriors-of-Rock/achievements,https://www.trueachievements.com/a64536/hand-mutilator-achievement,Hand Mutilator,Survived the Black Widow,Offline,(30),,"Hand Mutilator
Survived the Black Widow"
https://www.trueachievements.com/game/Portal-2/achievements,https://www.trueachievements.com/a149569/bridge-building-achievement,Bridge Building,Complete all test chambers in the Hard-Light Surfaces co-op course,Offline,(15),,"Bridge Building
Complete all test chambers in the Hard-Light Surfaces co-op course"
https://www.trueachievements.com/game/Portal-2/achievements,https://www.trueachievements.com/a149537/bridge-over-troubling-water-achievement,Bridge Over Troubling Water,Complete the first Hard Light Bridge test,Offline,(10),,"Bridge Over Troubling Water
Complete the first Hard Light Bridge test"
https://www.trueachievements.com/game/Portal-2/achievements,https://www.trueachievements.com/a149574/cant-touch-this-achievement,Can't Touch This,Dance in front of a turret blocked by a hard light bridge in co-op,Offline,(10),,"Can't Touch This
Dance in front of a turret blocked by a hard light bridge in co-op"
https://www.trueachievements.com/game/Portal-2/achievements,https://www.trueachievements.com/a149568/confidence-building-achievement,Confidence Building,Complete all test chambers in the Mass and Velocity co-op course,Offline,(10),,"Confidence Building
Complete all test chambers in the Mass and Velocity co-op course"
https://www.trueachievements.com/game/Portal-2/achievements,https://www.trueachievements.com/a149548/dual-pit-experiment-achievement,Dual Pit Experiment,Do the same test twice,Offline,(15),,"Dual Pit Experiment
Do the same test twice"
https://www.trueachievements.com/game/Portal-2/achievements,https://www.trueachievements.com/a149581/four-ring-circus-achievement,Four Ring Circus,Enter 4 different portals without touching the ground in co-op,Offline,(25),,"Four Ring Circus
Enter 4 different portals without touching the ground in co-op"
https://www.trueachievements.com/game/Portal-2/achievements,https://www.trueachievements.com/a149573/gesticul8-achievement,Gesticul-8,Perform all 8 gestures of your own volition in co-op,Offline,(15),,"Gesticul-8
Perform all 8 gestures of your own volition in co-op"
https://www.trueachievements.com/game/Portal-2/achievements,https://www.trueachievements.com/a149550/lunacy-achievement,Lunacy,That just happened,Offline,(20),,"Lunacy
That just happened"
https://www.trueachievements.com/game/Portal-2/achievements,https://www.trueachievements.com/a149570/obstacle-building-achievement,Obstacle Building,Complete all test chambers in the Excursion Funnels co-op course,Offline,(15),,"Obstacle Building
Complete all test chambers in the Excursion Funnels co-op course"
https://www.trueachievements.com/game/Portal-2/achievements,https://www.trueachievements.com/a149541/sabotour-achievement,SaBOTour,Make a break for it,Offline,(10),,"SaBOTour
Make a break for it"
https://www.trueachievements.com/game/Portal-2/achievements,https://www.trueachievements.com/a149558/scanned-alone-achievement,Scanned Alone,Stand in a defective turret detector,Offline,(5),,"Scanned Alone
Stand in a defective turret detector"
https://www.trueachievements.com/game/Portal-2/achievements,https://www.trueachievements.com/a149542/stalemate-associate-achievement,Stalemate Associate,Press the button!,Offline,(15),,"Stalemate Associate
Press the button!"
https://www.trueachievements.com/game/Portal-2/achievements,https://www.trueachievements.com/a149545/stranger-than-friction-achievement,Stranger Than Friction,Master the Propulsion Gel,Offline,(15),,"Stranger Than Friction
Master the Propulsion Gel"
https://www.trueachievements.com/game/Portal-2/achievements,https://www.trueachievements.com/a149543/tater-tote-achievement,Tater Tote,Carry science forward,Offline,(15),,"Tater Tote
Carry science forward"
https://www.trueachievements.com/game/Portal-2/achievements,https://www.trueachievements.com/a149549/the-part-where-he-kills-you-achievement,The Part Where He Kills You,This is that part,Offline,(20),,"The Part Where He Kills You
This is that part"
https://www.trueachievements.com/game/Portal-2/achievements,https://www.trueachievements.com/a149547/tunnel-of-funnel-achievement,Tunnel of Funnel,Master the Excursion Funnel,Offline,(15),,"Tunnel of Funnel
Master the Excursion Funnel"
https://www.trueachievements.com/game/Portal-2/achievements,https://www.trueachievements.com/a149538/undiscouraged-achievement,Undiscouraged,Complete the first Thermal Discouragement Beam test,Offline,(10),,"Undiscouraged
Complete the first Thermal Discouragement Beam test"
https://www.trueachievements.com/game/Portal-2/achievements,https://www.trueachievements.com/a149544/vertically-unchallenged-achievement,Vertically Unchallenged,Master the Repulsion Gel,Offline,(15),,"Vertically Unchallenged
Master the Repulsion Gel"
https://www.trueachievements.com/game/Portal-2/achievements,https://www.trueachievements.com/a149540/wake-up-call-achievement,Wake Up Call,Survive the manual override,Offline,(5),,"Wake Up Call
Survive the manual override"
https://www.trueachievements.com/game/Portal-2/achievements,https://www.trueachievements.com/a149546/white-out-achievement,White Out,Complete the first Conversion Gel test,Offline,(15),,"White Out
Complete the first Conversion Gel test"
https://www.trueachievements.com/game/Portal-2/achievements,https://www.trueachievements.com/a149539/you-monster-achievement,You Monster,Reunite with GLaDOS,Offline,(5),,"You Monster
Reunite with GLaDOS"
https://www.trueachievements.com/game/Portal-2/achievements,https://www.trueachievements.com/a149571/you-saved-science-achievement,You Saved Science,Complete all test chambers in all courses of co-op,Offline,(100),,"You Saved Science
Complete all test chambers in all courses of co-op"
https://www.trueachievements.com/game/Alan-Wake/achievements,https://www.trueachievements.com/a60466/back-back-i-say-achievement,"Back! Back, I Say!",You bought yourself some breathing time with a flare.,Offline,(10),,"Back! Back, I Say!
You bought yourself some breathing time with a flare."
https://www.trueachievements.com/game/Alan-Wake/achievements,https://www.trueachievements.com/a60437/boob-tube-achievement,Boob Tube,You checked out some important messages.,Offline,(5),,"Boob Tube
You checked out some important messages."
https://www.trueachievements.com/game/Alan-Wake/achievements,https://www.trueachievements.com/a60472/bright-falls-finest-achievement,Bright Falls' Finest,You finally managed to make that phone call.,Offline,(20),,"Bright Falls' Finest
You finally managed to make that phone call."
https://www.trueachievements.com/game/Alan-Wake/achievements,https://www.trueachievements.com/a60440/carny-achievement,Carny,You have heartlessly knocked over five defenseless can pyramids.,Offline,(10),,"Carny
You have heartlessly knocked over five defenseless can pyramids."
https://www.trueachievements.com/game/Alan-Wake/achievements,https://www.trueachievements.com/a60454/child-of-the-elder-god-achievement,Child of the Elder God,You shone a light upon this night of otherworldly fiends.,Offline,(10),,"Child of the Elder God
You shone a light upon this night of otherworldly fiends."
https://www.trueachievements.com/game/Alan-Wake/achievements,https://www.trueachievements.com/a60448/collateral-carnage-achievement,Collateral Carnage,"20 Taken have been drowned, electrocuted, or dispatched by some other indirect means.",Offline,(20),,"Collateral Carnage
20 Taken have been drowned, electrocuted, or dispatched by some other indirect means."
https://www.trueachievements.com/game/Alan-Wake/achievements,https://www.trueachievements.com/a60462/come-one-come-all-achievement,"Come One, Come All",You wiped out four Taken with a single flare.,Offline,(10),,"Come One, Come All
You wiped out four Taken with a single flare."
https://www.trueachievements.com/game/Alan-Wake/achievements,https://www.trueachievements.com/a60434/couch-potato-achievement,Couch Potato,You have watched every single TV show on offer.,Offline,(30),,"Couch Potato
You have watched every single TV show on offer."
https://www.trueachievements.com/game/Alan-Wake/achievements,https://www.trueachievements.com/a60461/damn-good-cup-of-coffee-achievement,Damn Good Cup of Coffee,You have found 25 coffee thermoses.,Offline,(20),,"Damn Good Cup of Coffee
You have found 25 coffee thermoses."
https://www.trueachievements.com/game/Alan-Wake/achievements,https://www.trueachievements.com/a60443/departure-achievement,Departure,You completed the game on Normal difficulty.,Offline,(40),,"Departure
You completed the game on Normal difficulty."
https://www.trueachievements.com/game/Alan-Wake/achievements,https://www.trueachievements.com/a60442/energized-achievement,Energized!,You changed batteries 100 times.,Offline,(10),,"Energized!
You changed batteries 100 times."
https://www.trueachievements.com/game/Alan-Wake/achievements,https://www.trueachievements.com/a60458/finders-keepers-achievement,Finders Keepers,You have discovered five of the hidden chests.,Offline,(20),,"Finders Keepers
You have discovered five of the hidden chests."
https://www.trueachievements.com/game/Alan-Wake/achievements,https://www.trueachievements.com/a60476/float-like-a-butterfly-achievement,Float Like a Butterfly,You avoided getting hit -- with style!,Offline,(15),,"Float Like a Butterfly
You avoided getting hit -- with style!"
https://www.trueachievements.com/game/Alan-Wake/achievements,https://www.trueachievements.com/a60449/gatekeeper-achievement,Gatekeeper,"Truly, you are the master of floodgates.",Offline,(10),,"Gatekeeper
Truly, you are the master of floodgates."
https://www.trueachievements.com/game/Alan-Wake/achievements,https://www.trueachievements.com/a60429/hardboiled-writer-achievement,Hardboiled Writer,You completed the game on Hard difficulty.,Offline,(40),,"Hardboiled Writer
You completed the game on Hard difficulty."
https://www.trueachievements.com/game/Alan-Wake/achievements,https://www.trueachievements.com/a60459/iron-horse-achievement,Iron Horse,You made the train engine run out of steam.,Offline,(10),,"Iron Horse
You made the train engine run out of steam."
https://www.trueachievements.com/game/Alan-Wake/achievements,https://www.trueachievements.com/a60453/its-not-just-a-typewriter-brand-achievement,It's Not Just a Typewriter Brand,QWERTY? DVORAK? 50 Taken know it's neither.,Offline,(20),,"It's Not Just a Typewriter Brand
QWERTY? DVORAK? 50 Taken know it's neither."
https://www.trueachievements.com/game/Alan-Wake/achievements,https://www.trueachievements.com/a60474/let-there-be-light-achievement,Let There Be Light,You have restored power.,Offline,(10),,"Let There Be Light
You have restored power."
https://www.trueachievements.com/game/Alan-Wake/achievements,https://www.trueachievements.com/a60470/missed-by-a-mile-achievement,Missed by a Mile,You managed a slow-motion dodge 20 times.,Offline,(25),,"Missed by a Mile
You managed a slow-motion dodge 20 times."
https://www.trueachievements.com/game/Alan-Wake/achievements,https://www.trueachievements.com/a60473/nordic-walking-achievement,Nordic Walking,"Unlike Stucky, you enjoy incontestable health benefits. Namely, you're not dead.",Offline,(10),,"Nordic Walking
Unlike Stucky, you enjoy incontestable health benefits. Namely, you're not dead."
https://www.trueachievements.com/game/Alan-Wake/achievements,https://www.trueachievements.com/a60469/paging-mr-wake-achievement,Paging Mr. Wake,You have discovered 25 manuscript pages.,Offline,(20),,"Paging Mr. Wake
You have discovered 25 manuscript pages."
https://www.trueachievements.com/game/Alan-Wake/achievements,https://www.trueachievements.com/a60467/park-ranger-achievement,Park Ranger,You survived Elderwood National Park.,Offline,(15),,"Park Ranger
You survived Elderwood National Park."
https://www.trueachievements.com/game/Alan-Wake/achievements,https://www.trueachievements.com/a60452/perchance-to-dream-achievement,Perchance to Dream,"Oh, so THAT'S what happened.",Offline,(20),,"Perchance to Dream
Oh, so THAT'S what happened."
https://www.trueachievements.com/game/Alan-Wake/achievements,https://www.trueachievements.com/a60468/right-of-way-achievement,Right of Way,You have peeled 15 Taken off your bumper.,Offline,(10),,"Right of Way
You have peeled 15 Taken off your bumper."
https://www.trueachievements.com/game/Alan-Wake/achievements,https://www.trueachievements.com/a60465/sound-and-fury-achievement,Sound and Fury,You blasted four Taken into ashes with a single flashbang.,Offline,(10),,"Sound and Fury
You blasted four Taken into ashes with a single flashbang."
https://www.trueachievements.com/game/Alan-Wake/achievements,https://www.trueachievements.com/a60447/the-lady-of-the-light-achievement,The Lady of the Light,Cynthia Weaver has taken you to the Well-Lit Room.,Offline,(20),,"The Lady of the Light
Cynthia Weaver has taken you to the Well-Lit Room."
https://www.trueachievements.com/game/Alan-Wake/achievements,https://www.trueachievements.com/a60463/the-sixgun-scribe-achievement,The Six-Gun Scribe,You capped 100 Taken with the revolver.,Offline,(20),,"The Six-Gun Scribe
You capped 100 Taken with the revolver."
https://www.trueachievements.com/game/Alan-Wake/achievements,https://www.trueachievements.com/a60460/theyre-heeeeeere-achievement,They're Heeeeeere!,You have destroyed 20 poltergeist objects.,Offline,(20),,"They're Heeeeeere!
You have destroyed 20 poltergeist objects."
https://www.trueachievements.com/game/Alan-Wake/achievements,https://www.trueachievements.com/a60455/thunder-and-lightning-achievement,Thunder and Lightning,"50 Taken have felt your fury. Also, your flashbangs.",Offline,(20),,"Thunder and Lightning
50 Taken have felt your fury. Also, your flashbangs."
https://www.trueachievements.com/game/Alan-Wake/achievements,https://www.trueachievements.com/a60444/tornado-wrangler-achievement,Tornado Wrangler,You calmed the fury of the storm.,Offline,(20),,"Tornado Wrangler
You calmed the fury of the storm."
https://www.trueachievements.com/game/Alan-Wake/achievements,https://www.trueachievements.com/a60450/two-for-the-price-of-one-achievement,Two For the Price of One,You took out two Taken with a single barrel.,Offline,(10),,"Two For the Price of One
You took out two Taken with a single barrel."
https://www.trueachievements.com/game/Alan-Wake/achievements,https://www.trueachievements.com/a60471/under-a-thin-layer-of-skin-achievement,Under a Thin Layer of Skin,You disobeyed the park ranger's instructions.,Offline,(10),,"Under a Thin Layer of Skin
You disobeyed the park ranger's instructions."
https://www.trueachievements.com/game/Alan-Wake/achievements,https://www.trueachievements.com/a60457/wheels-within-wheels-achievement,Wheels Within Wheels,"You found the kidnapper, but what he had to say wasn't what you wanted to hear.",Offline,(20),,"Wheels Within Wheels
You found the kidnapper, but what he had to say wasn't what you wanted to hear."
https://www.trueachievements.com/game/LEGO-Harry-Potter/achievements,https://www.trueachievements.com/a61433/building-blocks-achievement,Building Blocks,Complete all the LEGO Builder tutorial levels (Single Player Only),Offline,(30),,"Building Blocks
Complete all the LEGO Builder tutorial levels (Single Player Only)"
https://www.trueachievements.com/game/FIFA-11/achievements,https://www.trueachievements.com/a66716/good-week-achievement,Good Week!,Get yourself selected in the Team of the Week in Career Mode,Offline,(15),,"Good Week!
Get yourself selected in the Team of the Week in Career Mode"
https://www.trueachievements.com/game/FIFA-11/achievements,https://www.trueachievements.com/a66709/rising-talent-achievement,Rising Talent,Complete 100 Accomplishments with your Virtual Pro,Offline,(25),,"Rising Talent
Complete 100 Accomplishments with your Virtual Pro"
https://www.trueachievements.com/game/NCAA-Football-11/achievements,https://www.trueachievements.com/a63368/speed-reader-achievement,Speed Reader,Score a touchdown on a QB Choice run play (excludes co-op).,Offline,(5),,"Speed Reader
Score a touchdown on a QB Choice run play (excludes co-op)."
https://www.trueachievements.com/game/Batman-Arkham-City/achievements,https://www.trueachievements.com/a155699/50x-combo-achievement,50x Combo,"Complete a combo of 50 moves (any play mode, any character)",Offline,(5),,"50x Combo
Complete a combo of 50 moves (any play mode, any character)"
https://www.trueachievements.com/game/Batman-Arkham-City/achievements,https://www.trueachievements.com/a155659/acid-bath-achievement,Acid Bath,"Save the damsel, but is she in distress?",Offline,(10),,"Acid Bath
Save the damsel, but is she in distress?"
https://www.trueachievements.com/game/Batman-Arkham-City/achievements,https://www.trueachievements.com/a155674/broken-toys-achievement,Broken Toys,Destroy it all,Offline,(25),,"Broken Toys
Destroy it all"
https://www.trueachievements.com/game/Batman-Arkham-City/achievements,https://www.trueachievements.com/a155698/catch-achievement,Catch,Find someone to play remote Batarang catch with,Offline,(5),,"Catch
Find someone to play remote Batarang catch with"
https://www.trueachievements.com/game/Batman-Arkham-City/achievements,https://www.trueachievements.com/a155656/chimney-sweep-achievement,Chimney Sweep,There is only one way in,Offline,(10),,"Chimney Sweep
There is only one way in"
https://www.trueachievements.com/game/Batman-Arkham-City/achievements,https://www.trueachievements.com/a155675/dial-z-for-murder-achievement,Dial Z For Murder,Stop the phone booth killer,Offline,(25),,"Dial Z For Murder
Stop the phone booth killer"
https://www.trueachievements.com/game/Batman-Arkham-City/achievements,https://www.trueachievements.com/a155657/distress-flare-achievement,Distress Flare,Answer the call for help,Offline,(5),,"Distress Flare
Answer the call for help"
https://www.trueachievements.com/game/Batman-Arkham-City/achievements,https://www.trueachievements.com/a155693/flawless-freeflow-fighter-20-achievement,Flawless Freeflow Fighter 2.0,Complete one combat challenge without taking damage (any character),Offline,(5),,"Flawless Freeflow Fighter 2.0
Complete one combat challenge without taking damage (any character)"
https://www.trueachievements.com/game/Batman-Arkham-City/achievements,https://www.trueachievements.com/a155660/im-batman-achievement,I'm Batman,Become the Bat,Offline,(10),,"I'm Batman
Become the Bat"
https://www.trueachievements.com/game/Batman-Arkham-City/achievements,https://www.trueachievements.com/a155673/mystery-stalker-achievement,Mystery Stalker,Reveal the mystery watcher,Offline,(15),,"Mystery Stalker
Reveal the mystery watcher"
https://www.trueachievements.com/game/Batman-Arkham-City/achievements,https://www.trueachievements.com/a155658/savior-achievement,Savior,Save the medical volunteers,Offline,(10),,"Savior
Save the medical volunteers"
https://www.trueachievements.com/game/Batman-Arkham-City/achievements,https://www.trueachievements.com/a155672/serial-killer-achievement,Serial Killer,Track down the serial killer,Offline,(25),,"Serial Killer
Track down the serial killer"
