achievement_game_url,achievement_url,achievement_name,achievement_desc,achievement_earned,achievement_score,ta_score,ta_ratio
https://www.trueachievements.com/game/Microsoft-Solitaire-Collection/achievements,https://www.trueachievements.com/a203754/theres-a-timed-mode-achievement,There's a Timed Mode?,Played a game of Pyramid with the timer turned on,02 Aug 15,(10),24,2.48
https://www.trueachievements.com/game/Microsoft-Solitaire-Collection/achievements,https://www.trueachievements.com/a203722/came-to-play-achievement,Came to play,Played your first Daily Challenge,01 Aug 15,(10),13,1.39
https://www.trueachievements.com/game/Microsoft-Solitaire-Collection/achievements,https://www.trueachievements.com/a203723/came-to-win-achievement,Came to win,Won your first Daily Challenge,31 Jul 15,(10),14,1.45
https://www.trueachievements.com/game/Microsoft-Solitaire-Collection/achievements,https://www.trueachievements.com/a203720/well-played-achievement,Well Played,Won your first Solitaire Game,31 Jul 15,(10),10,1.08
https://www.trueachievements.com/game/Microsoft-Solitaire-Collection/achievements,https://www.trueachievements.com/a203719/first-ones-free-achievement,First One's Free,Flipped Over Your First Card,31 Jul 15,(5),5,1.01
https://www.trueachievements.com/game/Bulletstorm-PC/achievements,https://www.trueachievements.com/a147543/wannabe-achievement,Wannabe,Perform 10 different Single Player Skillshots,20 Jun 14,(10),10,1.09
https://www.trueachievements.com/game/Bulletstorm-PC/achievements,https://www.trueachievements.com/a147514/patched-up-achievement,Patched Up,Receive a software update for your leash,20 Jun 14,(15),15,1.05
https://www.trueachievements.com/game/Bulletstorm-PC/achievements,https://www.trueachievements.com/a147515/fits-like-a-glove-achievement,Fits Like a Glove,Meet your new best friend,20 Jun 14,(15),15,1.01
https://www.trueachievements.com/game/Dark-Souls-PC/achievements,https://www.trueachievements.com/a167063/estus-flask-achievement,Estus Flask,Acquire Estus Flask.,23 Jan 14,(15),15,1.03
https://www.trueachievements.com/game/Dark-Souls-PC/achievements,https://www.trueachievements.com/a167036/enkindle-achievement,Enkindle,Light bonfire flame.,23 Jan 14,(15),15,1.0
https://www.trueachievements.com/game/Super-Meat-Boy/achievements,https://www.trueachievements.com/a68082/im-a-golden-god-achievement,I'm A Golden God!,"You got 100% on Super Meat Boy, start bragging!",02 Sep 11,(20),120,6.04
https://www.trueachievements.com/game/Super-Meat-Boy/achievements,https://www.trueachievements.com/a68084/suffragette-achievement,Suffragette,You've beaten the Cotten Alley all by yourself!,28 Aug 11,(10),48,4.8
https://www.trueachievements.com/game/Super-Meat-Boy/achievements,https://www.trueachievements.com/a68081/the-real-end-achievement,The Real End,You completed the Dark World... you are awesome.,28 Aug 11,(20),108,5.43
https://www.trueachievements.com/game/Super-Meat-Boy/achievements,https://www.trueachievements.com/a68083/the-kid-achievement,The Kid,You unlocked The Kid!,27 Aug 11,(10),44,4.44
https://www.trueachievements.com/game/Super-Meat-Boy/achievements,https://www.trueachievements.com/a68080/the-end-achievement,The End,"You beat the game!... but that's not the end, is it?",07 Aug 11,(65),181,2.79
https://www.trueachievements.com/game/Super-Meat-Boy/achievements,https://www.trueachievements.com/a68079/business-time-achievement,Business Time,You unlocked Tim by collecting 50 bandages! He's weird...,31 Jul 11,(10),36,3.63
https://www.trueachievements.com/game/Super-Meat-Boy/achievements,https://www.trueachievements.com/a68078/living-in-the-past-achievement,Living in the Past,You conquered 5 warp zones! you're so old school...,31 Jul 11,(20),46,2.33
https://www.trueachievements.com/game/Super-Meat-Boy/achievements,https://www.trueachievements.com/a68073/iron-boy-achievement,Iron Boy!,You completed a full chapter without dying! Good for you!,31 Jul 11,(10),29,2.95
https://www.trueachievements.com/game/Super-Meat-Boy/achievements,https://www.trueachievements.com/a68074/tin-boy-achievement,Tin Boy,You just beat 10 levels without getting killed! Meat Boy loves you for that!,31 Jul 11,(5),9,1.98
https://www.trueachievements.com/game/Super-Meat-Boy/achievements,https://www.trueachievements.com/a68075/sticky-fingers-achievement,Sticky fingers,You unlocked Gish by collecting 10 bandages! Go you!,31 Jul 11,(5),8,1.78
https://www.trueachievements.com/game/Super-Meat-Boy/achievements,https://www.trueachievements.com/a68076/the-commander-achievement,The Commander,You unlocked Commander Video! Double rainbow all da way!,31 Jul 11,(10),12,1.22
https://www.trueachievements.com/game/Super-Meat-Boy/achievements,https://www.trueachievements.com/a68077/nostalgia-achievement,Nostalgia,You found a warp zone! Now pay me for the door repair!,31 Jul 11,(15),15,1.0
https://www.trueachievements.com/game/Universe-at-War/achievements,https://www.trueachievements.com/a141371/crater-creator-achievement,Crater Creator,Destroy five enemy structures using any Super Weapon during skirmish battles.,Offline,(15),32,2.17
https://www.trueachievements.com/game/Universe-at-War/achievements,https://www.trueachievements.com/a141364/demolition-expert-achievement,Demolition Expert,Defeat 1 medium AI in less than 20 minutes in a skirmish battle.,Offline,(15),41,2.73
https://www.trueachievements.com/game/Universe-at-War/achievements,https://www.trueachievements.com/a141361/feel-the-burn-achievement,Feel The Burn,Defeat two medium AI players during a skirmish session.,Offline,(35),102,2.92
https://www.trueachievements.com/game/Universe-at-War/achievements,https://www.trueachievements.com/a141363/no-need-for-heroes-achievement,No Need For Heroes,Defeat 1 hard AI player in a skirmish battle without building any heroes.,Offline,(35),108,3.09
https://www.trueachievements.com/game/Universe-at-War/achievements,https://www.trueachievements.com/a141362/skirmish-king-achievement,Skirmish King,Defeat 3 hard AI players during a skirmish session.,Offline,(50),193,3.86
https://www.trueachievements.com/game/Dead-Rising/achievements,https://www.trueachievements.com/a12011/punisher-achievement,Punisher,TYPE: 1 Play REQ: Defeat at least 10 psychopaths.,13 Oct 10,(20),51,2.58
https://www.trueachievements.com/game/Halo-Reach/achievements,https://www.trueachievements.com/a60870/heat-in-the-pipe-achievement,Heat in the Pipe,"Scored 1,000,000 points in a Firefight game.",09 Oct 10,(75),124,1.65
https://www.trueachievements.com/game/Halo-Reach/achievements,https://www.trueachievements.com/a60872/game-set-match-achievement,"Game, Set, Match",Completed a Firefight set on Legendary without dying.,09 Oct 10,(25),38,1.53
https://www.trueachievements.com/game/Halo-Reach/achievements,https://www.trueachievements.com/a60874/crowd-control-achievement,Crowd Control,Earned a Killionaire medal in Firefight.,09 Oct 10,(10),13,1.39
https://www.trueachievements.com/game/Halo-Reach/achievements,https://www.trueachievements.com/a60871/lucky-me-achievement,Lucky Me,"Earned a Triple Kill while Jetpacking in Campaign, Firefight or Matchmaking.",09 Oct 10,(25),33,1.32
https://www.trueachievements.com/game/Halo-Reach/achievements,https://www.trueachievements.com/a60873/blaze-of-glory-achievement,Blaze of Glory,"Scored 200,000 points in a Firefight game.",09 Oct 10,(25),38,1.55
https://www.trueachievements.com/game/Halo-Reach/achievements,https://www.trueachievements.com/a60875/firestarter-achievement,Firestarter,"Scored 50,000 points in a Firefight game.",09 Oct 10,(10),13,1.31
https://www.trueachievements.com/game/Halo-Reach/achievements,https://www.trueachievements.com/a60893/a-spoonful-of-blamite-achievement,A Spoonful of Blamite,Killed 10 enemies in Firefight or Campaign with a supercombine explosion.,09 Oct 10,(10),15,1.55
https://www.trueachievements.com/game/Halo-Reach/achievements,https://www.trueachievements.com/a60869/if-they-came-to-hear-me-beg-achievement,If They Came to Hear Me Beg,Performed an Assassination against an Elite to survive a fall that would've been fatal.,09 Oct 10,(25),46,1.87
https://www.trueachievements.com/game/Halo-Reach/achievements,https://www.trueachievements.com/a60884/banshees-fast-and-low-achievement,"Banshees, Fast and Low",Hijacked a Banshee during the Reach Campaign.,09 Oct 10,(25),37,1.51
https://www.trueachievements.com/game/Halo-Reach/achievements,https://www.trueachievements.com/a60876/send-me-out-with-a-bang-achievement,Send Me Out... with a Bang,Completed the 10th mission on Normal or harder.,09 Oct 10,(10),12,1.27
https://www.trueachievements.com/game/Halo-Reach/achievements,https://www.trueachievements.com/a60877/the-soldier-we-needed-you-to-be-achievement,The Soldier We Needed You To Be,Completed the Campaign on Normal difficulty.,09 Oct 10,(25),32,1.31
https://www.trueachievements.com/game/Halo-Reach/achievements,https://www.trueachievements.com/a60878/this-is-not-your-grave-achievement,This is Not Your Grave...,Completed the 9th mission on Normal or harder.,09 Oct 10,(10),12,1.25
https://www.trueachievements.com/game/Halo-Reach/achievements,https://www.trueachievements.com/a60879/dust-and-echoes-achievement,Dust and Echoes,Completed the 8th mission on Normal or harder.,09 Oct 10,(10),12,1.23
https://www.trueachievements.com/game/Halo-Reach/achievements,https://www.trueachievements.com/a60880/i-didnt-train-to-be-a-pilot-achievement,I Didn't Train to Be a Pilot,Killed 3 of the anti-aircraft batteries during the 8th mission.,09 Oct 10,(10),12,1.26
https://www.trueachievements.com/game/Halo-Reach/achievements,https://www.trueachievements.com/a60881/into-the-howling-dark-achievement,Into the Howling Dark,Completed the 7th mission on Normal or harder.,09 Oct 10,(10),12,1.23
https://www.trueachievements.com/game/Halo-Reach/achievements,https://www.trueachievements.com/a60891/theyve-always-been-faster-achievement,They've Always Been Faster,Cleared the 2nd mission without setting foot in a drivable vehicle.,09 Oct 10,(25),38,1.54
https://www.trueachievements.com/game/Halo-Reach/achievements,https://www.trueachievements.com/a60894/keep-it-clean-achievement,KEEP IT CLEAN,Killed 7 Moa during the 2nd mission of the Campaign.,09 Oct 10,(5),7,1.52
https://www.trueachievements.com/game/Halo-Reach/achievements,https://www.trueachievements.com/a60882/you-flew-pretty-good-achievement,You Flew Pretty Good,Completed the 6th mission on Normal or harder.,09 Oct 10,(10),12,1.21
https://www.trueachievements.com/game/Halo-Reach/achievements,https://www.trueachievements.com/a60883/to-war-achievement,To War,Completed the 5th mission on Normal or harder.,08 Oct 10,(10),11,1.19
https://www.trueachievements.com/game/Halo-Reach/achievements,https://www.trueachievements.com/a60885/your-heresy-will-stay-your-feet-achievement,Your Heresy Will Stay Your Feet,Killed the Elite Zealot before he escaped during the 5th mission.,08 Oct 10,(25),30,1.23
https://www.trueachievements.com/game/Halo-Reach/achievements,https://www.trueachievements.com/a60909/lemme-upgrade-ya-achievement,Lemme Upgrade Ya,Advanced a Commendation to a Silver state.,08 Oct 10,(10),14,1.41
https://www.trueachievements.com/game/Halo-Reach/achievements,https://www.trueachievements.com/a60896/the-start-of-something-achievement,The Start of Something,Reached the rank of Corporal in the UNSC.,08 Oct 10,(15),16,1.07
https://www.trueachievements.com/game/Halo-Reach/achievements,https://www.trueachievements.com/a60895/i-see-you-favor-a-45-achievement,I See You Favor a .45,Killed 10 enemies in a Firefight or Campaign session with the M6G pistol.,08 Oct 10,(10),11,1.18
https://www.trueachievements.com/game/Halo-Reach/achievements,https://www.trueachievements.com/a60899/make-it-drizzle-achievement,Make it Drizzle,Purchased an item from the Armory.,08 Oct 10,(10),10,1.06
https://www.trueachievements.com/game/Halo-Reach/achievements,https://www.trueachievements.com/a60886/i-need-a-weapon-achievement,I Need a Weapon,Completed the 4th mission on Normal or harder.,08 Oct 10,(10),11,1.17
https://www.trueachievements.com/game/Halo-Reach/achievements,https://www.trueachievements.com/a60902/thats-a-knife-achievement,That's a Knife,Performed an Assassination on an enemy.,08 Oct 10,(10),10,1.09
https://www.trueachievements.com/game/Halo-Reach/achievements,https://www.trueachievements.com/a60887/protocol-dictates-action-achievement,Protocol Dictates Action,Completed the 3rd mission on Normal or harder.,08 Oct 10,(10),11,1.13
https://www.trueachievements.com/game/Halo-Reach/achievements,https://www.trueachievements.com/a60888/two-corpses-in-one-grave-achievement,Two Corpses in One Grave,Killed 2 vehicles at once with the Target Locator during the 3rd mission.,08 Oct 10,(25),34,1.39
https://www.trueachievements.com/game/Halo-Reach/achievements,https://www.trueachievements.com/a60889/were-just-getting-started-achievement,We're Just Getting Started,Completed the 2nd mission on Normal or harder.,08 Oct 10,(10),10,1.09
https://www.trueachievements.com/game/Halo-Reach/achievements,https://www.trueachievements.com/a60890/an-elegant-weapon-achievement,An Elegant Weapon...,Killed 10 enemies in a Firefight or Campaign session with the DMR.,08 Oct 10,(10),11,1.1
https://www.trueachievements.com/game/Halo-Reach/achievements,https://www.trueachievements.com/a60900/doctor-doctor-achievement,"Doctor, Doctor",Used a Health Pack to replenish life after taking body damage.,08 Oct 10,(5),5,1.04
https://www.trueachievements.com/game/Halo-Reach/achievements,https://www.trueachievements.com/a60892/swap-meet-achievement,Swap Meet,Traded weapons with an AI ally in Campaign.,08 Oct 10,(10),11,1.12
https://www.trueachievements.com/game/Splosion-Man/achievements,https://www.trueachievements.com/a34900/lay-off-the-caffeine-achievement,Lay Off the Caffeine,Splode 300 times in a single level.,13 Sep 09,(10),12,1.29
https://www.trueachievements.com/game/Splosion-Man/achievements,https://www.trueachievements.com/a34896/omaha-steaks-delicious-achievement,"Omaha Steaks®, Delicious!","Create 5,000 filets.",13 Sep 09,(15),23,1.56
https://www.trueachievements.com/game/Splosion-Man/achievements,https://www.trueachievements.com/a34899/only-gandhi-would-be-proud-achievement,Only Gandhi Would Be Proud,Complete a level without killing any Scientists.,12 Sep 09,(10),20,2.0
https://www.trueachievements.com/game/Splosion-Man/achievements,https://www.trueachievements.com/a34891/get-over-yourselves-achievement,Get Over Yourselves,"Select ""Credits"" from the ""Help & Options"" menu and watch the whole thing.",12 Sep 09,(10),13,1.3
https://www.trueachievements.com/game/Splosion-Man/achievements,https://www.trueachievements.com/a34892/master-of-controls-achievement,Master of Controls,"Change the controls around in the ""Controls"" menu.",12 Sep 09,(10),15,1.5
https://www.trueachievements.com/game/Splosion-Man/achievements,https://www.trueachievements.com/a34893/get-them-out-of-our-schools-achievement,Get Them Out of Our Schools,Eliminate 10 Scientists and stop them from spreading their filthy lies.,12 Sep 09,(10),10,1.0
https://www.trueachievements.com/game/Banjo-Tooie/achievements,https://www.trueachievements.com/a32764/after-the-storm-achievement,After The Storm,Make a rainbow.,07 Sep 09,(10),21,2.1
https://www.trueachievements.com/game/Fallout-3/achievements,https://www.trueachievements.com/a26897/the-power-of-the-atom-achievement,The Power of the Atom,"Completed ""The Power of the Atom""",Offline,(20),24,1.21
https://www.trueachievements.com/game/Uno/achievements,https://www.trueachievements.com/a11599/multiplayer-achievement,Multiplayer,"Complete a 4-player game of UNO®, in any mode, on Xbox Live.",03 May 09,(10),11,1.14
https://www.trueachievements.com/game/Banjo-Tooie/achievements,https://www.trueachievements.com/a32768/shoot-em-up-achievement,Shoot Em Up!,"Shoot 20 Ulcers, Clinkers or mines.",02 May 09,(15),25,1.71
https://www.trueachievements.com/game/SoulCalibur/achievements,https://www.trueachievements.com/a22389/conqueror-achievement,Conqueror,You have conquered 25 opponents without taking any damage in Extra Survival Mode.,Offline,(25),49,1.97
https://www.trueachievements.com/game/Banjo-Tooie/achievements,https://www.trueachievements.com/a32760/a-merry-old-soul-achievement,A Merry Old Soul,Defeat Old King Coal Boss.,Offline,(20),29,1.48
https://www.trueachievements.com/game/Banjo-Tooie/achievements,https://www.trueachievements.com/a32759/all-beaten-up-achievement,All Beaten Up,20 bad guys need to go.,Offline,(20),34,1.7
https://www.trueachievements.com/game/Banjo-Tooie/achievements,https://www.trueachievements.com/a32762/calamari-bonanza-achievement,Calamari Bonanza,Freeze all the octopi in the Lagoon.,02 May 09,(20),36,1.8
https://www.trueachievements.com/game/Banjo-Tooie/achievements,https://www.trueachievements.com/a32766/points-make-prizes-achievement,Points Make Prizes,Score 60 points in a Balloon Burst Challenge.,02 May 09,(15),28,1.89
https://www.trueachievements.com/game/SoulCalibur/achievements,https://www.trueachievements.com/a22388/ring-out-achievement,Ring Out,You have defeated all opponents using your surroundings to your advantage and forcing Ring Outs.,01 May 09,(15),30,2.03
https://www.trueachievements.com/game/SoulCalibur/achievements,https://www.trueachievements.com/a22394/edge-master-achievement,Edge Master,You have mastered all characters and defeated every opponent in Arcade Mode.,01 May 09,(30),54,1.8
https://www.trueachievements.com/game/Banjo-Tooie/achievements,https://www.trueachievements.com/a32758/treasure-hunt-achievement,Treasure Hunt,"Collect a Note, an egg, a feather and a Jinjo to get this.",01 May 09,(20),23,1.17
https://www.trueachievements.com/game/Banjo-Tooie/achievements,https://www.trueachievements.com/a32761/hatch-the-future-achievement,Hatch the Future,Separate Banjo and Kazooie or have Heggy hatch a Stop 'N' Swop egg.,01 May 09,(20),29,1.47
https://www.trueachievements.com/game/Banjo-Tooie/achievements,https://www.trueachievements.com/a32757/knocked-out-klungo-achievement,Knocked Out Klungo,Beat Klungo.,01 May 09,(20),20,1.0
https://www.trueachievements.com/game/SoulCalibur/achievements,https://www.trueachievements.com/a22390/close-call-achievement,Close Call,You have triumphed over extreme adversity and defeated an enemy with very little health.,30 Apr 09,(15),19,1.31
https://www.trueachievements.com/game/SoulCalibur/achievements,https://www.trueachievements.com/a22383/zen-warrior-achievement,Zen Warrior,Concentration and practice have led you to perfect your skills and obtain a perfect victory.,30 Apr 09,(10),10,1.03
https://www.trueachievements.com/game/SoulCalibur/achievements,https://www.trueachievements.com/a22386/noble-soul-achievement,Noble Soul,Your soul is pure and noble. A victory in Ultra Hard proves you are worthy to wield the Soul Edge.,30 Apr 09,(25),49,1.96
https://www.trueachievements.com/game/SoulCalibur/achievements,https://www.trueachievements.com/a22385/warrior-achievement,Warrior,Your skills have shown improvement now that you have defeated Arcade Mode.,30 Apr 09,(10),10,1.06
https://www.trueachievements.com/game/SoulCalibur/achievements,https://www.trueachievements.com/a22387/champion-achievement,Champion,"You have shown strength, skill, and speed by defeating Time Attack Mode in under 4 minutes.",30 Apr 09,(25),42,1.7
https://www.trueachievements.com/game/SoulCalibur/achievements,https://www.trueachievements.com/a22384/apprentice-achievement,Apprentice,You have begun your journey by playing 3 different characters.,30 Apr 09,(5),5,1.09
https://www.trueachievements.com/game/SoulCalibur/achievements,https://www.trueachievements.com/a22393/summon-suffering-achievement,Summon Suffering,"Ivy is graceful but deadly and you have mastered her signature throw, the Summon Suffering.",30 Apr 09,(20),34,1.7
https://www.trueachievements.com/game/SoulCalibur/achievements,https://www.trueachievements.com/a22391/guardian-achievement,Guardian,You have learned to counterattack your opponents' repels and parries.,30 Apr 09,(15),29,1.96
https://www.trueachievements.com/game/SoulCalibur/achievements,https://www.trueachievements.com/a22392/art-connoisseur-achievement,Art Connoisseur,You truly appreciate fine art and have viewed all the different areas in the Museum Mode.,30 Apr 09,(5),6,1.34
https://www.trueachievements.com/game/Cyber-Troopers-VirtualOn-OT/achievements,https://www.trueachievements.com/a32785/10-ranked-matches-achievement,10 RANKED MATCHES,Played 10 ranked matches.,30 Apr 09,(20),27,1.37
https://www.trueachievements.com/game/Cyber-Troopers-VirtualOn-OT/achievements,https://www.trueachievements.com/a32786/watch-a-game-achievement,WATCH A GAME,Watched one match.,30 Apr 09,(10),11,1.16
https://www.trueachievements.com/game/Cyber-Troopers-VirtualOn-OT/achievements,https://www.trueachievements.com/a32781/perfect-achievement,PERFECT,Earn a PERFECT in a Single Player or Multiplayer match.,30 Apr 09,(25),29,1.16
https://www.trueachievements.com/game/Cyber-Troopers-VirtualOn-OT/achievements,https://www.trueachievements.com/a32784/1-ranked-match-achievement,1 RANKED MATCH,Played one ranked match.,30 Apr 09,(10),12,1.26
https://www.trueachievements.com/game/Cyber-Troopers-VirtualOn-OT/achievements,https://www.trueachievements.com/a32783/rank-in-achievement,RANK IN,Uploaded a Score Attack score to rankings.,30 Apr 09,(15),18,1.21
https://www.trueachievements.com/game/Cyber-Troopers-VirtualOn-OT/achievements,https://www.trueachievements.com/a32790/tangram-achievement,TANGRAM,Defeated Tangram in Arcade mode. Letting time expire does not count as a win.,30 Apr 09,(10),12,1.29
https://www.trueachievements.com/game/Cyber-Troopers-VirtualOn-OT/achievements,https://www.trueachievements.com/a32788/vs-ajim-achievement,VS. AJIM,Battled Ajim (Ajim appears after winning repeatedly by letting time expire in Arcade mode.),30 Apr 09,(20),26,1.32
https://www.trueachievements.com/game/Cyber-Troopers-VirtualOn-OT/achievements,https://www.trueachievements.com/a32787/custom-vr-achievement,CUSTOM VR,Used a customized VR in Single Player mode.,30 Apr 09,(10),11,1.19
https://www.trueachievements.com/game/Cyber-Troopers-VirtualOn-OT/achievements,https://www.trueachievements.com/a32789/bradtos-achievement,BRADTOS,Defeated Bradtos in Arcade mode.,30 Apr 09,(10),11,1.18
https://www.trueachievements.com/game/Cyber-Troopers-VirtualOn-OT/achievements,https://www.trueachievements.com/a32782/300-hits-achievement,300 HITS,Scored a total of 300 hits in Single Player or Multiplayer mode.,30 Apr 09,(25),29,1.19
https://www.trueachievements.com/game/Cyber-Troopers-VirtualOn-OT/achievements,https://www.trueachievements.com/a32780/first-win-achievement,FIRST WIN,Defeated an opponent in Single Player or Multiplayer mode.,30 Apr 09,(20),20,1.01
https://www.trueachievements.com/game/Cyber-Troopers-VirtualOn-OT/achievements,https://www.trueachievements.com/a32779/infight-achievement,INFIGHT,Scored a close-range attack in Single Player or Multiplayer mode.,30 Apr 09,(25),25,1.02
https://www.trueachievements.com/game/Lode-Runner/achievements,https://www.trueachievements.com/a32575/treasure-hunter-achievement,Treasure Hunter,You have unearthed 20 hidden enemies and stolen their treasure,Offline,(15),50,3.33
https://www.trueachievements.com/game/Lode-Runner/achievements,https://www.trueachievements.com/a32570/big-oredeal-achievement,Big Ore-Deal,You have completed 30 of the 1P Puzzles,26 Apr 09,(20),53,2.69
https://www.trueachievements.com/game/Lode-Runner/achievements,https://www.trueachievements.com/a32566/golden-rule-achievement,Golden Rule,"In a single game and without killing an enemy, you have completed the first stage of the 1P Journey",25 Apr 09,(15),33,2.2
https://www.trueachievements.com/game/Lode-Runner/achievements,https://www.trueachievements.com/a32577/fools-gold-achievement,Fool's Gold,You have stolen all gold from trapped enemies and completed level 3-1 of the 1P Journey,25 Apr 09,(15),50,3.39
https://www.trueachievements.com/game/Lode-Runner/achievements,https://www.trueachievements.com/a32576/blast-off-achievement,Blast Off,"Without blasting, you have collected all gold and completed level 3-1 of the 1P Journey",25 Apr 09,(10),21,2.17
https://www.trueachievements.com/game/Lode-Runner/achievements,https://www.trueachievements.com/a32569/mother-lode-achievement,Mother Lode,You have collected 8 bronze medals in Hang On,25 Apr 09,(15),26,1.76
https://www.trueachievements.com/game/Lode-Runner/achievements,https://www.trueachievements.com/a32573/metal-of-honor-achievement,Metal of Honor,You have won 5 Last Man matches on Xbox LIVE,25 Apr 09,(10),27,2.7
https://www.trueachievements.com/game/Lode-Runner/achievements,https://www.trueachievements.com/a32567/gold-star-achievement,Gold Star,You have completed the first stage of the 1P Journey,24 Apr 09,(15),15,1.03
https://www.trueachievements.com/game/Leisure-Suit-Larry/achievements,https://www.trueachievements.com/a32093/networking-socialite-achievement,Networking Socialite,Meet every principle character in the game,24 Apr 09,(10),12,1.23
https://www.trueachievements.com/game/The-Dishwasher/achievements,https://www.trueachievements.com/a32259/smasher-of-zombies-achievement,Smasher of Zombies,Beat the game on normal or ninja difficulty.,24 Apr 09,(25),61,2.44
https://www.trueachievements.com/game/Halo-3/achievements,https://www.trueachievements.com/a26149/post-mortem-achievement,Post Mortem,"On Orbital, got 2 Death From the Grave medals during a ranked or social match.",19 Apr 09,(25),58,2.35
https://www.trueachievements.com/game/Leisure-Suit-Larry/achievements,https://www.trueachievements.com/a32108/broadcasting-on-top-of-the-world-achievement,Broadcasting on Top of the world,Reach the highest point in Laffer Studio,19 Apr 09,(10),21,2.18
https://www.trueachievements.com/game/Leisure-Suit-Larry/achievements,https://www.trueachievements.com/a32103/best-newcomer-achievement,Best Newcomer,Collect a total of 10 Larry Awards,19 Apr 09,(10),14,1.41
