achievement_game_url,achievement_url,achievement_name,achievement_desc,achievement_earned,achievement_score,ta_score,ta_ratio
https://www.trueachievements.com/game/Crackdown/achievements,https://www.trueachievements.com/a12503/free-runner-achievement,Free Runner,Collect 500 Agility Orbs,06 Feb 09,(50),193,3.86
https://www.trueachievements.com/game/Crackdown/achievements,https://www.trueachievements.com/a15298/street-racer-elite-achievement,Street Racer Elite,Win every Street Race using all available vehicles,05 Feb 09,(150),486,3.24
https://www.trueachievements.com/game/Crackdown/achievements,https://www.trueachievements.com/a11564/repo-man-achievement,Repo Man,Commandeer 100 gang-controlled vehicles,02 Feb 09,(10),35,3.57
https://www.trueachievements.com/game/Crackdown/achievements,https://www.trueachievements.com/a11561/street-racer-achievement,Street Racer,Win every Street Race using any vehicle(s),02 Feb 09,(20),57,2.89
https://www.trueachievements.com/game/Call-of-Duty-4/achievements,https://www.trueachievements.com/a10756/eyes-and-ears-achievement,Eyes and Ears,Find 30 enemy intel items,31 Jan 09,(20),41,2.07
https://www.trueachievements.com/game/Call-of-Duty-4/achievements,https://www.trueachievements.com/a10757/look-sharp-achievement,Look Sharp,Find 15 enemy intel items,31 Jan 09,(20),31,1.58
https://www.trueachievements.com/game/Call-of-Duty-4/achievements,https://www.trueachievements.com/a9625/man-of-the-people-achievement,Man of the People,Save the farmer,31 Jan 09,(10),12,1.27
https://www.trueachievements.com/game/Call-of-Duty-4/achievements,https://www.trueachievements.com/a10769/new-squadron-record-achievement,New Squadron Record,Complete the cargo ship mockup in less than 20 seconds,31 Jan 09,(20),30,1.5
https://www.trueachievements.com/game/Call-of-Duty-4/achievements,https://www.trueachievements.com/a9612/straight-flush-achievement,Straight Flush,Kill 5 enemies with one shot while in the AC-130 gunship,31 Jan 09,(20),22,1.1
https://www.trueachievements.com/game/Call-of-Duty-4/achievements,https://www.trueachievements.com/a10755/your-show-sucks-achievement,Your Show Sucks,Destroy all the TVs showing Al-Asad's speech,31 Jan 09,(20),37,1.87
https://www.trueachievements.com/game/Call-of-Duty-4/achievements,https://www.trueachievements.com/a9605/win-the-war-achievement,Win the War,Complete the game on any difficulty,31 Jan 09,(40),45,1.14
https://www.trueachievements.com/game/Call-of-Duty-4/achievements,https://www.trueachievements.com/a9624/bird-on-the-ground-achievement,Bird on the Ground,Shoot down an enemy helicopter with an RPG in the single player campaign,31 Jan 09,(20),29,1.46
https://www.trueachievements.com/game/Call-of-Duty-4/achievements,https://www.trueachievements.com/a9609/piggyback-ride-achievement,Piggyback Ride,Carry Cpt. MacMillian to safety,31 Jan 09,(20),22,1.11
https://www.trueachievements.com/game/Left-4-Dead/achievements,https://www.trueachievements.com/a28866/untouchables-achievement,Untouchables,No Survivors take damage after contacting the rescue vehicle.,31 Jan 09,(30),93,3.1
https://www.trueachievements.com/game/Call-of-Duty-4/achievements,https://www.trueachievements.com/a9622/ghillies-in-the-mist-achievement,Ghillies In The Mist,Complete 'All Ghillied Up' without alerting any enemies,31 Jan 09,(20),24,1.24
https://www.trueachievements.com/game/Call-of-Duty-4/achievements,https://www.trueachievements.com/a9613/down-boy-down-achievement,Down Boy Down,Survive a dog attack,31 Jan 09,(20),22,1.13
https://www.trueachievements.com/game/Call-of-Duty-4/achievements,https://www.trueachievements.com/a9610/wrong-number-achievement,Wrong Number,Find Al-Asad's safehouse,31 Jan 09,(20),22,1.1
https://www.trueachievements.com/game/Call-of-Duty-4/achievements,https://www.trueachievements.com/a9611/death-from-above-achievement,Death From Above,Operate an AC-130 gun ship,31 Jan 09,(20),21,1.07
https://www.trueachievements.com/game/Call-of-Duty-4/achievements,https://www.trueachievements.com/a9608/roadkill-achievement,Roadkill,Kill 2 enemies by blowing up a car in the single player campaign,31 Jan 09,(10),10,1.09
https://www.trueachievements.com/game/Call-of-Duty-4/achievements,https://www.trueachievements.com/a9606/daredevil-achievement,Daredevil,Kill an enemy while blinded by a flashbang in the single player campaign,31 Jan 09,(10),10,1.07
https://www.trueachievements.com/game/Call-of-Duty-4/achievements,https://www.trueachievements.com/a9614/save-the-bacon-achievement,Save the Bacon,"Protect 'War Pig', the Abrams tank",31 Jan 09,(20),21,1.06
https://www.trueachievements.com/game/Call-of-Duty-4/achievements,https://www.trueachievements.com/a9623/no-rest-for-the-weary-achievement,No Rest for the Weary,Stab an injured crawling enemy,31 Jan 09,(10),11,1.14
https://www.trueachievements.com/game/Call-of-Duty-4/achievements,https://www.trueachievements.com/a9626/four-of-a-kind-achievement,Four of a Kind,Kill 4 enemies in a row with headshots in the single player campaign,31 Jan 09,(20),21,1.08
https://www.trueachievements.com/game/Call-of-Duty-4/achievements,https://www.trueachievements.com/a10768/three-of-a-kind-achievement,Three of a Kind,Kill 3 enemies in a row with your knife in the single player campaign,30 Jan 09,(10),13,1.31
https://www.trueachievements.com/game/Call-of-Duty-4/achievements,https://www.trueachievements.com/a9615/rescue-roycewicz-achievement,Rescue Roycewicz,Save Pvt. Roycewicz on the stairs,30 Jan 09,(20),21,1.08
https://www.trueachievements.com/game/Call-of-Duty-4/achievements,https://www.trueachievements.com/a9616/dancing-in-the-dark-achievement,Dancing in the Dark,Kill the power,30 Jan 09,(20),20,1.02
https://www.trueachievements.com/game/Left-4-Dead/achievements,https://www.trueachievements.com/a28888/jump-shot-achievement,Jump Shot,Headshot a Hunter while he's leaping.,27 Jan 09,(20),28,1.44
https://www.trueachievements.com/game/Left-4-Dead/achievements,https://www.trueachievements.com/a28873/man-vs-tank-achievement,Man vs Tank,Single-handedly kill a Tank.,27 Jan 09,(30),62,2.08
https://www.trueachievements.com/game/Left-4-Dead/achievements,https://www.trueachievements.com/a28874/safety-first-achievement,Safety First,Play an entire campaign with no Survivors taking friendly fire damage.,26 Jan 09,(30),76,2.54
https://www.trueachievements.com/game/Left-4-Dead/achievements,https://www.trueachievements.com/a28882/zombicidal-maniac-achievement,Zombicidal Maniac,Survive any campaign on Expert.,26 Jan 09,(30),83,2.77
https://www.trueachievements.com/game/Dead-Rising/achievements,https://www.trueachievements.com/a12013/8-mode-achievement,∞ Mode,TYPE: 1 Play REQ: Get the true ending.,25 Jan 09,(20),40,2.04
https://www.trueachievements.com/game/Dead-Rising/achievements,https://www.trueachievements.com/a12014/unbreakable-achievement,Unbreakable,TYPE: 1 Play REQ: Get the ture ending without being knocked out.,25 Jan 09,(20),48,2.41
https://www.trueachievements.com/game/Dead-Rising/achievements,https://www.trueachievements.com/a15039/pp-collector-achievement,PP Collector,TYPE: 1 Play REQ: Photograph all PP Stickers.,24 Jan 09,(20),83,4.17
https://www.trueachievements.com/game/Dead-Rising/achievements,https://www.trueachievements.com/a12679/gourmet-achievement,Gourmet,TYPE: 1 Play REQ: Eat all types of food available in the mall.,23 Jan 09,(20),67,3.35
https://www.trueachievements.com/game/Dead-Rising/achievements,https://www.trueachievements.com/a17121/clothes-horse-achievement,Clothes Horse,TYPE: Total REQ: Change into all costumes available in the mall.,23 Jan 09,(20),71,3.58
https://www.trueachievements.com/game/Dead-Rising/achievements,https://www.trueachievements.com/a12005/sharp-dresser-achievement,Sharp Dresser,TYPE: Total REQ: Change into at least 20 different costumes.,23 Jan 09,(20),41,2.05
https://www.trueachievements.com/game/Fable-2/achievements,https://www.trueachievements.com/a29710/the-collector-achievement,The Collector,"Thanks to heroic trading skills, every mystery item in The Box of Secrets has been uncovered.",23 Jan 09,(25),48,1.95
https://www.trueachievements.com/game/Dead-Rising/achievements,https://www.trueachievements.com/a11996/outdoorsman-achievement,Outdoorsman,TYPE: 1 Play REQ: Spend at least 24 hours outdoors.,23 Jan 09,(20),55,2.77
https://www.trueachievements.com/game/Dead-Rising/achievements,https://www.trueachievements.com/a11997/indoorsman-achievement,Indoorsman,TYPE: 1 Play REQ: Spend at least 24 hours indoors.,23 Jan 09,(20),53,2.65
https://www.trueachievements.com/game/Dead-Rising/achievements,https://www.trueachievements.com/a12022/item-smasher-achievement,Item Smasher,TYPE: Total REQ: Break at least 100 items.,23 Jan 09,(20),33,1.69
https://www.trueachievements.com/game/Dead-Rising/achievements,https://www.trueachievements.com/a12006/strike-achievement,Strike!,TYPE: 1 Play REQ: Send at least 10 zombies flying with bowling balls.,23 Jan 09,(20),41,2.06
https://www.trueachievements.com/game/Dead-Rising/achievements,https://www.trueachievements.com/a12000/karate-champ-achievement,Karate Champ,"TYPE: 1 Play REQ: Defeat at least 1,000 zombies barehanded.",23 Jan 09,(20),54,2.7
https://www.trueachievements.com/game/Dead-Rising/achievements,https://www.trueachievements.com/a12012/level-max-achievement,Level Max,TYPE: Total REQ: Reach Lv. 50.,20 Jan 09,(20),44,2.23
https://www.trueachievements.com/game/Dead-Rising/achievements,https://www.trueachievements.com/a12016/humanist-achievement,Humanist,TYPE: 1 Play REQ: Get at least 10 survivors out of the mall.,20 Jan 09,(20),37,1.85
https://www.trueachievements.com/game/Dead-Rising/achievements,https://www.trueachievements.com/a12018/overtime-mode-achievement,Overtime Mode,TYPE: 1 Play REQ: Unveil all CASES and be at the heliport at noon.,20 Jan 09,(20),38,1.92
https://www.trueachievements.com/game/Dead-Rising/achievements,https://www.trueachievements.com/a12020/bullet-point-achievement,Bullet Point,"TYPE: 1 Play REQ: Fire at least 1,000 bullets.",20 Jan 09,(20),35,1.76
https://www.trueachievements.com/game/Dead-Rising/achievements,https://www.trueachievements.com/a12021/legendary-soldier-achievement,Legendary Soldier,TYPE: 1 Play REQ: Defeat at least 10 special forces soldiers.,20 Jan 09,(20),37,1.85
https://www.trueachievements.com/game/Dead-Rising/achievements,https://www.trueachievements.com/a11998/perfect-gunner-achievement,Perfect Gunner,TYPE: 1 Play REQ: Don't miss with a machine gun.,20 Jan 09,(20),51,2.58
https://www.trueachievements.com/game/Dead-Rising/achievements,https://www.trueachievements.com/a11994/hella-copter-achievement,Hella Copter,TYPE: 1 Play REQ: Successfully repel a helicopter..,20 Jan 09,(20),54,2.72
https://www.trueachievements.com/game/Dead-Rising/achievements,https://www.trueachievements.com/a12009/snuff-shot-j-achievement,Snuff Shot J,TYPE: 1 Play REQ: Successfully photograph zombie Jessie.,20 Jan 09,(20),41,2.08
https://www.trueachievements.com/game/Tom-Clancys-Rainbow-Six-Vegas/achievements,https://www.trueachievements.com/a10870/killers-rampage-achievement,Killer's Rampage,10 consecutive player kills without dying,19 Jan 09,(30),62,2.08
https://www.trueachievements.com/game/Tom-Clancys-Rainbow-Six-Vegas/achievements,https://www.trueachievements.com/a10863/tour-of-duty-achievement,Tour of Duty,Cooperatively complete all Terrorist Hunt missions,19 Jan 09,(60),138,2.31
https://www.trueachievements.com/game/Dead-Rising/achievements,https://www.trueachievements.com/a12007/snuff-shot-b-achievement,Snuff Shot B,TYPE: 1 Play REQ: Successfully photograph zombie Brad.,19 Jan 09,(20),52,2.62
https://www.trueachievements.com/game/Dead-Rising/achievements,https://www.trueachievements.com/a12025/zombie-road-achievement,Zombie Road,TYPE: 1 Play REQ: Walk over 33 feet (10 meters) on the backs of zombies using the Zombie Ride.,19 Jan 09,(20),34,1.7
https://www.trueachievements.com/game/Tom-Clancys-Rainbow-Six-Vegas/achievements,https://www.trueachievements.com/a10862/equipment-specialist-achievement,Equipment Specialist,Used all Gadgets at least once in single player Story,19 Jan 09,(20),42,2.14
https://www.trueachievements.com/game/Tom-Clancys-Rainbow-Six-Vegas/achievements,https://www.trueachievements.com/a10873/coop-hunt-novice-achievement,Coop Hunt Novice,Complete a Cooperative T-Hunt mission with at least one other player,19 Jan 09,(10),13,1.39
https://www.trueachievements.com/game/Banjo-Kazooie-Nuts-and-Bolts/achievements,https://www.trueachievements.com/a28794/arcade-pwner-achievement,Arcade Pwner,Finished all levels of Klungo’s Arcade game,18 Jan 09,(20),55,2.79
https://www.trueachievements.com/game/Banjo-Kazooie-Nuts-and-Bolts/achievements,https://www.trueachievements.com/a28772/big-banker-achievement,Big Banker,Banked 30 Jiggies in Showdown Town,18 Jan 09,(30),63,2.12
https://www.trueachievements.com/game/Banjo-Kazooie-Nuts-and-Bolts/achievements,https://www.trueachievements.com/a28784/great-balls-of-fire-achievement,Great Balls of Fire,Placed a heavy ball on the Jiggosseum flames,18 Jan 09,(20),59,2.99
https://www.trueachievements.com/game/Banjo-Kazooie-Nuts-and-Bolts/achievements,https://www.trueachievements.com/a28783/test-your-strength-achievement,Test Your Strength,Rang the bell on the Cactus o’ Strength in Banjoland,18 Jan 09,(20),49,2.47
https://www.trueachievements.com/game/Banjo-Kazooie-Nuts-and-Bolts/achievements,https://www.trueachievements.com/a28761/paint-your-wagon-achievement,Paint Your Wagon,Painted any part of your vehicle in Mumbo's Motors,18 Jan 09,(10),14,1.49
https://www.trueachievements.com/game/Banjo-Kazooie-Nuts-and-Bolts/achievements,https://www.trueachievements.com/a28782/massive-damage-achievement,Massive Damage,Broke all the legs off the Brain CPU chip in LOGBOX 720,18 Jan 09,(20),50,2.54
https://www.trueachievements.com/game/Banjo-Kazooie-Nuts-and-Bolts/achievements,https://www.trueachievements.com/a28793/loose-change-achievement,Loose Change,Collected all the Showdown Town loose change,18 Jan 09,(20),76,3.81
https://www.trueachievements.com/game/Banjo-Kazooie-Nuts-and-Bolts/achievements,https://www.trueachievements.com/a28780/bingo-achievement,Bingo!,Completed a line on the Bingo card at King Jingaling’s Palace,18 Jan 09,(20),51,2.58
https://www.trueachievements.com/game/Banjo-Kazooie-Nuts-and-Bolts/achievements,https://www.trueachievements.com/a28777/few-trophy-pts-achievement,Few Trophy Pts,Earned 10 TT Trophies from any challenges,17 Jan 09,(20),40,2.02
https://www.trueachievements.com/game/Banjo-Kazooie-Nuts-and-Bolts/achievements,https://www.trueachievements.com/a28769/let-the-games-begin-achievement,Let the Games Begin,Placed the Jiggosseum Game Globe on its plinth in Showdown Town,17 Jan 09,(15),29,1.93
https://www.trueachievements.com/game/Banjo-Kazooie-Nuts-and-Bolts/achievements,https://www.trueachievements.com/a28786/floater-in-the-pipe-achievement,Floater in the Pipe,Put the floating ball into the Test-o-Track tunnel,17 Jan 09,(20),58,2.91
https://www.trueachievements.com/game/Banjo-Kazooie-Nuts-and-Bolts/achievements,https://www.trueachievements.com/a28752/vigilante-achievement,Vigilante,Locked up a Minjo in Showdown Town,17 Jan 09,(15),32,2.18
https://www.trueachievements.com/game/Banjo-Kazooie-Nuts-and-Bolts/achievements,https://www.trueachievements.com/a28753/start-to-free-the-showdown-six-achievement,Start to Free the Showdown Six,Freed and re-housed a Jinjo in Showdown Town,17 Jan 09,(15),28,1.87
https://www.trueachievements.com/game/Banjo-Kazooie-Nuts-and-Bolts/achievements,https://www.trueachievements.com/a28789/fuzz-off-achievement,Fuzz Off!,Destroyed a patrol car in Showdown Town,17 Jan 09,(20),39,1.99
https://www.trueachievements.com/game/Banjo-Kazooie-Nuts-and-Bolts/achievements,https://www.trueachievements.com/a28760/blueprint-buyout-achievement,Blueprint Buyout,Bought a blueprint from Humba in Showdown Town,17 Jan 09,(15),22,1.52
https://www.trueachievements.com/game/Banjo-Kazooie-Nuts-and-Bolts/achievements,https://www.trueachievements.com/a28759/caught-on-camera-achievement,Caught on Camera,"Sent a video replay to a Friend over Xbox LIVE, or saved five replays",17 Jan 09,(10),23,2.32
https://www.trueachievements.com/game/Banjo-Kazooie-Nuts-and-Bolts/achievements,https://www.trueachievements.com/a28791/minimalist-achievement,Minimalist,Built a vehicle with five blocks or less and got over a set speed,17 Jan 09,(25),61,2.44
https://www.trueachievements.com/game/Banjo-Kazooie-Nuts-and-Bolts/achievements,https://www.trueachievements.com/a28792/whoa-nelly-achievement,Whoa Nelly!,Travelled in a vehicle over a set speed,17 Jan 09,(25),59,2.37
https://www.trueachievements.com/game/Banjo-Kazooie-Nuts-and-Bolts/achievements,https://www.trueachievements.com/a28790/speedy-of-the-colossus-achievement,Speedy of the Colossus,Built a vehicle with 200 blocks or more and got over a set speed,17 Jan 09,(25),74,2.98
https://www.trueachievements.com/game/Banjo-Kazooie-Nuts-and-Bolts/achievements,https://www.trueachievements.com/a28771/little-banker-achievement,Little Banker,Banked 10 Jiggies in Showdown Town,17 Jan 09,(20),34,1.74
https://www.trueachievements.com/game/Banjo-Kazooie-Nuts-and-Bolts/achievements,https://www.trueachievements.com/a28768/history-lesson-achievement,History Lesson,Placed the Banjoland Game Globe on its plinth in Showdown Town,17 Jan 09,(15),24,1.62
https://www.trueachievements.com/game/Banjo-Kazooie-Nuts-and-Bolts/achievements,https://www.trueachievements.com/a28781/stop-n-swop-achievement,Stop ‘n’ Swop,Returned a Stop ‘n’ Swop crate to Mumbo’s Motors,17 Jan 09,(0),0,3.37
https://www.trueachievements.com/game/Banjo-Kazooie-Nuts-and-Bolts/achievements,https://www.trueachievements.com/a28754/roid-rage-achievement,Roid Rage,Trained Banjo once in the Showdown Town gym,17 Jan 09,(15),26,1.74
https://www.trueachievements.com/game/Banjo-Kazooie-Nuts-and-Bolts/achievements,https://www.trueachievements.com/a28762/paparazzi-achievement,Paparazzi,"Took a photo and uploaded it to Xbox LIVE, or took five photos",17 Jan 09,(10),21,2.14
https://www.trueachievements.com/game/Banjo-Kazooie-Nuts-and-Bolts/achievements,https://www.trueachievements.com/a28788/head-for-heights-achievement,Head for Heights,"Stood on top of L.O.G.’s palace, the highest point in Showdown Town",17 Jan 09,(20),39,1.98
https://www.trueachievements.com/game/Banjo-Kazooie-Nuts-and-Bolts/achievements,https://www.trueachievements.com/a28758/bbq-beef-achievement,BBQ Beef,Got a bull into the volcanic lava in Nutty Acres,16 Jan 09,(20),41,2.07
https://www.trueachievements.com/game/Banjo-Kazooie-Nuts-and-Bolts/achievements,https://www.trueachievements.com/a28757/nextnextgen-achievement,Next-Next-Gen,Placed the LOGBOX 720 Game Globe on its plinth in Showdown Town,16 Jan 09,(10),14,1.42
https://www.trueachievements.com/game/Banjo-Kazooie-Nuts-and-Bolts/achievements,https://www.trueachievements.com/a28766/be-crateful-achievement,Be Crateful,Found and returned two crates to Mumbo’s Motors,16 Jan 09,(15),19,1.28
https://www.trueachievements.com/game/Banjo-Kazooie-Nuts-and-Bolts/achievements,https://www.trueachievements.com/a28764/my-first-bank-achievement,My First Bank,Banked your first Jiggy in Showdown Town,16 Jan 09,(10),12,1.25
https://www.trueachievements.com/game/Banjo-Kazooie-Nuts-and-Bolts/achievements,https://www.trueachievements.com/a28763/my-first-trophy-achievement,My First Trophy,Earned a TT Trophy from any challenge,16 Jan 09,(10),13,1.32
https://www.trueachievements.com/game/Banjo-Kazooie-Nuts-and-Bolts/achievements,https://www.trueachievements.com/a28765/open-nuts-achievement,Open Nuts,Placed the Nutty Acres Game Globe on its plinth in Showdown Town,16 Jan 09,(10),11,1.12
https://www.trueachievements.com/game/Banjo-Kazooie-Nuts-and-Bolts/achievements,https://www.trueachievements.com/a28767/pointless-collector-achievement,Pointless Collector,Took part in the L.O.G. badge collecting challenge at the start of the game in Spiral Mountain,16 Jan 09,(10),10,1.0
https://www.trueachievements.com/game/Tom-Clancys-Rainbow-Six-Vegas/achievements,https://www.trueachievements.com/a10876/pistoleer-achievement,Pistoleer,Kill 150 terrorists using only a Pistol,11 Jan 09,(25),36,1.45
https://www.trueachievements.com/game/Tom-Clancys-Rainbow-Six-Vegas/achievements,https://www.trueachievements.com/a10450/executioner-achievement,Executioner,Kill 500 terrorists online or offline,11 Jan 09,(30),37,1.24
https://www.trueachievements.com/game/Tom-Clancys-Rainbow-Six-Vegas/achievements,https://www.trueachievements.com/a10864/coop-story-novice-achievement,Coop Story Novice,Complete a Cooperative Story mission with at least one other player,11 Jan 09,(10),12,1.25
https://www.trueachievements.com/game/Tom-Clancys-Rainbow-Six-Vegas/achievements,https://www.trueachievements.com/a10447/basic-training-achievement,Basic Training,Achieve the rank of Private 1st Class,11 Jan 09,(5),7,1.51
https://www.trueachievements.com/game/Tom-Clancys-Rainbow-Six-Vegas/achievements,https://www.trueachievements.com/a10455/true-identity-achievement,True Identity,Used the Xbox Live Vision to create a character with your appearance,11 Jan 09,(30),61,2.04
https://www.trueachievements.com/game/Tom-Clancys-Rainbow-Six-Vegas/achievements,https://www.trueachievements.com/a10874/killers-spree-achievement,Killer's Spree,5 consecutive player kills without dying,11 Jan 09,(20),32,1.64
https://www.trueachievements.com/game/Shadow-AssaultTenchu/achievements,https://www.trueachievements.com/a26862/legendary-ninja-achievement,Legendary Ninja,Unlock all available characters.,09 Jan 09,(35),59,1.7
https://www.trueachievements.com/game/Shadow-AssaultTenchu/achievements,https://www.trueachievements.com/a26861/master-ninja-achievement,Master Ninja,Unlock Onikage.,09 Jan 09,(25),41,1.66
https://www.trueachievements.com/game/Shadow-AssaultTenchu/achievements,https://www.trueachievements.com/a26852/apprentice-achievement,Apprentice,Finish Mission 28 without being discovered by anyone.,09 Jan 09,(10),15,1.59
https://www.trueachievements.com/game/Shadow-AssaultTenchu/achievements,https://www.trueachievements.com/a26856/chunin-achievement,Chunin,Finish Mission 26 without taking any damage.,09 Jan 09,(15),23,1.57
https://www.trueachievements.com/game/Shadow-AssaultTenchu/achievements,https://www.trueachievements.com/a26860/expert-ninja-achievement,Expert Ninja,Unlock Kagura.,09 Jan 09,(20),33,1.66
https://www.trueachievements.com/game/Shadow-AssaultTenchu/achievements,https://www.trueachievements.com/a26854/genin-achievement,Genin,Finish Mission 21 with at least 60 seconds left.,09 Jan 09,(10),15,1.5
https://www.trueachievements.com/game/Heavy-Weapon/achievements,https://www.trueachievements.com/a11738/massive-destruction-achievement,Massive Destruction,Destroy 12 enemies with a single Nuke.,09 Jan 09,(20),49,2.46
https://www.trueachievements.com/game/Heavy-Weapon/achievements,https://www.trueachievements.com/a11744/comsat-uplink-achievement,ComSat Uplink,Play over Xbox Live with 3 other players for at least 1 minute.,09 Jan 09,(10),18,1.85
https://www.trueachievements.com/game/Luxor-2/achievements,https://www.trueachievements.com/a11624/golden-ankh-coin-achievement,Golden Ankh Coin,Awarded for collecting 15 or more coins in a single level.,09 Jan 09,(16),23,1.46
https://www.trueachievements.com/game/Luxor-2/achievements,https://www.trueachievements.com/a11626/5-days-of-thoth-achievement,5 Days of Thoth,Awarded for putting together 5 chain reactions.,08 Jan 09,(15),21,1.44
https://www.trueachievements.com/game/Luxor-2/achievements,https://www.trueachievements.com/a11625/pharaohs-treasury-achievement,Pharaoh's Treasury,Awarded for collecting 100 pieces of gems and jewelry.,08 Jan 09,(16),18,1.17
https://www.trueachievements.com/game/Sonic-The-Hedgehog-XBLA/achievements,https://www.trueachievements.com/a15281/perfect-win-achievement,Perfect Win,You beat the game without dying.,08 Jan 09,(40),77,1.94
https://www.trueachievements.com/game/The-Orange-Box/achievements,https://www.trueachievements.com/a11128/the-one-free-bullet-achievement,The One Free Bullet,"Beat Episode One firing exactly one bullet. Grenade, crowbar, rocket, and Gravgun kills are okay!",07 Jan 09,(40),108,2.7
https://www.trueachievements.com/game/The-Orange-Box/achievements,https://www.trueachievements.com/a11131/attica-achievement,Attica!,Destroy the gunship in the hospital attic.,07 Jan 09,(5),8,1.71
https://www.trueachievements.com/game/The-Orange-Box/achievements,https://www.trueachievements.com/a11133/elevator-action-achievement,Elevator Action,Survive long enough to get on the parking garage elevator.,06 Jan 09,(10),16,1.67
https://www.trueachievements.com/game/The-Orange-Box/achievements,https://www.trueachievements.com/a11134/zombieque-achievement,Zombie-que,Use flares to light 15 zombies on fire.,06 Jan 09,(5),15,3.19
https://www.trueachievements.com/game/The-Orange-Box/achievements,https://www.trueachievements.com/a11107/pacifist-achievement,Pacifist,Contain the Citadel core without killing any stalkers.,06 Jan 09,(10),27,2.72
https://www.trueachievements.com/game/The-Orange-Box/achievements,https://www.trueachievements.com/a11137/containment-achievement,Containment,Contain the Citadel core.,06 Jan 09,(5),8,1.61
https://www.trueachievements.com/game/The-Orange-Box/achievements,https://www.trueachievements.com/a11138/watch-your-head-achievement,Watch Your Head!,Make it to the bottom of the Citadel's main elevator shaft in one piece.,06 Jan 09,(5),7,1.57
https://www.trueachievements.com/game/Luxor-2/achievements,https://www.trueachievements.com/a11627/life-health-prosperity-achievement,Life! Health! Prosperity!,Awarded for completing a level without losing a life.,05 Jan 09,(15),15,1.0
https://www.trueachievements.com/game/Boom-Boom-Rocket/achievements,https://www.trueachievements.com/a9711/johnny-3-fingers-achievement,Johnny 3 Fingers,Unlock your first firework type.,05 Jan 09,(5),5,1.0
