achievement_game_url,achievement_url,achievement_name,achievement_desc,achievement_earned,achievement_score,ta_score,ta_ratio
https://www.trueachievements.com/game/Marvel-Ultimate-Alliance/achievements,https://www.trueachievements.com/a12612/dooms-duds-achievement,Doom's Duds,Unlocked all the outfits for Doom.,08 Nov 08,(20),38,1.92
https://www.trueachievements.com/game/Marvel-Ultimate-Alliance/achievements,https://www.trueachievements.com/a12622/gamma-garb-achievement,Gamma Garb,Unlocked all the outfits for the Hulk.,08 Nov 08,(20),35,1.79
https://www.trueachievements.com/game/Marvel-Ultimate-Alliance/achievements,https://www.trueachievements.com/a12636/battle-tested-achievement,Battle Tested,Won 1 Arcade Mode Level.,07 Nov 08,(5),10,2.03
https://www.trueachievements.com/game/Halo-3/achievements,https://www.trueachievements.com/a26139/alas-poor-yorick-achievement,"Alas, Poor Yorick","On a Legendary map, got 3 Oddball melee kills during a ranked or social match.",07 Nov 08,(25),49,1.96
https://www.trueachievements.com/game/Halo-3/achievements,https://www.trueachievements.com/a26144/look-both-ways-achievement,Look Both Ways,"On a Legendary map, got a Splatter Spree during a ranked or social match.",07 Nov 08,(50),108,2.16
https://www.trueachievements.com/game/Halo-3/achievements,https://www.trueachievements.com/a26142/flag-dropped-achievement,Flag Dropped,"On a Legendary map, got 2 flag carrier kills during a ranked or social match.",07 Nov 08,(25),41,1.64
https://www.trueachievements.com/game/Halo-3/achievements,https://www.trueachievements.com/a26166/vidmaster-challenge-7-on-7-achievement,Vidmaster Challenge: 7 on 7,Entered into a ranked or social playlist with 7 EXP on the 7th of the month.,07 Nov 08,(0),0,2.18
https://www.trueachievements.com/game/Halo-3/achievements,https://www.trueachievements.com/a26137/vidmaster-challenge-annual-achievement,Vidmaster Challenge: Annual,"After 9/25/08, completed Halo on 4-player Legendary LIVE co-op, with Iron, and everyone in Ghosts.",06 Nov 08,(0),0,2.83
https://www.trueachievements.com/game/Beautiful-Katamari/achievements,https://www.trueachievements.com/a15802/resident-online-roller-achievement,Resident Online Roller,Played online 50 times.,04 Nov 08,(40),138,3.46
https://www.trueachievements.com/game/Beautiful-Katamari/achievements,https://www.trueachievements.com/a15803/1000-cookies-achievement,"1,000 Cookies","Obtained 1,000 Cookies.",04 Nov 08,(40),122,3.07
https://www.trueachievements.com/game/Beautiful-Katamari/achievements,https://www.trueachievements.com/a15337/frequent-online-roller-achievement,Frequent Online Roller,Played online 10 times.,04 Nov 08,(10),26,2.67
https://www.trueachievements.com/game/Beautiful-Katamari/achievements,https://www.trueachievements.com/a15338/100-cookies-achievement,100 Cookies,Obtained 100 Cookies.,04 Nov 08,(5),11,2.2
https://www.trueachievements.com/game/Beautiful-Katamari/achievements,https://www.trueachievements.com/a15010/online-roller-achievement,Online Roller,Played online.,04 Nov 08,(5),9,1.85
https://www.trueachievements.com/game/Ikaruga/achievements,https://www.trueachievements.com/a20890/target-misago-achievement,Target: Misago,Destroy Misago!,04 Nov 08,(15),35,2.35
https://www.trueachievements.com/game/Ikaruga/achievements,https://www.trueachievements.com/a20898/dot-eater-achievement,Dot Eater,Clear a certain chapter in any mode without shooting at all,04 Nov 08,(10),19,1.97
https://www.trueachievements.com/game/Ikaruga/achievements,https://www.trueachievements.com/a20889/target-uzura-achievement,Target: Uzura,Destroy Uzura!,04 Nov 08,(15),28,1.88
https://www.trueachievements.com/game/Ikaruga/achievements,https://www.trueachievements.com/a20887/target-buppousou-achievement,Target: Buppousou,Destroy Buppousou!,04 Nov 08,(10),13,1.34
https://www.trueachievements.com/game/Halo-3/achievements,https://www.trueachievements.com/a26165/vidmaster-challenge-lightswitch-achievement,Vidmaster Challenge: Lightswitch,Got the rank of Lieutenant in any playlist in the new EXP progression system.,03 Nov 08,(0),0,2.1
https://www.trueachievements.com/game/Halo-3/achievements,https://www.trueachievements.com/a9880/spartan-officer-achievement,Spartan Officer,"True veteran of many battles, you are a Spartan Officer.",03 Nov 08,(25),42,1.69
https://www.trueachievements.com/game/Shadow-AssaultTenchu/achievements,https://www.trueachievements.com/a26855/spy-achievement,Spy,Finish Mission 11 without taking any damage.,02 Nov 08,(15),19,1.32
https://www.trueachievements.com/game/Marble-Blast-Ultra/achievements,https://www.trueachievements.com/a26452/blue-gem-hunt-achievement,Blue Gem Hunt,Collect a blue gem in a Marble It Up! multiplayer match.,02 Nov 08,(10),14,1.48
https://www.trueachievements.com/game/Fable-2/achievements,https://www.trueachievements.com/a27132/the-family-achievement,The Family,The Needs of The Few' has condemned thousands to death so that loved ones might live.,01 Nov 08,(25),35,1.43
https://www.trueachievements.com/game/Fable-2/achievements,https://www.trueachievements.com/a27131/the-sacrifice-achievement,The Sacrifice,The Needs of the Many' has sacrificed loved ones so that many more will live.,01 Nov 08,(25),38,1.54
https://www.trueachievements.com/game/Fable-2/achievements,https://www.trueachievements.com/a27097/the-cliff-diver-achievement,The Cliff Diver,"You, or a friend, plunged an incredible 500 feet off a cliff. Heights hold no fears for Heroes.",01 Nov 08,(5),6,1.24
https://www.trueachievements.com/game/Fable-2/achievements,https://www.trueachievements.com/a27105/the-gambler-achievement,The Gambler,A Hero won 500 gold at a tavern game in one sitting. Time for more gambling!,01 Nov 08,(10),22,2.24
https://www.trueachievements.com/game/Fable-2/achievements,https://www.trueachievements.com/a27107/the-swinger-achievement,The Swinger,"You went to bed with more than one person and... Well, why do you think we blacked out the screen?",01 Nov 08,(5),7,1.56
https://www.trueachievements.com/game/Fable-2/achievements,https://www.trueachievements.com/a27129/the-hero-of-will-achievement,The Hero of Will,You were there when the Hero of Will was recruited.,01 Nov 08,(100),119,1.19
https://www.trueachievements.com/game/Crackdown/achievements,https://www.trueachievements.com/a11562/confiscator-achievement,Confiscator,Impound all flagged vehicles and store them in the Agency Garage,01 Nov 08,(40),80,2.02
https://www.trueachievements.com/game/Halo-3/achievements,https://www.trueachievements.com/a9778/maybe-next-time-buddy-achievement,Maybe Next Time Buddy,Boarded the same vehicle within 10 seconds after being boarded in any free for all playlist.,01 Nov 08,(5),11,2.32
https://www.trueachievements.com/game/Unreal-Tournament-3/achievements,https://www.trueachievements.com/a22327/bag-of-bolts-achievement,Bag of bolts,Completed Chapter 3 in Insane.,01 Nov 08,(30),118,3.96
https://www.trueachievements.com/game/Unreal-Tournament-3/achievements,https://www.trueachievements.com/a22368/winning-is-the-only-thing-achievement,Winning is the only thing,Finished with the highest points in a Ranked match.,31 Oct 08,(10),29,2.96
https://www.trueachievements.com/game/Small-Arms/achievements,https://www.trueachievements.com/a10497/six-degrees-of-small-arms-achievement,Six Degrees of Small Arms,Awarded for playing someone online who has this Achievement,31 Oct 08,(0),0,1.48
https://www.trueachievements.com/game/Small-Arms/achievements,https://www.trueachievements.com/a11525/barbaric-recruiter-achievement,Barbaric Recruiter,Awarded for hosting a match using the Iceberg or Village level,31 Oct 08,(20),33,1.68
https://www.trueachievements.com/game/Gears-of-War/achievements,https://www.trueachievements.com/a9720/zen-and-the-art-of-reloading-achievement,Zen and the Art of Reloading,Perform 25 perfect active reloads (on any difficulty),30 Oct 08,(10),11,1.14
https://www.trueachievements.com/game/Gears-of-War/achievements,https://www.trueachievements.com/a9874/zen-and-the-art-part-2-achievement,Zen and the Art Part 2,Perform 5 perfect active reloads in a row (on any difficulty),30 Oct 08,(20),23,1.16
https://www.trueachievements.com/game/Gears-of-War/achievements,https://www.trueachievements.com/a9713/domcurious-achievement,Dom-curious,Complete 1 co-op chapter as Dominic Santiago on any difficulty,30 Oct 08,(10),13,1.39
https://www.trueachievements.com/game/Aegis-Wing/achievements,https://www.trueachievements.com/a14669/immortal-achievement,Immortal,Complete a level without dying or losing any allies.,30 Oct 08,(15),20,1.37
https://www.trueachievements.com/game/TotemBall/achievements,https://www.trueachievements.com/a11524/shiny-achievement,Shiny!,Collected 100 shiny things,29 Oct 08,(10),18,1.89
https://www.trueachievements.com/game/TotemBall/achievements,https://www.trueachievements.com/a10573/totem-trainer-achievement,Totem Trainer,Completed the training level,29 Oct 08,(10),10,1.09
https://www.trueachievements.com/game/Aegis-Wing/achievements,https://www.trueachievements.com/a14670/untouchable-achievement,Untouchable,Complete a level without taking damage.,29 Oct 08,(15),23,1.55
https://www.trueachievements.com/game/Aegis-Wing/achievements,https://www.trueachievements.com/a14663/legend-achievement,Legend,Complete the game on Insane.,29 Oct 08,(50),90,1.8
https://www.trueachievements.com/game/Aegis-Wing/achievements,https://www.trueachievements.com/a14666/teamwork-achievement,Teamwork,"Score 10,000 points while attached in a level.",29 Oct 08,(15),19,1.29
https://www.trueachievements.com/game/Aegis-Wing/achievements,https://www.trueachievements.com/a14668/exterminator-achievement,Exterminator,Destroy all enemies in a level.,29 Oct 08,(15),23,1.59
https://www.trueachievements.com/game/Aegis-Wing/achievements,https://www.trueachievements.com/a14667/diplomat-achievement,Diplomat,Complete a level without firing.,29 Oct 08,(15),22,1.51
https://www.trueachievements.com/game/Aegis-Wing/achievements,https://www.trueachievements.com/a14664/hero-achievement,Hero,Complete the game on Normal.,29 Oct 08,(25),34,1.39
https://www.trueachievements.com/game/Aegis-Wing/achievements,https://www.trueachievements.com/a14672/epic-warrior-achievement,Epic Warrior,Form a four-ship (Epic) formation.,29 Oct 08,(10),12,1.22
https://www.trueachievements.com/game/Fable-2/achievements,https://www.trueachievements.com/a27104/the-executioner-achievement,The Executioner,Are achievements really worth the lives of so many innocents? Probably.,25 Oct 08,(10),17,1.79
https://www.trueachievements.com/game/Fable-2/achievements,https://www.trueachievements.com/a27109/the-party-animal-achievement,The Party Animal,"You, or a friend, spread the joy (and pain) of intoxication to five people in under three minutes.",25 Oct 08,(10),18,1.86
https://www.trueachievements.com/game/Fable-2/achievements,https://www.trueachievements.com/a27111/the-black-knight-achievement,The Black Knight,You have turned hollow man-killing into an artform. Turns out it wasn't a flesh wound.,25 Oct 08,(10),16,1.62
https://www.trueachievements.com/game/Fable-2/achievements,https://www.trueachievements.com/a27101/the-property-magnate-achievement,The Property Magnate,A property was sold for twice its original value. Now that's good business.,25 Oct 08,(10),20,2.08
https://www.trueachievements.com/game/Fable-2/achievements,https://www.trueachievements.com/a27118/the-completionist-achievement,The Completionist,"You, or a friend, have gathered every expression, pet trick and ability available. Such dedication.",25 Oct 08,(50),132,2.64
https://www.trueachievements.com/game/Fable-2/achievements,https://www.trueachievements.com/a27115/the-ruler-of-albion-achievement,The Ruler of Albion,There is no richer Hero in the whole of Albion!,25 Oct 08,(100),163,1.63
https://www.trueachievements.com/game/Fable-2/achievements,https://www.trueachievements.com/a27117/the-goth-achievement,The Goth,Everybody knows black is the coolest colour.,25 Oct 08,(5),8,1.64
https://www.trueachievements.com/game/Fable-2/achievements,https://www.trueachievements.com/a27112/the-duellist-achievement,The Duellist,"You, or a friend, have mastered the chain attack. Lightning-quick strikes are almost unstoppable.",25 Oct 08,(10),22,2.22
https://www.trueachievements.com/game/Fable-2/achievements,https://www.trueachievements.com/a27121/the-celebrity-achievement,The Celebrity,"You, or a friend, are the most famous person in Albion. Heroes deserve to be celebrities!",25 Oct 08,(50),67,1.35
https://www.trueachievements.com/game/Fable-2/achievements,https://www.trueachievements.com/a27100/the-teaser-achievement,The Teaser,"Bandits deserve having their minds messed with, and it's also jolly good fun!",25 Oct 08,(5),11,2.22
https://www.trueachievements.com/game/Fable-2/achievements,https://www.trueachievements.com/a27116/the-hoarder-achievement,The Hoarder,"You, or a friend, found every single silver key in Albion. Some would call you obsessive. Not us.",25 Oct 08,(25),60,2.43
https://www.trueachievements.com/game/Fable-2/achievements,https://www.trueachievements.com/a27095/the-gargoyle-achievement,The Gargoyle,You uncovered the gargoyles' treasure. The cheeky rocks have mocked you for the last time.,25 Oct 08,(25),54,2.18
https://www.trueachievements.com/game/Fable-2/achievements,https://www.trueachievements.com/a27119/the-paragon-achievement,The Paragon,"You, or a friend, have taken morality to its utmost extreme. Neutral Heroes are so boring.",25 Oct 08,(15),18,1.25
https://www.trueachievements.com/game/Fable-2/achievements,https://www.trueachievements.com/a27120/the-extremist-achievement,The Extremist,"You, or a friend, have taken purity or corruption to its utmost extreme.",25 Oct 08,(15),19,1.27
https://www.trueachievements.com/game/Fable-2/achievements,https://www.trueachievements.com/a27122/the-artisan-achievement,The Artisan,"You, or a friend, showed what it takes to be a model employee.",25 Oct 08,(10),13,1.32
https://www.trueachievements.com/game/Fable-2/achievements,https://www.trueachievements.com/a27113/the-sharpshooter-achievement,The Sharpshooter,"You, or a friend, hit three targets with one shot. Reaver himself would be envious.",25 Oct 08,(10),13,1.38
https://www.trueachievements.com/game/Fable-2/achievements,https://www.trueachievements.com/a27126/the-double-threat-achievement,The Double Threat,You achieved a co-op combat bonus.,25 Oct 08,(10),14,1.41
https://www.trueachievements.com/game/Fable-2/achievements,https://www.trueachievements.com/a27114/the-archmage-achievement,The Archmage,Five human enemies were killed with one magnificent spell.,25 Oct 08,(10),13,1.31
https://www.trueachievements.com/game/Fable-2/achievements,https://www.trueachievements.com/a27125/the-companions-achievement,The Companions,You performed a perfect co-op expression. Isn't it nice playing together?,25 Oct 08,(10),19,1.94
https://www.trueachievements.com/game/Fable-2/achievements,https://www.trueachievements.com/a27127/the-philanthropist-achievement,The Philanthropist,A gift was sent to an Xbox LIVE friend. Aren't Heroes nice people?,25 Oct 08,(10),17,1.75
https://www.trueachievements.com/game/Fable-2/achievements,https://www.trueachievements.com/a27091/the-romantic-achievement,The Romantic,"You, or a friend, organised the perfect date. Let's hope it was worth the trouble.",25 Oct 08,(10),17,1.75
https://www.trueachievements.com/game/Fable-2/achievements,https://www.trueachievements.com/a27106/the-bigamist-achievement,The Bigamist,"Marriage is so great, one might as well do it twice!",25 Oct 08,(10),13,1.35
https://www.trueachievements.com/game/Fable-2/achievements,https://www.trueachievements.com/a27093/the-parent-achievement,The Parent,"You, or a friend, have contributed to the population of Albion.",24 Oct 08,(10),12,1.21
https://www.trueachievements.com/game/Fable-2/achievements,https://www.trueachievements.com/a27103/the-illustrated-hero-achievement,The Illustrated Hero,Tattoos are forever. Just like this achievement.,24 Oct 08,(5),6,1.35
https://www.trueachievements.com/game/Fable-2/achievements,https://www.trueachievements.com/a27110/the-menace-to-society-achievement,The Menace To Society,"You, or a friend, committed an act of public indecency. Oh, the shame of it.",24 Oct 08,(5),8,1.74
https://www.trueachievements.com/game/Fable-2/achievements,https://www.trueachievements.com/a27098/the-workhorse-achievement,The Workhorse,There is nothing more fulfilling than doing one's job well!,24 Oct 08,(10),10,1.07
https://www.trueachievements.com/game/Fable-2/achievements,https://www.trueachievements.com/a27108/the-pied-piper-achievement,The Pied Piper,"You, or a friend, threw a really swinging party. No one spreads joy like a Hero.",24 Oct 08,(10),12,1.24
https://www.trueachievements.com/game/Fable-2/achievements,https://www.trueachievements.com/a27092/the-spouse-achievement,The Spouse,"You, or a friend, got married! You don't remember the wedding night? You were probably drunk.",24 Oct 08,(10),11,1.14
https://www.trueachievements.com/game/Fable-2/achievements,https://www.trueachievements.com/a27128/the-hero-of-strength-achievement,The Hero of Strength,You were there when the Hero of Strength was recruited.,24 Oct 08,(100),110,1.1
https://www.trueachievements.com/game/Fable-2/achievements,https://www.trueachievements.com/a27090/the-persuader-achievement,The Persuader,"You, or a friend, convinced someone to hand over a present.",24 Oct 08,(5),5,1.11
https://www.trueachievements.com/game/Fable-2/achievements,https://www.trueachievements.com/a27124/the-muse-achievement,The Muse,The whole of Albion has heard the songs you've commissioned about yourself. Show-off.,24 Oct 08,(5),5,1.14
https://www.trueachievements.com/game/Fable-2/achievements,https://www.trueachievements.com/a27099/the-hero-of-many-names-achievement,The Hero of Many Names,"You, or a friend, changed titles. We still know who you really are. No one hides from us.",24 Oct 08,(5),5,1.11
https://www.trueachievements.com/game/Fable-2/achievements,https://www.trueachievements.com/a27094/the-hunter-achievement,The Hunter,"So, proud of yourself? Big brave hunter killed an innocent rabbit? How do you sleep at night?",24 Oct 08,(5),6,1.22
https://www.trueachievements.com/game/Fable-2/achievements,https://www.trueachievements.com/a27102/the-rogue-achievement,The Rogue,"You, or a friend, managed to steal something from a house while people stood nearby.",23 Oct 08,(5),5,1.17
https://www.trueachievements.com/game/Fable-2/achievements,https://www.trueachievements.com/a27084/the-new-hero-achievement,The New Hero,Thag the Impatient has been defeated. Albion has a new Hero.,22 Oct 08,(50),51,1.03
https://www.trueachievements.com/game/Fable-2/achievements,https://www.trueachievements.com/a27089/the-dog-trainer-achievement,The Dog Trainer,"Your dog, or another Hero's, has one more trick in his repertoire.",22 Oct 08,(5),5,1.06
https://www.trueachievements.com/game/Fable-2/achievements,https://www.trueachievements.com/a27087/the-pooch-pamperer-achievement,The Pooch Pamperer,"You, or your friend, played fetch with the dog. That little fellow just loves to play.",22 Oct 08,(5),5,1.06
https://www.trueachievements.com/game/Fable-2/achievements,https://www.trueachievements.com/a27088/the-archaeologist-achievement,The Archaeologist,"You, or a friend, excavated a site discovered by the dog and found something.",22 Oct 08,(5),5,1.03
https://www.trueachievements.com/game/Fable-2/achievements,https://www.trueachievements.com/a27096/the-chicken-kicker-achievement,The Chicken Kicker,"You, or a friend, kicked a poor, defenceless chicken. Good thing they have reinforced feathers.",22 Oct 08,(5),5,1.12
https://www.trueachievements.com/game/Fable-2/achievements,https://www.trueachievements.com/a27085/the-whippersnapper-achievement,The Whippersnapper,A child Hero collected five gold pieces for a fateful purpose.,22 Oct 08,(25),25,1.0
https://www.trueachievements.com/game/Fable-2/achievements,https://www.trueachievements.com/a27086/the-showoff-achievement,The Show-off,"You, or a friend, performed a perfect expression and impressed a villager. Heroes are such a posers.",22 Oct 08,(5),5,1.03
https://www.trueachievements.com/game/Shadow-AssaultTenchu/achievements,https://www.trueachievements.com/a26853/footsoldier-achievement,Footsoldier,Finish Mission 8 with at least 90 seconds left.,20 Oct 08,(10),13,1.31
https://www.trueachievements.com/game/Shadow-AssaultTenchu/achievements,https://www.trueachievements.com/a26859/veteran-ninja-achievement,Veteran Ninja,Pull off a 25-hit combo.(Solo Play),20 Oct 08,(20),29,1.48
https://www.trueachievements.com/game/Shadow-AssaultTenchu/achievements,https://www.trueachievements.com/a26858/jonin-achievement,Jonin,Pull off a 20-hit combo.(Solo Play),20 Oct 08,(15),21,1.45
https://www.trueachievements.com/game/Shadow-AssaultTenchu/achievements,https://www.trueachievements.com/a26857/oniwaban-achievement,Oniwaban,Pull off a 15-hit combo.(Solo Play),20 Oct 08,(15),20,1.38
https://www.trueachievements.com/game/Halo-3/achievements,https://www.trueachievements.com/a11000/mongoose-mowdown-achievement,Mongoose Mowdown,Splattered an enemy with the mongoose in a ranked free for all playlist.,20 Oct 08,(5),10,2.16
https://www.trueachievements.com/game/Halo-3/achievements,https://www.trueachievements.com/a10988/steppin-razor-achievement,Steppin' Razor,Scored a Triple Kill with the sword in a ranked free for all playlist.,18 Oct 08,(5),10,2.1
https://www.trueachievements.com/game/Halo-3/achievements,https://www.trueachievements.com/a10990/overkill-achievement,Overkill,Killed 4 enemies within 4 seconds of one another in a ranked free for all playlist.,18 Oct 08,(5),12,2.41
https://www.trueachievements.com/game/Halo-3/achievements,https://www.trueachievements.com/a9879/triple-kill-achievement,Triple Kill,Killed 3 enemies within 4 seconds of one another in a ranked free for all playlist.,18 Oct 08,(5),8,1.67
https://www.trueachievements.com/game/Beautiful-Katamari/achievements,https://www.trueachievements.com/a15809/40-cousins-achievement,40 Cousins,Found 40 Cousins.,17 Oct 08,(40),107,2.67
https://www.trueachievements.com/game/Beautiful-Katamari/achievements,https://www.trueachievements.com/a15808/30-cousins-achievement,30 Cousins,Found 30 Cousins.,17 Oct 08,(20),45,2.29
https://www.trueachievements.com/game/Beautiful-Katamari/achievements,https://www.trueachievements.com/a15805/30-presents-achievement,30 Presents,Collected 30 Presents.,17 Oct 08,(20),51,2.57
https://www.trueachievements.com/game/Beautiful-Katamari/achievements,https://www.trueachievements.com/a15817/katamari-perfectionist-achievement,Katamari Perfectionist,Completed all Requests in Normal and Time Attack Mode.,17 Oct 08,(100),239,2.39
https://www.trueachievements.com/game/Unreal-Tournament-3/achievements,https://www.trueachievements.com/a22357/thirty-minutes-or-less-achievement,Thirty minutes or less,Completed 100 VCTF matches played to at least 3 captures.,16 Oct 08,(20),108,5.44
https://www.trueachievements.com/game/Beautiful-Katamari/achievements,https://www.trueachievements.com/a14996/collection-80-achievement,Collection 80%,Rolled up 80% of the Collection.,16 Oct 08,(40),68,1.7
https://www.trueachievements.com/game/Beautiful-Katamari/achievements,https://www.trueachievements.com/a15804/20-presents-achievement,20 Presents,Collected 20 Presents.,16 Oct 08,(10),20,2.03
https://www.trueachievements.com/game/Beautiful-Katamari/achievements,https://www.trueachievements.com/a14997/all-requests-achievement,All Requests,Completed all Requests.,16 Oct 08,(60),89,1.49
https://www.trueachievements.com/game/Beautiful-Katamari/achievements,https://www.trueachievements.com/a15003/colossal-katamari-achievement,Colossal Katamari,"You made a katamari over 10,000km!",16 Oct 08,(60),84,1.4
https://www.trueachievements.com/game/Beautiful-Katamari/achievements,https://www.trueachievements.com/a15807/20-cousins-achievement,20 Cousins,Found 20 Cousins.,16 Oct 08,(10),17,1.75
https://www.trueachievements.com/game/Beautiful-Katamari/achievements,https://www.trueachievements.com/a15004/collection-60-achievement,Collection 60%,Rolled up 60% of the Collection.,16 Oct 08,(20),27,1.38
https://www.trueachievements.com/game/Beautiful-Katamari/achievements,https://www.trueachievements.com/a14998/10-presents-achievement,10 Presents,Collected 10 Presents.,16 Oct 08,(5),7,1.45
https://www.trueachievements.com/game/Beautiful-Katamari/achievements,https://www.trueachievements.com/a14995/nonstop-roller-achievement,Non-stop Roller,You roll constantly without stopping!,16 Oct 08,(30),52,1.74
https://www.trueachievements.com/game/Beautiful-Katamari/achievements,https://www.trueachievements.com/a14999/responsible-roller-achievement,Responsible Roller,You are a safe and responsible roller!,16 Oct 08,(30),66,2.22
https://www.trueachievements.com/game/Beautiful-Katamari/achievements,https://www.trueachievements.com/a15005/10-cousins-achievement,10 Cousins,Found 10 Cousins.,16 Oct 08,(5),6,1.37
https://www.trueachievements.com/game/Beautiful-Katamari/achievements,https://www.trueachievements.com/a15007/jumbo-katamari-achievement,Jumbo Katamari,You made a katamari over 500m!,16 Oct 08,(20),26,1.34
https://www.trueachievements.com/game/Beautiful-Katamari/achievements,https://www.trueachievements.com/a15008/big-katamari-achievement,Big Katamari,You made a katamari over 30m!,16 Oct 08,(10),13,1.33
https://www.trueachievements.com/game/Beautiful-Katamari/achievements,https://www.trueachievements.com/a15006/collection-40-achievement,Collection 40%,Rolled up 40% of the Collection.,16 Oct 08,(10),12,1.29
https://www.trueachievements.com/game/Beautiful-Katamari/achievements,https://www.trueachievements.com/a15009/request-x-9-achievement,Request x 9,Completed 9 Requests.,16 Oct 08,(20),25,1.29
https://www.trueachievements.com/game/Beautiful-Katamari/achievements,https://www.trueachievements.com/a15012/sorta-big-katamari-achievement,Sorta Big Katamari,You made a katamari over 5m!,16 Oct 08,(5),5,1.19
