achievement_game_url,achievement_url,achievement_name,achievement_desc,achievement_earned,achievement_score,ta_score,ta_ratio
https://www.trueachievements.com/game/LEGO-Marvel-Super-Heroes/achievements,https://www.trueachievements.com/a182560/welcome-to-level-7-achievement,Welcome to Level 7,Played as Agent Coulson,06 Jan 14,(20),,"Welcome to Level 7
Played as Agent Coulson"
https://www.trueachievements.com/game/LEGO-Marvel-Super-Heroes/achievements,https://www.trueachievements.com/a182534/red-head-detention-achievement,Red Head Detention,Completed Level 6 - Red Head Detention,06 Jan 14,(20),,"Red Head Detention
Completed Level 6 - Red Head Detention"
https://www.trueachievements.com/game/LEGO-Marvel-Super-Heroes/achievements,https://www.trueachievements.com/a182544/dont-i-know-you-achievement,Don't I Know You?,Teamed up Captain America with Human Torch (Co-op),06 Jan 14,(20),,"Don't I Know You?
Teamed up Captain America with Human Torch (Co-op)"
https://www.trueachievements.com/game/LEGO-Marvel-Super-Heroes/achievements,https://www.trueachievements.com/a182533/rebooted-resuited-achievement,"Rebooted, Resuited","Completed Level 5 - Rebooted, Resuited",06 Jan 14,(20),,"Rebooted, Resuited
Completed Level 5 - Rebooted, Resuited"
https://www.trueachievements.com/game/LEGO-Marvel-Super-Heroes/achievements,https://www.trueachievements.com/a182532/rock-up-at-the-lock-up-achievement,Rock up at the Lock up,Completed Level 4 - Rock up at the Lock up,05 Jan 14,(20),,"Rock up at the Lock up
Completed Level 4 - Rock up at the Lock up"
https://www.trueachievements.com/game/LEGO-Marvel-Super-Heroes/achievements,https://www.trueachievements.com/a182531/exploratory-laboratory-achievement,Exploratory Laboratory,Completed Level 3 - Exploratory Laboratory,05 Jan 14,(20),,"Exploratory Laboratory
Completed Level 3 - Exploratory Laboratory"
https://www.trueachievements.com/game/LEGO-Marvel-Super-Heroes/achievements,https://www.trueachievements.com/a182527/times-square-off-achievement,Times Square Off,Completed Level 2 - Times Square Off,05 Jan 14,(20),,"Times Square Off
Completed Level 2 - Times Square Off"
https://www.trueachievements.com/game/LEGO-Marvel-Super-Heroes/achievements,https://www.trueachievements.com/a182529/falling-with-style-achievement,Falling... with Style,Complete first Helicarrier skydive,05 Jan 14,(20),,"Falling... with Style
Complete first Helicarrier skydive"
https://www.trueachievements.com/game/LEGO-Marvel-Super-Heroes/achievements,https://www.trueachievements.com/a182530/sand-central-station-achievement,Sand Central Station,Completed Level 1 - Sand Central Station,05 Jan 14,(20),,"Sand Central Station
Completed Level 1 - Sand Central Station"
https://www.trueachievements.com/game/Call-of-Duty-Ghosts/achievements,https://www.trueachievements.com/a181910/federation-day-achievement,Federation Day,"Gather intel on Rorke. (Complete ""Federation Day"" on any difficulty.)",02 Jan 14,(10),,"Federation Day
Gather intel on Rorke. (Complete ""Federation Day"" on any difficulty.)"
https://www.trueachievements.com/game/Call-of-Duty-Ghosts/achievements,https://www.trueachievements.com/a181911/carbon-faceprint-achievement,Carbon Faceprint,Catch the photocopier with your face.,02 Jan 14,(10),,"Carbon Faceprint
Catch the photocopier with your face."
https://www.trueachievements.com/game/Call-of-Duty-Ghosts/achievements,https://www.trueachievements.com/a181913/legends-never-die-achievement,Legends Never Die,"Hunt down Almagro. (Complete ""Legends Never Die"" on any difficulty.)",02 Jan 14,(10),,"Legends Never Die
Hunt down Almagro. (Complete ""Legends Never Die"" on any difficulty.)"
https://www.trueachievements.com/game/Call-of-Duty-Ghosts/achievements,https://www.trueachievements.com/a181915/homecoming-achievement,Homecoming,"Defend LA. (Complete ""Homecoming"" on any difficulty.)",02 Jan 14,(10),,"Homecoming
Defend LA. (Complete ""Homecoming"" on any difficulty.)"
https://www.trueachievements.com/game/Call-of-Duty-Ghosts/achievements,https://www.trueachievements.com/a181917/struck-down-achievement,Struck Down,"Find Ajax. (Complete ""Struck Down"" on any difficulty.)",27 Dec 13,(10),,"Struck Down
Find Ajax. (Complete ""Struck Down"" on any difficulty.)"
https://www.trueachievements.com/game/Call-of-Duty-Ghosts/achievements,https://www.trueachievements.com/a181918/no-mans-land-achievement,No Man's Land,"Make it to San Diego. (Complete ""No Man's Land"" on any difficulty.)",27 Dec 13,(10),,"No Man's Land
Make it to San Diego. (Complete ""No Man's Land"" on any difficulty.)"
https://www.trueachievements.com/game/Call-of-Duty-Ghosts/achievements,https://www.trueachievements.com/a181919/brave-new-world-achievement,Brave New World,"Rendez-vous in Fort Santa Monica. (Complete ""Brave New World"" on any difficulty.)",26 Dec 13,(10),,"Brave New World
Rendez-vous in Fort Santa Monica. (Complete ""Brave New World"" on any difficulty.)"
https://www.trueachievements.com/game/Call-of-Duty-Ghosts/achievements,https://www.trueachievements.com/a181920/liberty-wall-achievement,Liberty Wall,Take down both attack helicopters in Brave New World.,26 Dec 13,(10),,"Liberty Wall
Take down both attack helicopters in Brave New World."
https://www.trueachievements.com/game/Call-of-Duty-Ghosts/achievements,https://www.trueachievements.com/a181921/ghost-stories-achievement,Ghost Stories,"Escape. (Complete ""Ghost Stories"" on any difficulty.)",26 Dec 13,(5),,"Ghost Stories
Escape. (Complete ""Ghost Stories"" on any difficulty.)"
https://www.trueachievements.com/game/Call-of-Duty-Ghosts/achievements,https://www.trueachievements.com/a181922/spatial-awareness-achievement,Spatial Awareness,Kill your first enemy in the Call of Duty® Ghosts campaign.,26 Dec 13,(10),,"Spatial Awareness
Kill your first enemy in the Call of Duty® Ghosts campaign."
https://www.trueachievements.com/game/Tom-Clancys-Splinter-Cell-Blacklist/achievements,https://www.trueachievements.com/a178743/asset-retrieval-achievement,Asset Retrieval,Completed Safehouse,26 Oct 13,(10),,"Asset Retrieval
Completed Safehouse"
https://www.trueachievements.com/game/Grand-Theft-Auto-V-Xbox-360/achievements,https://www.trueachievements.com/a179414/off-the-plane-achievement,Off the Plane,You completed the GTA Online Introduction.,07 Oct 13,(5),,"Off the Plane
You completed the GTA Online Introduction."
https://www.trueachievements.com/game/Tom-Clancys-Splinter-Cell-Blacklist/achievements,https://www.trueachievements.com/a178742/shadownet-online-achievement,ShadowNet Online,Logged into ShadowNet for the first time,22 Sep 13,(5),,"ShadowNet Online
Logged into ShadowNet for the first time"
https://www.trueachievements.com/game/Grand-Theft-Auto-V-Xbox-360/achievements,https://www.trueachievements.com/a179382/welcome-to-los-santos-achievement,Welcome to Los Santos,You repo'd a car and raced it through the heart of a sun-soaked metropolis.,18 Sep 13,(10),,"Welcome to Los Santos
You repo'd a car and raced it through the heart of a sun-soaked metropolis."
https://www.trueachievements.com/game/Tom-Clancys-Splinter-Cell-Blacklist/achievements,https://www.trueachievements.com/a178741/distraction-tactician-achievement,Distraction Tactician,Stealthily took down an enemy who'd been lured by sound,21 Aug 13,(10),,"Distraction Tactician
Stealthily took down an enemy who'd been lured by sound"
https://www.trueachievements.com/game/Tom-Clancys-Splinter-Cell-Blacklist/achievements,https://www.trueachievements.com/a178764/evidence-concealed-achievement,Evidence Concealed,Hid 5 bodies in containers,21 Aug 13,(10),,"Evidence Concealed
Hid 5 bodies in containers"
https://www.trueachievements.com/game/Skyrim/achievements,https://www.trueachievements.com/a157026/dragon-soul-achievement,Dragon Soul,Absorb a dragon soul,29 Jul 13,(10),,"Dragon Soul
Absorb a dragon soul"
https://www.trueachievements.com/game/Skyrim/achievements,https://www.trueachievements.com/a157025/apprentice-achievement,Apprentice,Reach Level 5,29 Jul 13,(5),,"Apprentice
Reach Level 5"
https://www.trueachievements.com/game/Skyrim/achievements,https://www.trueachievements.com/a157027/bleak-falls-barrow-achievement,Bleak Falls Barrow,"Complete ""Bleak Falls Barrow""",29 Jul 13,(10),,"Bleak Falls Barrow
Complete ""Bleak Falls Barrow"""
https://www.trueachievements.com/game/Skyrim/achievements,https://www.trueachievements.com/a157028/blessed-achievement,Blessed,Select a Standing Stone blessing,22 Jul 13,(10),,"Blessed
Select a Standing Stone blessing"
https://www.trueachievements.com/game/The-Walking-Dead-Xbox-360/achievements,https://www.trueachievements.com/a163970/rock-and-a-hard-place-achievement,Rock and a Hard Place,Chose between two sons.,11 Jun 13,(10),,"Rock and a Hard Place
Chose between two sons."
https://www.trueachievements.com/game/The-Walking-Dead-Xbox-360/achievements,https://www.trueachievements.com/a163971/in-your-charge-achievement,In Your Charge,Found help and are now responsible for a little girl.,11 Jun 13,(10),,"In Your Charge
Found help and are now responsible for a little girl."
https://www.trueachievements.com/game/The-Walking-Dead-Xbox-360/achievements,https://www.trueachievements.com/a163972/adventures-in-babysitting-achievement,Adventures in Babysitting,Escaped from Sandra and met Clementine.,11 Jun 13,(10),,"Adventures in Babysitting
Escaped from Sandra and met Clementine."
https://www.trueachievements.com/game/The-Walking-Dead-Xbox-360/achievements,https://www.trueachievements.com/a163973/out-of-the-frying-pan-achievement,Out of the Frying Pan,"Freed from your cuffs, but...",11 Jun 13,(10),,"Out of the Frying Pan
Freed from your cuffs, but..."
https://www.trueachievements.com/game/WWE-13/achievements,https://www.trueachievements.com/a170119/paint-tool-magician-achievement,Paint tool magician,Use the paint tool to create and add an original logo to any original creation.,13 Apr 13,(10),,"Paint tool magician
Use the paint tool to create and add an original logo to any original creation."
https://www.trueachievements.com/game/WWE-13/achievements,https://www.trueachievements.com/a170100/its-like-a-car-crash-achievement,It's like a car crash!,Exhibition - Break the barricade in 2 places in the same match (single player).,13 Apr 13,(20),,"It's like a car crash!
Exhibition - Break the barricade in 2 places in the same match (single player)."
https://www.trueachievements.com/game/WWE-13/achievements,https://www.trueachievements.com/a170079/the-ring-is-my-home-achievement,The ring is my home!,Play a match in an arena created in Create an Arena mode.,13 Apr 13,(15),,"The ring is my home!
Play a match in an arena created in Create an Arena mode."
https://www.trueachievements.com/game/WWE-13/achievements,https://www.trueachievements.com/a170118/check-out-my-entrance-video-achievement,Check out my Entrance Video!,Create an entrance movie in Create an Entrance mode,08 Apr 13,(10),,"Check out my Entrance Video!
Create an entrance movie in Create an Entrance mode"
https://www.trueachievements.com/game/WWE-13/achievements,https://www.trueachievements.com/a170121/the-champ-is-here-achievement,The champ is here!,Create an original championship belt in the Championship Editor.,08 Apr 13,(10),,"The champ is here!
Create an original championship belt in the Championship Editor."
https://www.trueachievements.com/game/WWE-13/achievements,https://www.trueachievements.com/a170080/arena-designer-achievement,Arena designer,Create an arena in Create an Arena mode.,08 Apr 13,(10),,"Arena designer
Create an arena in Create an Arena mode."
https://www.trueachievements.com/game/WWE-13/achievements,https://www.trueachievements.com/a170089/off-script-scenario-cleared-achievement,Off Script scenario cleared!,"Clear the ""Off Script"" chapter.",08 Apr 13,(45),,"Off Script scenario cleared!
Clear the ""Off Script"" chapter."
https://www.trueachievements.com/game/WWE-13/achievements,https://www.trueachievements.com/a170114/ring-hooligan-achievement,Ring hooligan,"Break a total of 20 tables, ladders, and chairs by attacking with them (single player).",08 Apr 13,(15),,"Ring hooligan
Break a total of 20 tables, ladders, and chairs by attacking with them (single player)."
https://www.trueachievements.com/game/WWE-13/achievements,https://www.trueachievements.com/a170091/road-to-wrestlemania-xv-cleared-achievement,Road to WrestleMania XV cleared!,"Clear the ""Road to WrestleMania XV"" chapter.",07 Apr 13,(40),,"Road to WrestleMania XV cleared!
Clear the ""Road to WrestleMania XV"" chapter."
https://www.trueachievements.com/game/WWE-13/achievements,https://www.trueachievements.com/a170093/mankind-scenario-cleared-achievement,Mankind scenario cleared!,"Clear the ""Mankind"" chapter.",07 Apr 13,(30),,"Mankind scenario cleared!
Clear the ""Mankind"" chapter."
https://www.trueachievements.com/game/WWE-13/achievements,https://www.trueachievements.com/a170097/the-great-one-scenario-cleared-achievement,The Great One scenario cleared!,"Clear the ""The Great One"" chapter.",07 Apr 13,(25),,"The Great One scenario cleared!
Clear the ""The Great One"" chapter."
https://www.trueachievements.com/game/WWE-13/achievements,https://www.trueachievements.com/a170103/brothers-of-destruction-cleared-achievement,Brothers of Destruction cleared!,"Clear the ""Brothers of Destruction"" chapter.",07 Apr 13,(20),,"Brothers of Destruction cleared!
Clear the ""Brothers of Destruction"" chapter."
https://www.trueachievements.com/game/WWE-13/achievements,https://www.trueachievements.com/a170081/austin-316-scenario-cleared-achievement,Austin 3:16 scenario cleared!,"Clear the ""Austin 3:16"" chapter.",06 Apr 13,(15),,"Austin 3:16 scenario cleared!
Clear the ""Austin 3:16"" chapter."
https://www.trueachievements.com/game/WWE-13/achievements,https://www.trueachievements.com/a170082/rise-of-dx-scenario-cleared-achievement,Rise of D-X scenario cleared!,"Clear the ""Rise of D-X"" chapter.",06 Apr 13,(10),,"Rise of D-X scenario cleared!
Clear the ""Rise of D-X"" chapter."
https://www.trueachievements.com/game/WWE-13/achievements,https://www.trueachievements.com/a170083/oh-my-achievement,Oh my!,Break the announcer table with an OMG Move (single player).,06 Apr 13,(15),,"Oh my!
Break the announcer table with an OMG Move (single player)."
https://www.trueachievements.com/game/WWE-13/achievements,https://www.trueachievements.com/a170084/comeback-achievement,Comeback!,Successfully perform a Comeback Move (single player).,06 Apr 13,(20),,"Comeback!
Successfully perform a Comeback Move (single player)."
https://www.trueachievements.com/game/WWE-13/achievements,https://www.trueachievements.com/a170109/fighting-smart-achievement,Fighting smart,Exhibition - Attack the same body part 10 or more times in a single match (single player).,06 Apr 13,(15),,"Fighting smart
Exhibition - Attack the same body part 10 or more times in a single match (single player)."
https://www.trueachievements.com/game/WWE-13/achievements,https://www.trueachievements.com/a170116/reached-the-ropes-achievement,Reached the ropes!,Crawl to the ropes during a submission (Single Player).,05 Apr 13,(10),,"Reached the ropes!
Crawl to the ropes during a submission (Single Player)."
https://www.trueachievements.com/game/WWE-13/achievements,https://www.trueachievements.com/a170095/watch-out-achievement,Watch out!,Successfully reverse a Finisher (single player).,05 Apr 13,(30),,"Watch out!
Successfully reverse a Finisher (single player)."
https://www.trueachievements.com/game/Resident-Evil-6-Xbox-360/achievements,https://www.trueachievements.com/a168133/one-is-better-than-none-achievement,One Is Better Than None,Purchase one skill.,10 Feb 13,(15),,"One Is Better Than None
Purchase one skill."
https://www.trueachievements.com/game/Resident-Evil-6-Xbox-360/achievements,https://www.trueachievements.com/a168134/gone-to-hell-achievement,Gone to Hell,Complete Chapter 1 in Leon's campaign.,10 Feb 13,(15),,"Gone to Hell
Complete Chapter 1 in Leon's campaign."
https://www.trueachievements.com/game/Resident-Evil-6-Xbox-360/achievements,https://www.trueachievements.com/a168130/silent-killer-achievement,Silent Killer,Use a stealth attack to take down five enemies.,10 Feb 13,(15),,"Silent Killer
Use a stealth attack to take down five enemies."
https://www.trueachievements.com/game/Resident-Evil-6-Xbox-360/achievements,https://www.trueachievements.com/a168163/lifesaver-achievement,Lifesaver,Help or rescue your partner ten times.,10 Feb 13,(15),,"Lifesaver
Help or rescue your partner ten times."
https://www.trueachievements.com/game/Resident-Evil-6-Xbox-360/achievements,https://www.trueachievements.com/a168135/the-longest-night-achievement,The Longest Night,Complete the tutorial.,10 Feb 13,(10),,"The Longest Night
Complete the tutorial."
https://www.trueachievements.com/game/Tom-Clancys-Ghost-Recon-Future-Soldier/achievements,https://www.trueachievements.com/a164253/highvalue-target-achievement,High-Value Target,"Kill a member of the dev team, or kill someone who has",27 Jan 13,(5),,"High-Value Target
Kill a member of the dev team, or kill someone who has"
https://www.trueachievements.com/game/Tom-Clancys-Ghost-Recon-Future-Soldier/achievements,https://www.trueachievements.com/a164277/blood-brother-achievement,Blood Brother,Rescue the Georgian Spec Ops,26 Jan 13,(20),,"Blood Brother
Rescue the Georgian Spec Ops"
https://www.trueachievements.com/game/Call-of-Duty-Black-Ops-II/achievements,https://www.trueachievements.com/a171199/welcome-to-the-club-achievement,Welcome to the Club,Reach Sergeant (Level 10) in multiplayer Public Match.,19 Jan 13,(10),,"Welcome to the Club
Reach Sergeant (Level 10) in multiplayer Public Match."
https://www.trueachievements.com/game/Solitaire-Collection/achievements,https://www.trueachievements.com/a166670/first-ones-free-achievement,First One's Free,Flipped over your first card,09 Jan 13,(10),,"First One's Free
Flipped over your first card"
https://www.trueachievements.com/game/Assassins-Creed/achievements,https://www.trueachievements.com/a10238/the-blood-of-a-corrupt-merchant-achievement,The Blood of a Corrupt Merchant,"You've slain Tamir, Black Market Merchant in Damascus.",04 Jan 13,(25),,"The Blood of a Corrupt Merchant
You've slain Tamir, Black Market Merchant in Damascus."
https://www.trueachievements.com/game/Tom-Clancys-Splinter-Cell-Conviction/achievements,https://www.trueachievements.com/a61113/survivor-achievement,Survivor,Battle your CO-OP teammate and survive,02 Jan 13,(10),,"Survivor
Battle your CO-OP teammate and survive"
https://www.trueachievements.com/game/Tom-Clancys-Splinter-Cell-Conviction/achievements,https://www.trueachievements.com/a61112/modzok-proving-grounds-achievement,Modzok Proving Grounds,"Complete CO-OP Story ""Modzok Proving Grounds"" on any difficulty",02 Jan 13,(20),,"Modzok Proving Grounds
Complete CO-OP Story ""Modzok Proving Grounds"" on any difficulty"
https://www.trueachievements.com/game/Tom-Clancys-Splinter-Cell-Conviction/achievements,https://www.trueachievements.com/a61111/yastreb-complex-achievement,Yastreb Complex,"Complete CO-OP Story ""Yastreb Complex"" on any difficulty",02 Jan 13,(20),,"Yastreb Complex
Complete CO-OP Story ""Yastreb Complex"" on any difficulty"
https://www.trueachievements.com/game/Tom-Clancys-Ghost-Recon-Future-Soldier/achievements,https://www.trueachievements.com/a164276/must-come-down-achievement,...Must Come Down.,Destroy the plane with the weapons system on board while it is in flight,01 Jan 13,(20),,"...Must Come Down.
Destroy the plane with the weapons system on board while it is in flight"
https://www.trueachievements.com/game/Tom-Clancys-Ghost-Recon-Future-Soldier/achievements,https://www.trueachievements.com/a164275/eod-achievement,EOD,Destroy the Russian weapons transfer station,31 Dec 12,(20),,"EOD
Destroy the Russian weapons transfer station"
https://www.trueachievements.com/game/Tom-Clancys-Ghost-Recon-Future-Soldier/achievements,https://www.trueachievements.com/a164274/source-control-achievement,Source Control,Secure the VIP and transfer them to the exfiltration team,31 Dec 12,(20),,"Source Control
Secure the VIP and transfer them to the exfiltration team"
https://www.trueachievements.com/game/Tom-Clancys-Ghost-Recon-Future-Soldier/achievements,https://www.trueachievements.com/a164273/precious-cargo-achievement,Precious Cargo,Secure the VIP and transfer him to the exfiltration team,31 Dec 12,(20),,"Precious Cargo
Secure the VIP and transfer him to the exfiltration team"
https://www.trueachievements.com/game/Borderlands/achievements,https://www.trueachievements.com/a37886/down-in-front-achievement,Down in Front!,Killed 15 enemies with the Soldier's action skill,22 Dec 12,(15),,"Down in Front!
Killed 15 enemies with the Soldier's action skill"
https://www.trueachievements.com/game/LEGO-Batman-2-DC-Super-Heroes/achievements,https://www.trueachievements.com/a165254/super-hero-achievement,Super Hero,Get Super Hero in all levels (Single Player Only),16 Dec 12,(50),,"Super Hero
Get Super Hero in all levels (Single Player Only)"
https://www.trueachievements.com/game/LEGO-Batman-2-DC-Super-Heroes/achievements,https://www.trueachievements.com/a165262/the-house-of-luthor-achievement,The House of Luthor,"Obtain more than 10,100,000,000 Studs (Single Player Only)",16 Dec 12,(20),,"The House of Luthor
Obtain more than 10,100,000,000 Studs (Single Player Only)"
https://www.trueachievements.com/game/LEGO-Batman-2-DC-Super-Heroes/achievements,https://www.trueachievements.com/a165257/justice-league-achievement,Justice League,Unlock all Justice League characters (Single Player Only),16 Dec 12,(20),,"Justice League
Unlock all Justice League characters (Single Player Only)"
https://www.trueachievements.com/game/Halo-4/achievements,https://www.trueachievements.com/a170028/requiem-achievement,Requiem,Completed mission 2 on any difficulty.,23 Nov 12,(10),,"Requiem
Completed mission 2 on any difficulty."
https://www.trueachievements.com/game/Halo-4/achievements,https://www.trueachievements.com/a170027/dawn-achievement,Dawn,Completed mission 1 on any difficulty.,22 Nov 12,(10),,"Dawn
Completed mission 1 on any difficulty."
https://www.trueachievements.com/game/LEGO-Lord-of-the-Rings/achievements,https://www.trueachievements.com/a171769/on-the-precious-achievement,On the Precious...,Complete 'Taming Gollum'.,18 Nov 12,(25),,"On the Precious...
Complete 'Taming Gollum'."
https://www.trueachievements.com/game/LEGO-Lord-of-the-Rings/achievements,https://www.trueachievements.com/a171768/lets-hunt-some-orc-achievement,Let's hunt some Orc!,Complete 'Amon Hen'.,18 Nov 12,(25),,"Let's hunt some Orc!
Complete 'Amon Hen'."
https://www.trueachievements.com/game/LEGO-Lord-of-the-Rings/achievements,https://www.trueachievements.com/a171794/that-is-a-rare-gift-achievement,That is a rare gift.,Reach the top of Amon Hen without being caught once by Boromir. (Single Player Only),18 Nov 12,(10),,"That is a rare gift.
Reach the top of Amon Hen without being caught once by Boromir. (Single Player Only)"
https://www.trueachievements.com/game/LEGO-Lord-of-the-Rings/achievements,https://www.trueachievements.com/a171767/this-is-no-mine-its-a-tomb-achievement,This is no mine... it's a tomb.,Complete 'The Mines of Moria'.,17 Nov 12,(25),,"This is no mine... it's a tomb.
Complete 'The Mines of Moria'."
https://www.trueachievements.com/game/LEGO-Lord-of-the-Rings/achievements,https://www.trueachievements.com/a171766/the-long-way-around-achievement,The long way around.,Complete 'The Pass of Caradhras'.,17 Nov 12,(25),,"The long way around.
Complete 'The Pass of Caradhras'."
https://www.trueachievements.com/game/LEGO-Lord-of-the-Rings/achievements,https://www.trueachievements.com/a171803/great-where-are-we-going-achievement,Great! ...Where are we going?,Form The Fellowship of the Ring.,17 Nov 12,(5),,"Great! ...Where are we going?
Form The Fellowship of the Ring."
https://www.trueachievements.com/game/LEGO-Lord-of-the-Rings/achievements,https://www.trueachievements.com/a171765/that-is-no-trinket-you-carry-achievement,That is no trinket you carry.,Complete 'Weathertop'.,17 Nov 12,(25),,"That is no trinket you carry.
Complete 'Weathertop'."
https://www.trueachievements.com/game/LEGO-Lord-of-the-Rings/achievements,https://www.trueachievements.com/a171764/its-a-dangerous-business-achievement,It's a dangerous business...,Complete 'The Black Rider'.,17 Nov 12,(25),,"It's a dangerous business...
Complete 'The Black Rider'."
https://www.trueachievements.com/game/LEGO-Lord-of-the-Rings/achievements,https://www.trueachievements.com/a171762/the-strength-of-men-failed-achievement,The strength of Men failed.,Complete 'Prologue'.,17 Nov 12,(25),,"The strength of Men failed.
Complete 'Prologue'."
https://www.trueachievements.com/game/LEGO-Lord-of-the-Rings/achievements,https://www.trueachievements.com/a171791/im-glad-to-be-with-you-achievement,I'm glad to be with you.,Complete a level in co-op.,17 Nov 12,(10),,"I'm glad to be with you.
Complete a level in co-op."
https://www.trueachievements.com/game/LEGO-Batman-2-DC-Super-Heroes/achievements,https://www.trueachievements.com/a165250/extra-extra-achievement,Extra! Extra!,Collect all the red bricks (Single Player Only),17 Nov 12,(20),,"Extra! Extra!
Collect all the red bricks (Single Player Only)"
https://www.trueachievements.com/game/LEGO-Batman-2-DC-Super-Heroes/achievements,https://www.trueachievements.com/a165248/halfway-through-achievement,Halfway Through,Get 50% (Single Player Only),17 Nov 12,(50),,"Halfway Through
Get 50% (Single Player Only)"
https://www.trueachievements.com/game/LEGO-Batman-2-DC-Super-Heroes/achievements,https://www.trueachievements.com/a165259/supervillain-achievement,Super-Villain,Unlock all the Bosses (Single Player Only),16 Nov 12,(20),,"Super-Villain
Unlock all the Bosses (Single Player Only)"
