achievement_game_url,achievement_url,achievement_name,achievement_desc,achievement_earned,achievement_score,ta_score,ta_ratio
https://www.trueachievements.com/game/Virtua-Tennis-2009/achievements,https://www.trueachievements.com/a33342/breaking-the-speed-limit-achievement,Breaking the Speed Limit,Hit a serve over 200kph/124.28miles,12 May 14,(15),15,1.06
https://www.trueachievements.com/game/NBA-2K12/achievements,https://www.trueachievements.com/a155409/hey-mr-dj-achievement,Hey Mr. DJ,Create a 2K Beats Playlist.,06 May 14,(10),16,1.61
https://www.trueachievements.com/game/Dragon-Age-Origins/achievements,https://www.trueachievements.com/a37931/persuasive-achievement,Persuasive,Succeeded at five difficult Persuasion attempts,03 May 14,(10),12,1.27
https://www.trueachievements.com/game/NBA-2K12/achievements,https://www.trueachievements.com/a155378/my-every-day-player-achievement,My Every Day Player,Become a starter in the NBA in My Player Mode.,30 Apr 14,(20),31,1.58
https://www.trueachievements.com/game/NBA-2K12/achievements,https://www.trueachievements.com/a155377/my-player-of-the-game-achievement,My Player of the Game,Be named Player of the Game (in an NBA game) in My Player mode.,30 Apr 14,(20),31,1.55
https://www.trueachievements.com/game/NBA-2K12/achievements,https://www.trueachievements.com/a155407/sprite-slam-cam-achievement,Sprite Slam Cam,Get the Sprite Slam Cam replay after a dunk with LeBron James.,30 Apr 14,(15),23,1.54
https://www.trueachievements.com/game/NBA-2K12/achievements,https://www.trueachievements.com/a155372/dawn-of-an-era-achievement,Dawn of an Era,Get drafted as a lottery pick in the NBA draft in My Player mode.,29 Apr 14,(15),22,1.47
https://www.trueachievements.com/game/Tiger-Woods-PGA-TOUR-08/achievements,https://www.trueachievements.com/a14112/pole-dancer-achievement,Pole Dancer,Hit the flag pole.,28 Apr 14,(20),22,1.13
https://www.trueachievements.com/game/Tiger-Woods-PGA-TOUR-08/achievements,https://www.trueachievements.com/a14116/afraid-of-the-dark-achievement,Afraid of the Dark,Land the ball inches from the hole.,28 Apr 14,(20),20,1.01
https://www.trueachievements.com/game/Banjo-Kazooie-Nuts-and-Bolts/achievements,https://www.trueachievements.com/a28757/nextnextgen-achievement,Next-Next-Gen,Placed the LOGBOX 720 Game Globe on its plinth in Showdown Town,20 Apr 14,(10),14,1.42
https://www.trueachievements.com/game/Banjo-Kazooie-Nuts-and-Bolts/achievements,https://www.trueachievements.com/a28764/my-first-bank-achievement,My First Bank,Banked your first Jiggy in Showdown Town,20 Apr 14,(10),12,1.25
https://www.trueachievements.com/game/Banjo-Kazooie-Nuts-and-Bolts/achievements,https://www.trueachievements.com/a28763/my-first-trophy-achievement,My First Trophy,Earned a TT Trophy from any challenge,20 Apr 14,(10),13,1.32
https://www.trueachievements.com/game/Banjo-Kazooie-Nuts-and-Bolts/achievements,https://www.trueachievements.com/a28761/paint-your-wagon-achievement,Paint Your Wagon,Painted any part of your vehicle in Mumbo's Motors,19 Apr 14,(10),14,1.49
https://www.trueachievements.com/game/Banjo-Kazooie-Nuts-and-Bolts/achievements,https://www.trueachievements.com/a28765/open-nuts-achievement,Open Nuts,Placed the Nutty Acres Game Globe on its plinth in Showdown Town,19 Apr 14,(10),11,1.12
https://www.trueachievements.com/game/Banjo-Kazooie-Nuts-and-Bolts/achievements,https://www.trueachievements.com/a28767/pointless-collector-achievement,Pointless Collector,Took part in the L.O.G. badge collecting challenge at the start of the game in Spiral Mountain,19 Apr 14,(10),10,1.0
https://www.trueachievements.com/game/Sniper-Ghost-Warrior-2/achievements,https://www.trueachievements.com/a174609/balls-of-steel-achievement,Balls Of Steel,"Completed any single player mission without using med kits, but taking damage",19 Apr 14,(20),23,1.16
https://www.trueachievements.com/game/Battlefield-4-Xbox-360/achievements,https://www.trueachievements.com/a180735/fish-achievement,Fish,Complete the Campaign on Easy,14 Apr 14,(20),30,1.5
https://www.trueachievements.com/game/Battlefield-4-Xbox-360/achievements,https://www.trueachievements.com/a180741/guns-at-dawn-achievement,Guns at dawn,Complete the Suez mission in the Campaign,14 Apr 14,(20),28,1.4
https://www.trueachievements.com/game/Battlefield-4-Xbox-360/achievements,https://www.trueachievements.com/a180749/wolf-achievement,Wolf,Complete the Campaign on Normal,14 Apr 14,(25),41,1.66
https://www.trueachievements.com/game/Battlefield-4-Xbox-360/achievements,https://www.trueachievements.com/a180744/took-a-casual-look-around-achievement,Took a casual look around,Find 9 collectibles in the Campaign,14 Apr 14,(20),26,1.33
https://www.trueachievements.com/game/Battlefield-4-Xbox-360/achievements,https://www.trueachievements.com/a180760/for-the-cause-achievement,For the cause,Sacrifice Hannah to save the Valkyrie in the Campaign,14 Apr 14,(20),32,1.63
https://www.trueachievements.com/game/Battlefield-4-Xbox-360/achievements,https://www.trueachievements.com/a180733/guardian-of-the-fleet-achievement,Guardian of the fleet,Obtain 6 000 points in the Suez mission in the Campaign,14 Apr 14,(25),36,1.46
https://www.trueachievements.com/game/Battlefield-4-Xbox-360/achievements,https://www.trueachievements.com/a180742/antediluvian-achievement,Antediluvian,Complete the Tashgar mission in the Campaign,14 Apr 14,(20),27,1.37
https://www.trueachievements.com/game/Battlefield-4-Xbox-360/achievements,https://www.trueachievements.com/a180732/demolition-man-achievement,Demolition man,Obtain 15 000 points in the Tashgar mission in the Campaign,14 Apr 14,(25),41,1.64
https://www.trueachievements.com/game/Battlefield-4-Xbox-360/achievements,https://www.trueachievements.com/a180740/dead-by-dawn-achievement,Dead by dawn,Complete the Kunlun Mountains mission in the Campaign,14 Apr 14,(20),25,1.29
https://www.trueachievements.com/game/Battlefield-4-Xbox-360/achievements,https://www.trueachievements.com/a180757/shawshank-achievement,Shawshank,Get 5 kills with Shank in the Kunlun Mountains mission in the Campaign,14 Apr 14,(20),27,1.36
https://www.trueachievements.com/game/Battlefield-4-Xbox-360/achievements,https://www.trueachievements.com/a180737/braving-the-storm-achievement,Braving the storm,Complete the Singapore mission in the Campaign,14 Apr 14,(20),25,1.25
https://www.trueachievements.com/game/Battlefield-4-Xbox-360/achievements,https://www.trueachievements.com/a180743/it-was-on-the-way-achievement,It was on the way...,Find 6 collectibles in the Campaign,14 Apr 14,(20),23,1.18
https://www.trueachievements.com/game/AFL-Live-2/achievements,https://www.trueachievements.com/a179224/coleman-medal-superstar-achievement,Coleman Medal Superstar,One of your players wins the Coleman Medal in AFL Live 2. Unlocks Victorian Team.,13 Apr 14,(30),50,1.67
https://www.trueachievements.com/game/AFL-Live-2/achievements,https://www.trueachievements.com/a179226/ron-evans-medal-ace-achievement,Ron Evans Medal Ace,One of your players wins the NAB Rising Star in AFL Live 2.,13 Apr 14,(30),75,2.52
https://www.trueachievements.com/game/AFL-Live-2/achievements,https://www.trueachievements.com/a179225/norm-smith-medal-champion-achievement,Norm Smith Medal Champion,One of your players wins the Norm Smith Medal in AFL Live 2. Unlocks TIO Stadium.,13 Apr 14,(30),51,1.7
https://www.trueachievements.com/game/Battlefield-4-Xbox-360/achievements,https://www.trueachievements.com/a180739/the-fall-of-a-titan-achievement,The fall of a Titan,Complete the South China Sea mission in the Campaign,13 Apr 14,(20),23,1.17
https://www.trueachievements.com/game/Battlefield-4-Xbox-360/achievements,https://www.trueachievements.com/a180729/terror-of-the-deep-achievement,Terror of the deep,Obtain 11 000 points in the South China Sea mission in the Campaign,13 Apr 14,(25),29,1.16
https://www.trueachievements.com/game/Battlefield-4-Xbox-360/achievements,https://www.trueachievements.com/a180738/wolves-in-sheeps-clothing-achievement,Wolves in sheep's clothing,Complete the Shanghai mission in the Campaign,11 Apr 14,(20),22,1.12
https://www.trueachievements.com/game/Battlefield-4-Xbox-360/achievements,https://www.trueachievements.com/a180726/stumbled-over-it-achievement,Stumbled over it,Find 3 collectibles in the Campaign,11 Apr 14,(20),21,1.08
https://www.trueachievements.com/game/Battlefield-4-Xbox-360/achievements,https://www.trueachievements.com/a180725/fishing-in-baku-achievement,Fishing in Baku,Complete the Baku mission in the Campaign,11 Apr 14,(20),21,1.06
https://www.trueachievements.com/game/Battlefield-4-Xbox-360/achievements,https://www.trueachievements.com/a180736/dunns-pride-achievement,Dunn's pride,Obtain 7 000 points in the Baku mission in the Campaign,11 Apr 14,(25),39,1.56
https://www.trueachievements.com/game/State-of-Decay/achievements,https://www.trueachievements.com/a177137/torn-apart-achievement,Torn Apart,Got killed by zombies.,09 Apr 14,(10),12,1.22
https://www.trueachievements.com/game/State-of-Decay/achievements,https://www.trueachievements.com/a177123/watch-the-birdie-achievement,Watch the Birdie!,Distracted zombies to complete an objective.,09 Apr 14,(10),11,1.14
https://www.trueachievements.com/game/State-of-Decay/achievements,https://www.trueachievements.com/a177141/gotta-enjoy-the-little-things-achievement,Gotta Enjoy the Little Things,Used a car door to kill a zombie.,09 Apr 14,(10),10,1.07
https://www.trueachievements.com/game/Dragons-Dogma/achievements,https://www.trueachievements.com/a164412/writ-large-achievement,Writ Large,Received a writ from the castle.,09 Apr 14,(10),12,1.26
https://www.trueachievements.com/game/Dragons-Dogma/achievements,https://www.trueachievements.com/a164434/foreign-recruit-achievement,Foreign Recruit,Enlisted a pawn to your party from beyond the rift.,09 Apr 14,(5),5,1.13
https://www.trueachievements.com/game/FIFA-14-Xbox-360/achievements,https://www.trueachievements.com/a179299/passing-on-the-armband-achievement,Passing on the Armband,Change your captain in FUT,05 Apr 14,(5),9,1.89
https://www.trueachievements.com/game/FIFA-14-Xbox-360/achievements,https://www.trueachievements.com/a179315/started-from-the-bottom-achievement,Started From The Bottom…,Reach EA SPORTS Football Club Level 15,03 Apr 14,(30),37,1.25
https://www.trueachievements.com/game/Halo-Anniversary/achievements,https://www.trueachievements.com/a158185/what-have-we-here-achievement,What have we here?,Read a terminal.,28 Mar 14,(10),10,1.07
https://www.trueachievements.com/game/FIFA-14-Xbox-360/achievements,https://www.trueachievements.com/a179282/control-achievement,Control,Change your formation from the Team Management tile in Squad during your Career,26 Mar 14,(5),10,2.02
https://www.trueachievements.com/game/FIFA-14-Xbox-360/achievements,https://www.trueachievements.com/a179302/silverware-achievement,Silverware,Win a trophy as a Team Manager in Career,26 Mar 14,(50),87,1.74
https://www.trueachievements.com/game/AFL-Live-2/achievements,https://www.trueachievements.com/a179213/best-of-the-best-achievement,Best Of The Best,Win the AFL Premiership in AFL Live 2. Unlocks Bendigo Stadium.,24 Mar 14,(35),55,1.58
https://www.trueachievements.com/game/AFL-Live-2/achievements,https://www.trueachievements.com/a179205/winning-attitude-achievement,Winning Attitude,Finish a season in career mode with a majority of games won in AFL Live 2.,24 Mar 14,(15),23,1.53
https://www.trueachievements.com/game/AFL-Live-2/achievements,https://www.trueachievements.com/a179201/bonecrunching-display-achievement,Bonecrunching Display,Perform 10 tackles in a game of AFL Live 2.,24 Mar 14,(15),17,1.18
https://www.trueachievements.com/game/AFL-Live-2/achievements,https://www.trueachievements.com/a179200/aerial-display-achievement,Aerial Display,Player takes 3 or more marks inside the attacking 50m line during one match of AFL Live 2.,24 Mar 14,(15),15,1.02
https://www.trueachievements.com/game/AFL-Live-2/achievements,https://www.trueachievements.com/a179199/kicked-the-six-pack-achievement,Kicked The Six Pack,Player kicks six or more goals in one match of AFL Live 2.,24 Mar 14,(15),15,1.05
https://www.trueachievements.com/game/AFL-Live-2/achievements,https://www.trueachievements.com/a179203/wicked-win-achievement,Wicked Win,Win by more than 100 points in AFL Live 2. Unlocks Tru Blu Team.,24 Mar 14,(15),18,1.25
https://www.trueachievements.com/game/AFL-Live-2/achievements,https://www.trueachievements.com/a179209/a-good-warm-up-achievement,A Good Warm Up,Win the NAB Cup in any mode in AFL Live 2.,24 Mar 14,(15),21,1.41
https://www.trueachievements.com/game/Battlefield-4-Xbox-360/achievements,https://www.trueachievements.com/a180766/call-me-sir-achievement,"Call me ""Sir""",Reach rank 25.,14 Mar 14,(50),81,1.62
https://www.trueachievements.com/game/Battlefield-4-Xbox-360/achievements,https://www.trueachievements.com/a181535/2-wheels-achievement,2 Wheels,Get a kill with the Dirtbike,11 Mar 14,(20),38,1.92
https://www.trueachievements.com/game/Battlefield-4-Xbox-360/achievements,https://www.trueachievements.com/a181537/death-from-above-achievement,Death From Above,Get a kill with the bomber,09 Mar 14,(20),38,1.91
https://www.trueachievements.com/game/The-Walking-Dead-Season-Two-Xbox-360/achievements,https://www.trueachievements.com/a185075/reunion-achievement,Reunion,"Completed Episode 2: ""A House Divided""",06 Mar 14,(25),28,1.15
https://www.trueachievements.com/game/The-Walking-Dead-Season-Two-Xbox-360/achievements,https://www.trueachievements.com/a185074/past-midnight-achievement,Past Midnight,Settled things with a new friend.,06 Mar 14,(15),17,1.15
https://www.trueachievements.com/game/The-Walking-Dead-Season-Two-Xbox-360/achievements,https://www.trueachievements.com/a185073/old-friends-achievement,Old Friends,Made it to the ski lodge.,06 Mar 14,(10),11,1.14
https://www.trueachievements.com/game/The-Walking-Dead-Season-Two-Xbox-360/achievements,https://www.trueachievements.com/a185072/a-stranger-achievement,A Stranger,Met someone on a bridge.,06 Mar 14,(10),11,1.14
https://www.trueachievements.com/game/The-Walking-Dead-Season-Two-Xbox-360/achievements,https://www.trueachievements.com/a185071/over-the-bridge-achievement,Over the Bridge,Found a way across the water.,06 Mar 14,(10),11,1.14
https://www.trueachievements.com/game/The-Walking-Dead-Season-Two-Xbox-360/achievements,https://www.trueachievements.com/a185070/moving-on-achievement,Moving On,Left the cabin.,06 Mar 14,(10),11,1.14
https://www.trueachievements.com/game/The-Walking-Dead-Season-Two-Xbox-360/achievements,https://www.trueachievements.com/a185069/the-intruder-achievement,The Intruder,Talked to a stranger.,06 Mar 14,(10),11,1.14
https://www.trueachievements.com/game/The-Walking-Dead-Season-Two-Xbox-360/achievements,https://www.trueachievements.com/a185068/new-morning-achievement,New Morning,Helped someone through a difficult time.,06 Mar 14,(10),11,1.14
https://www.trueachievements.com/game/Dragon-Age-2/achievements,https://www.trueachievements.com/a147868/dedicated-achievement,Dedicated,Reached Level 10.,21 Feb 14,(15),18,1.23
https://www.trueachievements.com/game/Dragon-Age-2/achievements,https://www.trueachievements.com/a147857/stone-cold-achievement,Stone Cold,Defeated the rock wraith on your expedition into the Deep Roads.,21 Feb 14,(5),6,1.25
https://www.trueachievements.com/game/Dragon-Age-2/achievements,https://www.trueachievements.com/a147876/delver-of-the-deep-achievement,Delver of the Deep,Explored the Deep Roads.,21 Feb 14,(10),12,1.24
https://www.trueachievements.com/game/Dragon-Age-2/achievements,https://www.trueachievements.com/a147867/financier-achievement,Financier,Became a partner in a Deep Roads expedition.,20 Feb 14,(10),12,1.29
https://www.trueachievements.com/game/Dragon-Age-2/achievements,https://www.trueachievements.com/a147869/enchanter-achievement,Enchanter,Enchanted an item.,20 Feb 14,(5),6,1.28
https://www.trueachievements.com/game/Dragon-Age-2/achievements,https://www.trueachievements.com/a147884/friend-achievement,Friend,Earned the friendship of one of your party members.,19 Feb 14,(25),29,1.19
https://www.trueachievements.com/game/Dragon-Age-2/achievements,https://www.trueachievements.com/a147844/treasure-hunter-achievement,Treasure Hunter,Opened 50 chests.,19 Feb 14,(25),29,1.17
https://www.trueachievements.com/game/Dragon-Age-2/achievements,https://www.trueachievements.com/a147855/talented-achievement,Talented,Upgraded a spell or talent.,18 Feb 14,(5),5,1.13
https://www.trueachievements.com/game/Dragon-Age-2/achievements,https://www.trueachievements.com/a147851/craftsman-achievement,Craftsman,Acquired your first crafting recipe.,18 Feb 14,(5),5,1.09
https://www.trueachievements.com/game/Dragon-Age-2/achievements,https://www.trueachievements.com/a147849/birthright-achievement,Birthright,Kicked the slavers out of your ancestral mansion.,18 Feb 14,(15),17,1.13
https://www.trueachievements.com/game/Dragon-Age-2/achievements,https://www.trueachievements.com/a147850/a-friend-in-need-achievement,A Friend in Need,Upgraded the armor of one of your party members.,18 Feb 14,(5),5,1.13
https://www.trueachievements.com/game/Dragon-Age-2/achievements,https://www.trueachievements.com/a147846/full-house-achievement,Full House,Recruited four party members.,18 Feb 14,(10),11,1.13
https://www.trueachievements.com/game/Dragon-Age-2/achievements,https://www.trueachievements.com/a147845/explorer-achievement,Explorer,Left Kirkwall to explore the outlying regions.,18 Feb 14,(5),5,1.11
https://www.trueachievements.com/game/Dragon-Age-2/achievements,https://www.trueachievements.com/a147847/darkness-falls-achievement,Darkness Falls,Toggled the map from day to night.,18 Feb 14,(5),5,1.1
https://www.trueachievements.com/game/Dragon-Age-2/achievements,https://www.trueachievements.com/a147852/immigrant-achievement,Immigrant,Became a resident of Kirkwall.,18 Feb 14,(5),5,1.08
https://www.trueachievements.com/game/Dragon-Age-2/achievements,https://www.trueachievements.com/a147854/nefarious-achievement,Nefarious,Allied yourself with the smugglers upon arriving in Kirkwall.,18 Feb 14,(10),12,1.21
https://www.trueachievements.com/game/Dragon-Age-2/achievements,https://www.trueachievements.com/a147856/tale-within-a-tale-achievement,Tale Within a Tale,Listened to Varric begin his tale of the Champion of Kirkwall.,18 Feb 14,(5),5,1.0
https://www.trueachievements.com/game/FIFA-14-Xbox-360/achievements,https://www.trueachievements.com/a179280/you-got-mail-achievement,You Got Mail,Open up your inbox while advancing in Career,17 Feb 14,(5),6,1.39
https://www.trueachievements.com/game/FIFA-14-Xbox-360/achievements,https://www.trueachievements.com/a179295/i-could-do-this-every-week-achievement,I Could Do This Every Week,Challenge the Team of the Week in FUT,14 Feb 14,(10),15,1.5
https://www.trueachievements.com/game/AFL-Live-2/achievements,https://www.trueachievements.com/a179198/new-face-achievement,New Face,Create a Custom Player in AFL Live 2.,14 Feb 14,(15),16,1.1
https://www.trueachievements.com/game/Halo-4/achievements,https://www.trueachievements.com/a170069/what-a-poser-achievement,What a Poser!,Changed your Spartan's pose in the Spartan ID card.,14 Feb 14,(5),6,1.24
https://www.trueachievements.com/game/Fable-Anniversary/achievements,https://www.trueachievements.com/a183912/the-graduation-achievement,The Graduation,"Your student loan has ended, it will be years before you can buy a house, but hey; you've graduated!",13 Feb 14,(25),28,1.12
https://www.trueachievements.com/game/Fable-Anniversary/achievements,https://www.trueachievements.com/a183891/from-the-smallest-acorn-achievement,From The Smallest Acorn,"Your childhood is behind you, next stop: puberty. 5 years of out-of-control hormones awaits you.",13 Feb 14,(25),25,1.0
https://www.trueachievements.com/game/Halo-4/achievements,https://www.trueachievements.com/a170053/i-3-red-vs-blue-achievement,I <3 Red vs Blue,Won 5 War Games matchmaking matches.,12 Feb 14,(15),18,1.21
https://www.trueachievements.com/game/Halo-4/achievements,https://www.trueachievements.com/a170066/armorer-achievement,Armorer,Changed your Spartan's armor in the Spartan Armor card.,11 Feb 14,(5),5,1.15
https://www.trueachievements.com/game/Halo-4/achievements,https://www.trueachievements.com/a170064/the-challenged-achievement,The Challenged,Completed a Challenge.,11 Feb 14,(10),11,1.17
https://www.trueachievements.com/game/Halo-4/achievements,https://www.trueachievements.com/a170051/not-some-recruit-anymore-achievement,Not Some Recruit Anymore,Ranked up your Spartan-IV to SR-5.,11 Feb 14,(15),16,1.11
https://www.trueachievements.com/game/Halo-4/achievements,https://www.trueachievements.com/a170068/pwnd-achievement,PWND,Changed your Service Tag in the Spartan ID card.,10 Feb 14,(5),5,1.09
https://www.trueachievements.com/game/Halo-4/achievements,https://www.trueachievements.com/a170067/badge-achievement,Badge,Changed your Emblem in the Spartan ID card.,10 Feb 14,(5),5,1.08
https://www.trueachievements.com/game/State-of-Decay/achievements,https://www.trueachievements.com/a177116/holy-rolling-achievement,Holy Rolling,Escaped Mt. Tanner and found the survivors at the church.,09 Feb 14,(10),10,1.03
https://www.trueachievements.com/game/State-of-Decay/achievements,https://www.trueachievements.com/a177124/i-can-see-my-house-from-here-achievement,I Can See My House From Here,Completed a survey activity.,09 Feb 14,(10),10,1.01
https://www.trueachievements.com/game/State-of-Decay/achievements,https://www.trueachievements.com/a177115/cannibal-family-picnic-achievement,Cannibal Family Picnic,Got to the Mt. Tanner Ranger Station.,09 Feb 14,(5),5,1.0
https://www.trueachievements.com/game/Halo-Anniversary/achievements,https://www.trueachievements.com/a158180/halo-achievement,Halo,Complete the level “Halo” on any difficulty.,08 Feb 14,(25),27,1.09
https://www.trueachievements.com/game/Halo-Anniversary/achievements,https://www.trueachievements.com/a158182/pillar-of-autumn-achievement,Pillar of Autumn,Complete the level “Pillar of Autumn” on any difficulty.,08 Feb 14,(25),25,1.01
https://www.trueachievements.com/game/FIFA-14-Xbox-360/achievements,https://www.trueachievements.com/a179286/extra-effort-achievement,Extra Effort,Score with a first time Sliding Shot,08 Feb 14,(25),31,1.26
https://www.trueachievements.com/game/FIFA-14-Xbox-360/achievements,https://www.trueachievements.com/a179284/what-a-hit-son-achievement,"What a Hit, Son!",Score with a Dipping Volley,04 Feb 14,(25),28,1.15
https://www.trueachievements.com/game/FIFA-14-Xbox-360/achievements,https://www.trueachievements.com/a179275/its-mine-now-achievement,It's Mine Now,Redeem an item from the Football Club Catalogue,03 Feb 14,(10),12,1.29
https://www.trueachievements.com/game/FIFA-14-Xbox-360/achievements,https://www.trueachievements.com/a179281/first-mission-achievement,First Mission,Send a Scout on an Area Scouting mission.,31 Jan 14,(5),7,1.46
https://www.trueachievements.com/game/FIFA-14-Xbox-360/achievements,https://www.trueachievements.com/a179279/seconds-please-achievement,"Seconds, Please",Win the ball back with a Second Chance Tackle,30 Jan 14,(10),10,1.03
https://www.trueachievements.com/game/FIFA-14-Xbox-360/achievements,https://www.trueachievements.com/a179287/who-needs-a-weak-foot-achievement,Who Needs a Weak Foot?,Score with an Outside of the Foot Shot,29 Jan 14,(10),11,1.15
https://www.trueachievements.com/game/FIFA-14-Xbox-360/achievements,https://www.trueachievements.com/a179277/beast-mode-achievement,Beast Mode,Straight Arm a Defender to Protect the Ball,29 Jan 14,(10),12,1.21
https://www.trueachievements.com/game/FIFA-14-Xbox-360/achievements,https://www.trueachievements.com/a179276/start-building-achievement,Start Building,Create a FUT Club,29 Jan 14,(10),11,1.18
https://www.trueachievements.com/game/FIFA-14-Xbox-360/achievements,https://www.trueachievements.com/a179303/rising-star-achievement,Rising Star,Be featured in the team of the week in your Career as a Player,29 Jan 14,(30),53,1.78
https://www.trueachievements.com/game/FIFA-14-Xbox-360/achievements,https://www.trueachievements.com/a179283/power-and-movement-achievement,Power and Movement,Score with a Curling Lace Shot,28 Jan 14,(10),10,1.07
https://www.trueachievements.com/game/Battlefield-4-Xbox-360/achievements,https://www.trueachievements.com/a180762/turn-around-achievement,Turn around...,Perform 5 dog tag kills in Multiplayer,14 Jan 14,(10),12,1.23
https://www.trueachievements.com/game/The-Walking-Dead-Season-Two-Xbox-360/achievements,https://www.trueachievements.com/a183341/split-decision-achievement,Split Decision,"Completed Episode 1: ""All That Remains""",07 Jan 14,(25),26,1.06
https://www.trueachievements.com/game/The-Walking-Dead-Season-Two-Xbox-360/achievements,https://www.trueachievements.com/a183340/headed-out-achievement,Headed Out,Headed out with the group.,07 Jan 14,(15),15,1.05
https://www.trueachievements.com/game/The-Walking-Dead-Season-Two-Xbox-360/achievements,https://www.trueachievements.com/a183339/still-not-bitten-achievement,Still. Not. Bitten.,Took care of yourself.,07 Jan 14,(10),10,1.05
https://www.trueachievements.com/game/The-Walking-Dead-Season-Two-Xbox-360/achievements,https://www.trueachievements.com/a183338/sneaky-achievement,Sneaky,Got what you needed.,07 Jan 14,(10),10,1.05
https://www.trueachievements.com/game/The-Walking-Dead-Season-Two-Xbox-360/achievements,https://www.trueachievements.com/a183337/now-what-achievement,Now What?,Arrived at the cabin.,07 Jan 14,(10),10,1.03
https://www.trueachievements.com/game/The-Walking-Dead-Season-Two-Xbox-360/achievements,https://www.trueachievements.com/a183336/on-the-path-achievement,On the Path,Met new people.,07 Jan 14,(10),10,1.02
https://www.trueachievements.com/game/The-Walking-Dead-Season-Two-Xbox-360/achievements,https://www.trueachievements.com/a183335/shelter-achievement,Shelter,Found a campsite.,07 Jan 14,(10),10,1.01
