achievement_game_url,achievement_url,achievement_name,achievement_desc,achievement_earned,achievement_score,ta_score,ta_ratio
https://www.trueachievements.com/game/Ghostbusters/achievements,https://www.trueachievements.com/a33694/and-you-want-to-keep-it-achievement,...And You Want to Keep It?,Collect a Cursed Artifact.,Offline,(20),,"...And You Want to Keep It?
Collect a Cursed Artifact."
https://www.trueachievements.com/game/Ghostbusters/achievements,https://www.trueachievements.com/a33693/aim-for-the-flat-top-achievement,Aim for the Flat Top!,Eliminate a creature.,Offline,(10),,"Aim for the Flat Top!
Eliminate a creature."
https://www.trueachievements.com/game/Ghostbusters/achievements,https://www.trueachievements.com/a33697/i-aint-fraid-of-no-ghost-achievement,I Ain't 'Fraid of No Ghost!,Trap a ghost.,Offline,(10),,"I Ain't 'Fraid of No Ghost!
Trap a ghost."
https://www.trueachievements.com/game/Ghostbusters/achievements,https://www.trueachievements.com/a33695/im-picking-up-a-signal-achievement,I'm Picking Up A Signal...,Obtain a 100% PKE scan on a paranormal creature.,Offline,(20),,"I'm Picking Up A Signal...
Obtain a 100% PKE scan on a paranormal creature."
https://www.trueachievements.com/game/Ghostbusters/achievements,https://www.trueachievements.com/a33689/once-smore-into-the-breach-achievement,Once S'more into the Breach,Complete the 'Panic in Times Square' level.,Offline,(20),,"Once S'more into the Breach
Complete the 'Panic in Times Square' level."
https://www.trueachievements.com/game/Ghostbusters/achievements,https://www.trueachievements.com/a33701/slam-dunk-achievement,Slam Dunk!,Slam dunk a ghost into a trap.,Offline,(15),,"Slam Dunk!
Slam dunk a ghost into a trap."
https://www.trueachievements.com/game/Ghostbusters/achievements,https://www.trueachievements.com/a33691/the-flowers-are-still-standing-achievement,The Flowers are Still Standing!,Complete the 'Welcome to the Hotel Sedgewick' level.,Offline,(20),,"The Flowers are Still Standing!
Complete the 'Welcome to the Hotel Sedgewick' level."
https://www.trueachievements.com/game/Ghostbusters/achievements,https://www.trueachievements.com/a33690/total-protonic-reversal-achievement,Total Protonic Reversal,Knock yourself down with your own weapon.,Offline,(5),,"Total Protonic Reversal
Knock yourself down with your own weapon."
https://www.trueachievements.com/game/Ghostbusters/achievements,https://www.trueachievements.com/a33696/we-have-the-talent-achievement,We Have the Talent!,Complete the Firehouse training level.,Offline,(20),,"We Have the Talent!
Complete the Firehouse training level."
https://www.trueachievements.com/game/Ghostbusters/achievements,https://www.trueachievements.com/a33698/you-gotta-try-this-pole-achievement,You Gotta Try This Pole!,Slide down the fire pole.,Offline,(5),,"You Gotta Try This Pole!
Slide down the fire pole."
https://www.trueachievements.com/game/LEGO-Star-Wars-2/achievements,https://www.trueachievements.com/a11988/secret-plans-level-complete-achievement,Secret Plans level complete,"Complete Secret Plans, the first level of Episode IV",Offline,(20),,"Secret Plans level complete
Complete Secret Plans, the first level of Episode IV"
https://www.trueachievements.com/game/Kung-Fu-Panda/achievements,https://www.trueachievements.com/a22002/fastest-warrior-achievement,Fastest Warrior,Obtained a Hit Chain of 10 or higher using only Fast Attacks.,Offline,(20),,"Fastest Warrior
Obtained a Hit Chain of 10 or higher using only Fast Attacks."
https://www.trueachievements.com/game/Marvel-Ultimate-Alliance/achievements,https://www.trueachievements.com/a12665/blue-screen-of-death-achievement,Blue Screen of Death,M.O.D.O.K was defeated.,Offline,(15),,"Blue Screen of Death
M.O.D.O.K was defeated."
https://www.trueachievements.com/game/Marvel-Ultimate-Alliance/achievements,https://www.trueachievements.com/a12654/defeated-grey-gargoyle-achievement,Defeated Grey Gargoyle,Grey Gargoyle was defeated.,Offline,(15),,"Defeated Grey Gargoyle
Grey Gargoyle was defeated."
https://www.trueachievements.com/game/Marvel-Ultimate-Alliance/achievements,https://www.trueachievements.com/a12668/dragon-slayer-achievement,Dragon Slayer,Fin Fang Foom was defeated.,Offline,(15),,"Dragon Slayer
Fin Fang Foom was defeated."
https://www.trueachievements.com/game/Marvel-Ultimate-Alliance/achievements,https://www.trueachievements.com/a12669/fledgling-super-hero-achievement,Fledgling Super Hero,Defeated 10 enemies.,Offline,(5),,"Fledgling Super Hero
Defeated 10 enemies."
https://www.trueachievements.com/game/Marvel-Ultimate-Alliance/achievements,https://www.trueachievements.com/a12652/game-over-achievement,Game Over,Arcade was defeated.,Offline,(15),,"Game Over
Arcade was defeated."
https://www.trueachievements.com/game/Marvel-Ultimate-Alliance/achievements,https://www.trueachievements.com/a12643/giant-relief-achievement,Giant Relief,Ymir fell to the forces of good.,Offline,(15),,"Giant Relief
Ymir fell to the forces of good."
https://www.trueachievements.com/game/Marvel-Ultimate-Alliance/achievements,https://www.trueachievements.com/a12656/i-have-a-friend-achievement,I have a friend,Completed a level with at least 1 other player.,Offline,(5),,"I have a friend
Completed a level with at least 1 other player."
https://www.trueachievements.com/game/Marvel-Ultimate-Alliance/achievements,https://www.trueachievements.com/a12666/legendary-super-hero-achievement,Legendary Super Hero,Defeated 100 enemies.,Offline,(15),,"Legendary Super Hero
Defeated 100 enemies."
https://www.trueachievements.com/game/Marvel-Ultimate-Alliance/achievements,https://www.trueachievements.com/a12653/mandarins-downfall-achievement,Mandarin's Downfall,The evil Mandarin was crushed by the forces of good.,Offline,(45),,"Mandarin's Downfall
The evil Mandarin was crushed by the forces of good."
https://www.trueachievements.com/game/Marvel-Ultimate-Alliance/achievements,https://www.trueachievements.com/a12660/melee-master-achievement,Melee Master,Performed 50 Finishing Moves.,Offline,(15),,"Melee Master
Performed 50 Finishing Moves."
https://www.trueachievements.com/game/Marvel-Ultimate-Alliance/achievements,https://www.trueachievements.com/a12649/mephistos-defeat-achievement,Mephisto's Defeat,Mephisto was struck down.,Offline,(45),,"Mephisto's Defeat
Mephisto was struck down."
https://www.trueachievements.com/game/Marvel-Ultimate-Alliance/achievements,https://www.trueachievements.com/a12661/pugilist-achievement,Pugilist,Performed 5 Finishing Moves.,Offline,(5),,"Pugilist
Performed 5 Finishing Moves."
https://www.trueachievements.com/game/Marvel-Ultimate-Alliance/achievements,https://www.trueachievements.com/a12650/son-of-a-devil-achievement,Son of a Devil,Blackheart was defeated.,Offline,(15),,"Son of a Devil
Blackheart was defeated."
https://www.trueachievements.com/game/Marvel-Ultimate-Alliance/achievements,https://www.trueachievements.com/a12658/swimming-with-the-fish-achievement,Swimming with the Fish,The mighty Kraken was defeated.,Offline,(15),,"Swimming with the Fish
The mighty Kraken was defeated."
https://www.trueachievements.com/game/Marvel-Ultimate-Alliance/achievements,https://www.trueachievements.com/a12644/the-executioners-blade-achievement,The Executioner's Blade,Executioner and Enchantress were defeated.,Offline,(15),,"The Executioner's Blade
Executioner and Enchantress were defeated."
https://www.trueachievements.com/game/Marvel-Ultimate-Alliance/achievements,https://www.trueachievements.com/a12642/the-trickster-achievement,The Trickster,Loki was defeated.,Offline,(45),,"The Trickster
Loki was defeated."
https://www.trueachievements.com/game/Marvel-Ultimate-Alliance/achievements,https://www.trueachievements.com/a12657/touch-of-death-achievement,Touch of Death,Performed 200 Finishing Moves.,Offline,(30),,"Touch of Death
Performed 200 Finishing Moves."
https://www.trueachievements.com/game/Marvel-Ultimate-Alliance/achievements,https://www.trueachievements.com/a12659/underwater-battle-achievement,Underwater Battle,Tigershark and Attuma were defeated.,Offline,(15),,"Underwater Battle
Tigershark and Attuma were defeated."
https://www.trueachievements.com/game/Modern-Warfare-2-2009/achievements,https://www.trueachievements.com/a37549/back-in-the-saddle-achievement,Back in the Saddle,Help train the local militia.,Offline,(15),,"Back in the Saddle
Help train the local militia."
https://www.trueachievements.com/game/Modern-Warfare-2-2009/achievements,https://www.trueachievements.com/a37551/cold-shoulder-achievement,Cold Shoulder,Infiltrate the snowy mountain side base.,Offline,(15),,"Cold Shoulder
Infiltrate the snowy mountain side base."
https://www.trueachievements.com/game/Modern-Warfare-2-2009/achievements,https://www.trueachievements.com/a37550/danger-close-achievement,Danger Close,Get hand picked for Shepherd's elite squad.,Offline,(15),,"Danger Close
Get hand picked for Shepherd's elite squad."
https://www.trueachievements.com/game/Modern-Warfare-2-2009/achievements,https://www.trueachievements.com/a37555/desperate-times-achievement,Desperate Times,Execute the plan to help the Americans.,Offline,(15),,"Desperate Times
Execute the plan to help the Americans."
https://www.trueachievements.com/game/Modern-Warfare-2-2009/achievements,https://www.trueachievements.com/a37559/for-the-record-achievement,For the Record,Complete the Single Player campaign on any difficulty.,Offline,(35),,"For the Record
Complete the Single Player campaign on any difficulty."
https://www.trueachievements.com/game/Modern-Warfare-2-2009/achievements,https://www.trueachievements.com/a37573/gold-star-achievement,Gold Star,Earn 1 star in Special Ops.,Offline,(20),,"Gold Star
Earn 1 star in Special Ops."
https://www.trueachievements.com/game/Modern-Warfare-2-2009/achievements,https://www.trueachievements.com/a37597/no-rest-for-the-wary-achievement,No Rest For the Wary,Knife an enemy without him ever knowing you were there in Single Player or Special Ops.,Offline,(10),,"No Rest For the Wary
Knife an enemy without him ever knowing you were there in Single Player or Special Ops."
https://www.trueachievements.com/game/Modern-Warfare-2-2009/achievements,https://www.trueachievements.com/a37558/out-of-the-frying-pan-achievement,Out of the Frying Pan…,Complete the mission in the airplane graveyard.,Offline,(15),,"Out of the Frying Pan…
Complete the mission in the airplane graveyard."
https://www.trueachievements.com/game/Modern-Warfare-2-2009/achievements,https://www.trueachievements.com/a37553/royale-with-cheese-achievement,Royale with Cheese,Defend Burger Town.,Offline,(15),,"Royale with Cheese
Defend Burger Town."
https://www.trueachievements.com/game/Modern-Warfare-2-2009/achievements,https://www.trueachievements.com/a37554/soap-on-a-rope-achievement,Soap on a Rope,Storm the gulag.,Offline,(15),,"Soap on a Rope
Storm the gulag."
https://www.trueachievements.com/game/Modern-Warfare-2-2009/achievements,https://www.trueachievements.com/a37589/some-like-it-hot-achievement,Some Like it Hot,Kill 6 enemies in a row using a thermal weapon in Single Player or Special Ops.,Offline,(10),,"Some Like it Hot
Kill 6 enemies in a row using a thermal weapon in Single Player or Special Ops."
https://www.trueachievements.com/game/Modern-Warfare-2-2009/achievements,https://www.trueachievements.com/a37552/tag-em-and-bag-em-achievement,Tag 'em and bag 'em,Find Rojas in the Favelas.,Offline,(15),,"Tag 'em and bag 'em
Find Rojas in the Favelas."
https://www.trueachievements.com/game/Modern-Warfare-2-2009/achievements,https://www.trueachievements.com/a37586/ten-plus-footmobiles-achievement,Ten plus foot-mobiles,Kill at least 10 enemies with one Predator missile in Single Player or Special Ops.,Offline,(10),,"Ten plus foot-mobiles
Kill at least 10 enemies with one Predator missile in Single Player or Special Ops."
https://www.trueachievements.com/game/Modern-Warfare-2-2009/achievements,https://www.trueachievements.com/a37594/the-harder-they-fall-achievement,The Harder They Fall,Kill 2 rappelling enemies in a row before they land on their feet in Single Player or Special Ops.,Offline,(10),,"The Harder They Fall
Kill 2 rappelling enemies in a row before they land on their feet in Single Player or Special Ops."
https://www.trueachievements.com/game/Modern-Warfare-2-2009/achievements,https://www.trueachievements.com/a37557/the-pawn-achievement,The Pawn,Assault Makarov's safe house.,Offline,(15),,"The Pawn
Assault Makarov's safe house."
https://www.trueachievements.com/game/Modern-Warfare-2-2009/achievements,https://www.trueachievements.com/a37598/threesome-achievement,Three-some,Kill at least 3 enemies with a single shot from a grenade launcher in Single Player or Special Ops.,Offline,(10),,"Three-some
Kill at least 3 enemies with a single shot from a grenade launcher in Single Player or Special Ops."
https://www.trueachievements.com/game/Modern-Warfare-2-2009/achievements,https://www.trueachievements.com/a37590/two-birds-with-one-stone-achievement,Two Birds with One Stone,Kill 2 enemies with a single bullet in Single Player or Special Ops.,Offline,(10),,"Two Birds with One Stone
Kill 2 enemies with a single bullet in Single Player or Special Ops."
https://www.trueachievements.com/game/Modern-Warfare-2-2009/achievements,https://www.trueachievements.com/a37587/unnecessary-roughness-achievement,Unnecessary Roughness,Use a riot shield to beat down an enemy in Single Player or Special Ops.,Offline,(10),,"Unnecessary Roughness
Use a riot shield to beat down an enemy in Single Player or Special Ops."
https://www.trueachievements.com/game/Modern-Warfare-2-2009/achievements,https://www.trueachievements.com/a37556/whiskey-hotel-achievement,Whiskey Hotel,Take back Whiskey Hotel.,Offline,(15),,"Whiskey Hotel
Take back Whiskey Hotel."
https://www.trueachievements.com/game/Marvel-Ultimate-Alliance/achievements,https://www.trueachievements.com/a12640/deathbirds-defeat-achievement,Deathbird's Defeat,Deathbird was crushed.,29 Jan 11,(15),,"Deathbird's Defeat
Deathbird was crushed."
https://www.trueachievements.com/game/Marvel-Ultimate-Alliance/achievements,https://www.trueachievements.com/a12641/warriors-path-achievement,Warrior's Path,Gladiator was defeated.,28 Jan 11,(15),,"Warrior's Path
Gladiator was defeated."
