achievement_game_url,achievement_url,achievement_name,achievement_desc,achievement_earned,achievement_score,ta_score,ta_ratio
https://www.trueachievements.com/game/PGR-4/achievements,https://www.trueachievements.com/a10140/numero-uno-achievement,Numero Uno,Reach Rank Number One on the Single Player Career Drivers' Leaderboard.,12 Jun 14,(50),,"Numero Uno
Reach Rank Number One on the Single Player Career Drivers' Leaderboard."
https://www.trueachievements.com/game/PGR-4/achievements,https://www.trueachievements.com/a10133/tonight-make-me-unstoppable-achievement,Tonight Make Me Unstoppable,Puzzle #3,12 Jun 14,(5),,"Tonight Make Me Unstoppable
Puzzle #3"
https://www.trueachievements.com/game/Tron-Evolution/achievements,https://www.trueachievements.com/a77589/warming-up-achievement,Warming Up,Get a 5X Hit multiplier,24 May 14,(5),,"Warming Up
Get a 5X Hit multiplier"
https://www.trueachievements.com/game/Tron-Evolution/achievements,https://www.trueachievements.com/a77586/unstoppable-achievement,Unstoppable,Derezzed 10 enemies before dying,24 May 14,(30),,"Unstoppable
Derezzed 10 enemies before dying"
https://www.trueachievements.com/game/Tron-Evolution/achievements,https://www.trueachievements.com/a77579/please-come-again-achievement,Please come again,Bought your first upgrade,24 May 14,(5),,"Please come again
Bought your first upgrade"
https://www.trueachievements.com/game/Tron-Evolution/achievements,https://www.trueachievements.com/a77592/what-kind-of-program-is-he-achievement,What kind of program is he?,Gained a Version (Level) for the first time,24 May 14,(5),,"What kind of program is he?
Gained a Version (Level) for the first time"
https://www.trueachievements.com/game/Tron-Evolution/achievements,https://www.trueachievements.com/a77564/greetings-program-achievement,"Greetings, program!",Completed the Tutorial,24 May 14,(20),,"Greetings, program!
Completed the Tutorial"
https://www.trueachievements.com/game/Tron-Evolution/achievements,https://www.trueachievements.com/a77575/look-what-i-found-achievement,Look what I found!,Collected your first Tron File,24 May 14,(5),,"Look what I found!
Collected your first Tron File"
https://www.trueachievements.com/game/Call-of-Duty-Ghosts-Xbox-360/achievements,https://www.trueachievements.com/a181000/all-or-nothing-achievement,All or nothing,"Gather the troops. (Complete ""All or Nothing"" on any difficulty.)",13 May 14,(20),,"All or nothing
Gather the troops. (Complete ""All or Nothing"" on any difficulty.)"
https://www.trueachievements.com/game/Call-of-Duty-Ghosts-Xbox-360/achievements,https://www.trueachievements.com/a180998/sin-city-achievement,Sin City,"Plan your next move. (Complete ""Sin City"" on any difficulty.)",13 May 14,(20),,"Sin City
Plan your next move. (Complete ""Sin City"" on any difficulty.)"
https://www.trueachievements.com/game/Call-of-Duty-Ghosts-Xbox-360/achievements,https://www.trueachievements.com/a180996/end-of-the-line-achievement,End of the Line,"Storm the factory (Complete ""End of the Line"" on any difficulty.)",12 May 14,(20),,"End of the Line
Storm the factory (Complete ""End of the Line"" on any difficulty.)"
https://www.trueachievements.com/game/Call-of-Duty-Ghosts-Xbox-360/achievements,https://www.trueachievements.com/a180997/cog-in-the-machine-achievement,Cog in the machine,Kill 5 enemies without being detected before infiltrating Black Zone.,12 May 14,(35),,"Cog in the machine
Kill 5 enemies without being detected before infiltrating Black Zone."
https://www.trueachievements.com/game/Call-of-Duty-Ghosts-Xbox-360/achievements,https://www.trueachievements.com/a180994/into-the-deep-achievement,Into the Deep,"Destroy the enemy ship (Complete ""Into The Deep"" on any difficulty.)",12 May 14,(20),,"Into the Deep
Destroy the enemy ship (Complete ""Into The Deep"" on any difficulty.)"
https://www.trueachievements.com/game/Call-of-Duty-Ghosts-Xbox-360/achievements,https://www.trueachievements.com/a180995/david--goliath-achievement,David & Goliath,Take down the LCS on the first go.,12 May 14,(20),,"David & Goliath
Take down the LCS on the first go."
https://www.trueachievements.com/game/Call-of-Duty-Ghosts-Xbox-360/achievements,https://www.trueachievements.com/a180991/atlas-falls-achievement,Atlas Falls,"Distract the Federation Fleet. (Complete ""Atlas Falls"" on any difficulty.)",12 May 14,(25),,"Atlas Falls
Distract the Federation Fleet. (Complete ""Atlas Falls"" on any difficulty.)"
https://www.trueachievements.com/game/Call-of-Duty-Ghosts-Xbox-360/achievements,https://www.trueachievements.com/a180989/clockwork-achievement,Clockwork,"Hack the system (Complete ""Clockwork"" on any difficulty.)",12 May 14,(25),,"Clockwork
Hack the system (Complete ""Clockwork"" on any difficulty.)"
https://www.trueachievements.com/game/Call-of-Duty-Ghosts-Xbox-360/achievements,https://www.trueachievements.com/a180990/deep-freeze-achievement,Deep Freeze,Drop 8 vehicles into ice holes.,12 May 14,(25),,"Deep Freeze
Drop 8 vehicles into ice holes."
https://www.trueachievements.com/game/Call-of-Duty-Ghosts-Xbox-360/achievements,https://www.trueachievements.com/a180987/the-hunted-achievement,The Hunted,"Make it out alive (Complete ""The Hunted"" on any difficulty.)",12 May 14,(25),,"The Hunted
Make it out alive (Complete ""The Hunted"" on any difficulty.)"
https://www.trueachievements.com/game/Call-of-Duty-Ghosts-Xbox-360/achievements,https://www.trueachievements.com/a180985/birds-of-prey-achievement,Birds of Prey,"Capture Rorke (Complete ""Birds of Prey"" on any difficulty.)",12 May 14,(10),,"Birds of Prey
Capture Rorke (Complete ""Birds of Prey"" on any difficulty.)"
https://www.trueachievements.com/game/Call-of-Duty-Ghosts-Xbox-360/achievements,https://www.trueachievements.com/a180982/federation-day-achievement,Federation Day,"Gather intel on Rorke. (Complete ""Federation Day"" on any difficulty.)",11 May 14,(10),,"Federation Day
Gather intel on Rorke. (Complete ""Federation Day"" on any difficulty.)"
https://www.trueachievements.com/game/Call-of-Duty-Ghosts-Xbox-360/achievements,https://www.trueachievements.com/a180984/carbon-faceprint-achievement,Carbon Faceprint,Catch the photocopier with your face.,11 May 14,(10),,"Carbon Faceprint
Catch the photocopier with your face."
https://www.trueachievements.com/game/Call-of-Duty-Ghosts-Xbox-360/achievements,https://www.trueachievements.com/a180980/legends-never-die-achievement,Legends Never Die,"Hunt down Almagro. (Complete ""Legends Never Die"" on any difficulty.)",11 May 14,(10),,"Legends Never Die
Hunt down Almagro. (Complete ""Legends Never Die"" on any difficulty.)"
https://www.trueachievements.com/game/Minecraft-Xbox-360/achievements,https://www.trueachievements.com/a163966/moar-tools-achievement,MOAR Tools,"Construct one type of each tool (one pickaxe, one spade, one axe and one hoe).",11 May 14,(15),,"MOAR Tools
Construct one type of each tool (one pickaxe, one spade, one axe and one hoe)."
https://www.trueachievements.com/game/Minecraft-Xbox-360/achievements,https://www.trueachievements.com/a163958/time-to-farm-achievement,Time to Farm!,Use planks and sticks to make a hoe.,11 May 14,(10),,"Time to Farm!
Use planks and sticks to make a hoe."
https://www.trueachievements.com/game/Borderlands-2-Xbox-360/achievements,https://www.trueachievements.com/a167537/first-ones-free-achievement,First One's Free,"Completed the mission ""My First Gun""",22 Dec 13,(10),,"First One's Free
Completed the mission ""My First Gun"""
https://www.trueachievements.com/game/Call-of-Duty-Ghosts-Xbox-360/achievements,https://www.trueachievements.com/a180978/homecoming-achievement,Homecoming,"Defend LA. (Complete ""Homecoming"" on any difficulty.)",15 Dec 13,(10),,"Homecoming
Defend LA. (Complete ""Homecoming"" on any difficulty.)"
https://www.trueachievements.com/game/Call-of-Duty-Ghosts-Xbox-360/achievements,https://www.trueachievements.com/a180976/struck-down-achievement,Struck Down,"Find Ajax. (Complete ""Struck Down"" on any difficulty.)",15 Dec 13,(10),,"Struck Down
Find Ajax. (Complete ""Struck Down"" on any difficulty.)"
https://www.trueachievements.com/game/Call-of-Duty-Ghosts-Xbox-360/achievements,https://www.trueachievements.com/a180974/no-mans-land-achievement,No Man's Land,"Make it to San Diego. (Complete ""No Man's Land"" on any difficulty.)",15 Dec 13,(10),,"No Man's Land
Make it to San Diego. (Complete ""No Man's Land"" on any difficulty.)"
https://www.trueachievements.com/game/Call-of-Duty-Ghosts-Xbox-360/achievements,https://www.trueachievements.com/a180970/brave-new-world-achievement,Brave New World,"Rendez-vous in Fort Santa Monica. (Complete ""Brave New World"" on any difficulty.)",15 Dec 13,(10),,"Brave New World
Rendez-vous in Fort Santa Monica. (Complete ""Brave New World"" on any difficulty.)"
https://www.trueachievements.com/game/Call-of-Duty-Ghosts-Xbox-360/achievements,https://www.trueachievements.com/a180972/ghost-stories-achievement,Ghost Stories,"Escape. (Complete ""Ghost Stories"" on any difficulty.)",15 Dec 13,(5),,"Ghost Stories
Escape. (Complete ""Ghost Stories"" on any difficulty.)"
https://www.trueachievements.com/game/Call-of-Duty-Ghosts-Xbox-360/achievements,https://www.trueachievements.com/a180973/spatial-awareness-achievement,Spatial Awareness,Kill your first enemy in the Call of Duty® Ghosts campaign.,15 Dec 13,(10),,"Spatial Awareness
Kill your first enemy in the Call of Duty® Ghosts campaign."
https://www.trueachievements.com/game/Minecraft-Xbox-360/achievements,https://www.trueachievements.com/a163959/bake-bread-achievement,Bake Bread,Turn wheat into bread.,29 Aug 13,(20),,"Bake Bread
Turn wheat into bread."
https://www.trueachievements.com/game/Minecraft-Xbox-360/achievements,https://www.trueachievements.com/a163964/when-pigs-fly-achievement,When Pigs Fly,"Use a saddle to ride a pig, then have the pig get hurt from fall damage while riding it.",04 Aug 13,(40),,"When Pigs Fly
Use a saddle to ride a pig, then have the pig get hurt from fall damage while riding it."
https://www.trueachievements.com/game/Minecraft-Xbox-360/achievements,https://www.trueachievements.com/a163961/delicious-fish-achievement,Delicious Fish,Catch and cook a fish!,04 Aug 13,(15),,"Delicious Fish
Catch and cook a fish!"
https://www.trueachievements.com/game/Crackdown/achievements,https://www.trueachievements.com/a9581/take-me-to-your-supply-point-achievement,Take Me To Your Supply Point,Unlock your first Supply Point,04 Aug 13,(10),,"Take Me To Your Supply Point
Unlock your first Supply Point"
https://www.trueachievements.com/game/Minecraft-Xbox-360/achievements,https://www.trueachievements.com/a163963/time-to-strike-achievement,Time to Strike!,Use planks and sticks to make a sword.,02 Aug 13,(10),,"Time to Strike!
Use planks and sticks to make a sword."
https://www.trueachievements.com/game/LEGO-Lord-of-the-Rings/achievements,https://www.trueachievements.com/a171764/its-a-dangerous-business-achievement,It's a dangerous business...,Complete 'The Black Rider'.,15 Jul 13,(25),,"It's a dangerous business...
Complete 'The Black Rider'."
https://www.trueachievements.com/game/LEGO-Lord-of-the-Rings/achievements,https://www.trueachievements.com/a171762/the-strength-of-men-failed-achievement,The strength of Men failed.,Complete 'Prologue'.,15 Jul 13,(25),,"The strength of Men failed.
Complete 'Prologue'."
https://www.trueachievements.com/game/LEGO-Lord-of-the-Rings/achievements,https://www.trueachievements.com/a171791/im-glad-to-be-with-you-achievement,I'm glad to be with you.,Complete a level in co-op.,15 Jul 13,(10),,"I'm glad to be with you.
Complete a level in co-op."
https://www.trueachievements.com/game/LEGO-Pirates-of-the-Caribbean/achievements,https://www.trueachievements.com/a150895/wind-in-your-sails-achievement,Wind in your sails!,Hit a flying parrot on Smuggler's Den,10 Jul 13,(15),,"Wind in your sails!
Hit a flying parrot on Smuggler's Den"
https://www.trueachievements.com/game/LEGO-Pirates-of-the-Caribbean/achievements,https://www.trueachievements.com/a150903/five-lashes-be-owed-achievement,Five lashes be owed,"As Jimmy Legs, whip Will Turner 5 times",10 Jul 13,(15),,"Five lashes be owed
As Jimmy Legs, whip Will Turner 5 times"
https://www.trueachievements.com/game/LEGO-Pirates-of-the-Caribbean/achievements,https://www.trueachievements.com/a150904/fire-achievement,Fire!,Fire 100 cannonballs,10 Jul 13,(15),,"Fire!
Fire 100 cannonballs"
https://www.trueachievements.com/game/LEGO-Pirates-of-the-Caribbean/achievements,https://www.trueachievements.com/a150887/a-pirates-life-for-me-achievement,A pirate's life for me,Test any custom character,10 Jul 13,(15),,"A pirate's life for me
Test any custom character"
https://www.trueachievements.com/game/LEGO-Pirates-of-the-Caribbean/achievements,https://www.trueachievements.com/a150870/the-curse-of-the-black-pearl-achievement,The Curse of the Black Pearl,Complete the Film 1 story,07 Jul 13,(20),,"The Curse of the Black Pearl
Complete the Film 1 story"
https://www.trueachievements.com/game/LEGO-Pirates-of-the-Caribbean/achievements,https://www.trueachievements.com/a150880/a-weather-eye-on-the-horizon-achievement,A weather eye on the horizon,Use a spyglass,07 Jul 13,(15),,"A weather eye on the horizon
Use a spyglass"
https://www.trueachievements.com/game/LEGO-Pirates-of-the-Caribbean/achievements,https://www.trueachievements.com/a150881/the-green-flash-achievement,The Green Flash,Watch a sunset,07 Jul 13,(15),,"The Green Flash
Watch a sunset"
https://www.trueachievements.com/game/LEGO-Pirates-of-the-Caribbean/achievements,https://www.trueachievements.com/a150868/welcome-to-the-caribbean-achievement,Welcome to the Caribbean!,Complete Port Royal,07 Jul 13,(12),,"Welcome to the Caribbean!
Complete Port Royal"
https://www.trueachievements.com/game/LEGO-Pirates-of-the-Caribbean/achievements,https://www.trueachievements.com/a150889/try-wearing-a-corset-achievement,Try wearing a corset,Do 5 lady backflips in a row,07 Jul 13,(15),,"Try wearing a corset
Do 5 lady backflips in a row"
https://www.trueachievements.com/game/LEGO-Pirates-of-the-Caribbean/achievements,https://www.trueachievements.com/a150867/ayeaye-captain-achievement,"Aye-aye, captain!",Play a level in co-op,07 Jul 13,(15),,"Aye-aye, captain!
Play a level in co-op"
https://www.trueachievements.com/game/LEGO-Pirates-of-the-Caribbean/achievements,https://www.trueachievements.com/a150869/here-there-be-monsters-achievement,Here there be monsters,Get eaten by a creature in deadly water,07 Jul 13,(15),,"Here there be monsters
Get eaten by a creature in deadly water"
https://www.trueachievements.com/game/Hydro-Thunder/achievements,https://www.trueachievements.com/a61952/cha-ching-achievement,Cha Ching!,"Earn 5,000 credits.",26 Jun 13,(25),,"Cha Ching!
Earn 5,000 credits."
https://www.trueachievements.com/game/Trials-HD/achievements,https://www.trueachievements.com/a35339/bling-achievement,Bling,The player has made at least 5 Gold-level performances.,26 Jun 13,(15),,"Bling
The player has made at least 5 Gold-level performances."
https://www.trueachievements.com/game/Hydro-Thunder/achievements,https://www.trueachievements.com/a61954/spare-change-achievement,Spare Change,"Earn 1,000 credits.",24 Jun 13,(35),,"Spare Change
Earn 1,000 credits."
https://www.trueachievements.com/game/Hydro-Thunder/achievements,https://www.trueachievements.com/a61955/splish-splash-achievement,Splish Splash,Earn a bronze or better in any Single Player event.,24 Jun 13,(35),,"Splish Splash
Earn a bronze or better in any Single Player event."
https://www.trueachievements.com/game/Minecraft-Xbox-360/achievements,https://www.trueachievements.com/a163968/into-the-nether-achievement,Into The Nether,Construct a Nether Portal.,16 Jun 13,(40),,"Into The Nether
Construct a Nether Portal."
https://www.trueachievements.com/game/Minecraft-Xbox-360/achievements,https://www.trueachievements.com/a163957/acquire-hardware-achievement,Acquire Hardware,Smelt an iron ingot.,11 Jun 13,(15),,"Acquire Hardware
Smelt an iron ingot."
https://www.trueachievements.com/game/Minecraft-Xbox-360/achievements,https://www.trueachievements.com/a163962/on-a-rail-achievement,On A Rail,Travel by minecart to a point at least 500m in a single direction from where you started.,10 Jun 13,(40),,"On A Rail
Travel by minecart to a point at least 500m in a single direction from where you started."
https://www.trueachievements.com/game/Minecraft-Xbox-360/achievements,https://www.trueachievements.com/a163953/time-to-mine-achievement,Time to Mine!,Use planks and sticks to make a pickaxe.,10 Jun 13,(10),,"Time to Mine!
Use planks and sticks to make a pickaxe."
https://www.trueachievements.com/game/Minecraft-Xbox-360/achievements,https://www.trueachievements.com/a163949/monster-hunter-achievement,Monster Hunter,Attack and destroy a monster.,09 Jun 13,(20),,"Monster Hunter
Attack and destroy a monster."
https://www.trueachievements.com/game/Doritos-Crash-Course-2/achievements,https://www.trueachievements.com/a176399/mission-control-achievement,Mission Control,Completed a Bonus Objective.,09 Jun 13,(15),,"Mission Control
Completed a Bonus Objective."
https://www.trueachievements.com/game/Doritos-Crash-Course-2/achievements,https://www.trueachievements.com/a176397/welcome-to-cc2-achievement,Welcome to CC2,Unlocked your first course.,09 Jun 13,(5),,"Welcome to CC2
Unlocked your first course."
https://www.trueachievements.com/game/Doritos-Crash-Course-2/achievements,https://www.trueachievements.com/a176422/cc2-community-achievement,CC2 Community,Finished an online game.,09 Jun 13,(10),,"CC2 Community
Finished an online game."
https://www.trueachievements.com/game/Doritos-Crash-Course-2/achievements,https://www.trueachievements.com/a176398/one-for-the-road-achievement,One for the Road,Unlocked a split path.,09 Jun 13,(10),,"One for the Road
Unlocked a split path."
https://www.trueachievements.com/game/Doritos-Crash-Course-2/achievements,https://www.trueachievements.com/a176400/on-course-achievement,On Course,Finished a course marked with a trophy icon without dying.,09 Jun 13,(10),,"On Course
Finished a course marked with a trophy icon without dying."
https://www.trueachievements.com/game/Minecraft-Xbox-360/achievements,https://www.trueachievements.com/a163951/cow-tipper-achievement,Cow Tipper,Harvest some leather.,01 Jun 13,(15),,"Cow Tipper
Harvest some leather."
https://www.trueachievements.com/game/Minecraft-Xbox-360/achievements,https://www.trueachievements.com/a163952/hot-topic-achievement,Hot Topic,Construct a furnace out of eight cobblestone blocks.,01 Jun 13,(15),,"Hot Topic
Construct a furnace out of eight cobblestone blocks."
https://www.trueachievements.com/game/Minecraft-Xbox-360/achievements,https://www.trueachievements.com/a163954/benchmarking-achievement,Benchmarking,Craft a workbench with four blocks of wooden planks.,01 Jun 13,(10),,"Benchmarking
Craft a workbench with four blocks of wooden planks."
https://www.trueachievements.com/game/Minecraft-Xbox-360/achievements,https://www.trueachievements.com/a163955/getting-wood-achievement,Getting Wood,Punch a tree until the block of wood pops out.,01 Jun 13,(10),,"Getting Wood
Punch a tree until the block of wood pops out."
https://www.trueachievements.com/game/Minecraft-Xbox-360/achievements,https://www.trueachievements.com/a163950/getting-an-upgrade-achievement,Getting an Upgrade,Construct a better pickaxe.,01 Jun 13,(15),,"Getting an Upgrade
Construct a better pickaxe."
https://www.trueachievements.com/game/Minecraft-Xbox-360/achievements,https://www.trueachievements.com/a163956/taking-inventory-achievement,Taking Inventory,Open your inventory.,01 Jun 13,(10),,"Taking Inventory
Open your inventory."
https://www.trueachievements.com/game/Transformers-Dark-of-the-Moon/achievements,https://www.trueachievements.com/a151326/chapter-i-achievement,Chapter I,Completed Chapter I on any difficulty.,10 Dec 12,(25),,"Chapter I
Completed Chapter I on any difficulty."
https://www.trueachievements.com/game/Transformers-Dark-of-the-Moon/achievements,https://www.trueachievements.com/a151330/boot-stomper-achievement,Boot Stomper,Killed 3 Enemies with Bumblebee’s Kick Ability in Chapter I.,10 Dec 12,(25),,"Boot Stomper
Killed 3 Enemies with Bumblebee’s Kick Ability in Chapter I."
https://www.trueachievements.com/game/Transformers-Dark-of-the-Moon/achievements,https://www.trueachievements.com/a151328/road-kill-achievement,Road Kill,Destroyed 30 enemies while in vehicle form in Campaign.,10 Dec 12,(25),,"Road Kill
Destroyed 30 enemies while in vehicle form in Campaign."
https://www.trueachievements.com/game/Happy-Wars-Xbox-360/achievements,https://www.trueachievements.com/a169134/nobody-calls-me-noob-achievement,Nobody Calls Me Noob,Complete all of the tutorials,10 Dec 12,(20),,"Nobody Calls Me Noob
Complete all of the tutorials"
https://www.trueachievements.com/game/Happy-Wars-Xbox-360/achievements,https://www.trueachievements.com/a169135/first-victory-achievement,First Victory,Get 1 victory in any game session,10 Dec 12,(10),,"First Victory
Get 1 victory in any game session"
https://www.trueachievements.com/game/DiRT-3/achievements,https://www.trueachievements.com/a151093/the-extra-mile-achievement,The Extra Mile,You have completed 25 bonus Race Objectives,29 Oct 12,(20),,"The Extra Mile
You have completed 25 bonus Race Objectives"
https://www.trueachievements.com/game/DiRT-3/achievements,https://www.trueachievements.com/a151100/rising-talent-achievement,Rising Talent,You have unlocked Driver Rep level 10,29 Oct 12,(10),,"Rising Talent
You have unlocked Driver Rep level 10"
https://www.trueachievements.com/game/Battlefield-3/achievements,https://www.trueachievements.com/a155864/wanted-dead-or-alive-achievement,Wanted: Dead or Alive,Captured Al Bashir,14 Jun 12,(20),,"Wanted: Dead or Alive
Captured Al Bashir"
https://www.trueachievements.com/game/Battlefield-3/achievements,https://www.trueachievements.com/a155872/twofor-achievement,Twofor,Took down 2 enemies with 1 bullet in Night Shift,14 Jun 12,(15),,"Twofor
Took down 2 enemies with 1 bullet in Night Shift"
https://www.trueachievements.com/game/Battlefield-3/achievements,https://www.trueachievements.com/a155869/scrap-metal-achievement,Scrap Metal,Destroyed 6 enemy tanks before reaching the fort in Thunder Run,10 Jun 12,(25),,"Scrap Metal
Destroyed 6 enemy tanks before reaching the fort in Thunder Run"
https://www.trueachievements.com/game/Battlefield-3/achievements,https://www.trueachievements.com/a155862/this-is-the-end-achievement,This is the end,Failed to prevent the attack,08 Jun 12,(20),,"This is the end
Failed to prevent the attack"
https://www.trueachievements.com/game/Dungeon-Defenders/achievements,https://www.trueachievements.com/a156412/dungeon-crawler-achievement,Dungeon Crawler,Completed all levels on any difficulty setting,08 Jun 12,(10),,"Dungeon Crawler
Completed all levels on any difficulty setting"
https://www.trueachievements.com/game/Battlefield-3/achievements,https://www.trueachievements.com/a155863/where-are-the-other-two-achievement,Where are the other two?,Found the nuke,07 Jun 12,(20),,"Where are the other two?
Found the nuke"
https://www.trueachievements.com/game/DiRT-3/achievements,https://www.trueachievements.com/a151083/driven-achievement,Driven,You have won DiRT Tour races using vehicles from every discipline,05 Jun 12,(20),,"Driven
You have won DiRT Tour races using vehicles from every discipline"
https://www.trueachievements.com/game/DiRT-3/achievements,https://www.trueachievements.com/a151087/kick-off-the-training-wheels-achievement,Kick Off the Training Wheels!,You have achieved a podium finish in the Gymkhana Academy,05 Jun 12,(20),,"Kick Off the Training Wheels!
You have achieved a podium finish in the Gymkhana Academy"
https://www.trueachievements.com/game/DiRT-3/achievements,https://www.trueachievements.com/a151088/driving-school-achievement,Driving School,You completed all of the Gymkhana tutorials,05 Jun 12,(10),,"Driving School
You completed all of the Gymkhana tutorials"
https://www.trueachievements.com/game/DiRT-3/achievements,https://www.trueachievements.com/a151084/todays-forecast-isvictory-achievement,Today's Forecast is...Victory!,You have earned victories in all weather conditions,04 Jun 12,(20),,"Today's Forecast is...Victory!
You have earned victories in all weather conditions"
https://www.trueachievements.com/game/Dead-Space-Xbox-360/achievements,https://www.trueachievements.com/a26791/marksman-achievement,Marksman,Dismember 20 Limbs,28 May 12,(5),,"Marksman
Dismember 20 Limbs"
https://www.trueachievements.com/game/Forza-Motorsport-4/achievements,https://www.trueachievements.com/a155098/amateur-achievement,Amateur,Complete the first year of Season Play.,05 Feb 12,(25),,"Amateur
Complete the first year of Season Play."
https://www.trueachievements.com/game/Forza-Motorsport-4/achievements,https://www.trueachievements.com/a155099/kingpin-achievement,Kingpin,Knock down a gold bowling pin in Car Bowling.,05 Feb 12,(5),,"Kingpin
Knock down a gold bowling pin in Car Bowling."
https://www.trueachievements.com/game/Forza-Motorsport-4/achievements,https://www.trueachievements.com/a155100/driver-level-1-achievement,Driver Level 1,Level 1 in Career,05 Feb 12,(20),,"Driver Level 1
Level 1 in Career"
https://www.trueachievements.com/game/Forza-Motorsport-4/achievements,https://www.trueachievements.com/a155102/perfect-turn-achievement,Perfect Turn,Earn a perfect Turn score.,05 Feb 12,(15),,"Perfect Turn
Earn a perfect Turn score."
https://www.trueachievements.com/game/Forza-Motorsport-4/achievements,https://www.trueachievements.com/a155107/welcome-to-forza-motorsport-achievement,Welcome to Forza Motorsport,Complete the very first race in the game.,05 Feb 12,(15),,"Welcome to Forza Motorsport
Complete the very first race in the game."
