achievement_game_url,achievement_url,achievement_name,achievement_desc,achievement_earned,achievement_score,ta_score,ta_ratio
https://www.trueachievements.com/game/Halo-Reach/achievements,https://www.trueachievements.com/a60899/make-it-drizzle-achievement,Make it Drizzle,Purchased an item from the Armory.,28 Jan 12,(10),,"Make it Drizzle
Purchased an item from the Armory."
https://www.trueachievements.com/game/Modern-Warfare-3/achievements,https://www.trueachievements.com/a157659/who-dares-wins-achievement,Who Dares Wins,Complete the campaign on any difficulty.,09 Jan 12,(40),,"Who Dares Wins
Complete the campaign on any difficulty."
https://www.trueachievements.com/game/Modern-Warfare-3/achievements,https://www.trueachievements.com/a157652/diamond-in-the-rough-achievement,Diamond in the Rough,"Rescue the Russian President. Complete ""Down the Rabbit Hole"" on any difficulty.",09 Jan 12,(10),,"Diamond in the Rough
Rescue the Russian President. Complete ""Down the Rabbit Hole"" on any difficulty."
https://www.trueachievements.com/game/Modern-Warfare-3/achievements,https://www.trueachievements.com/a157651/bad-first-date-achievement,Bad First Date,"Find the girl. Complete ""Scorched Earth"" on any difficulty.",09 Jan 12,(10),,"Bad First Date
Find the girl. Complete ""Scorched Earth"" on any difficulty."
https://www.trueachievements.com/game/Modern-Warfare-3/achievements,https://www.trueachievements.com/a157650/storm-the-castle-achievement,Storm the Castle,"Discover Makarov's next move. Complete ""Stronghold"" on any difficulty.",09 Jan 12,(10),,"Storm the Castle
Discover Makarov's next move. Complete ""Stronghold"" on any difficulty."
https://www.trueachievements.com/game/Modern-Warfare-3/achievements,https://www.trueachievements.com/a157649/requiem-achievement,Requiem,"Escape the city. Complete ""Blood Brothers"" on any difficulty.",09 Jan 12,(10),,"Requiem
Escape the city. Complete ""Blood Brothers"" on any difficulty."
https://www.trueachievements.com/game/Modern-Warfare-3/achievements,https://www.trueachievements.com/a157648/vive-la-revolution-achievement,Vive la Revolution!,"Reach the church. Complete ""Eye of the Storm"" on any difficulty.",09 Jan 12,(10),,"Vive la Revolution!
Reach the church. Complete ""Eye of the Storm"" on any difficulty."
https://www.trueachievements.com/game/Modern-Warfare-3/achievements,https://www.trueachievements.com/a157647/well-always-have-paris-achievement,We'll Always Have Paris,"Escape Paris with Volk. Complete ""Iron Lady"" on any difficulty.",09 Jan 12,(10),,"We'll Always Have Paris
Escape Paris with Volk. Complete ""Iron Lady"" on any difficulty."
https://www.trueachievements.com/game/Modern-Warfare-3/achievements,https://www.trueachievements.com/a157671/menage-a-trois-achievement,Menage a Trois,"Destroy 3 tanks with a single 105mm shot in ""Iron Lady.""",09 Jan 12,(20),,"Menage a Trois
Destroy 3 tanks with a single 105mm shot in ""Iron Lady."""
https://www.trueachievements.com/game/Modern-Warfare-3/achievements,https://www.trueachievements.com/a157646/back-seat-driver-achievement,Back Seat Driver,"Track down Volk. Complete ""Bag and Drag"" on any difficulty.",09 Jan 12,(10),,"Back Seat Driver
Track down Volk. Complete ""Bag and Drag"" on any difficulty."
https://www.trueachievements.com/game/Modern-Warfare-3/achievements,https://www.trueachievements.com/a157645/sandstorm-achievement,Sandstorm!,"Assault the shipping company. Complete ""Return to Sender"" on any difficulty.",09 Jan 12,(10),,"Sandstorm!
Assault the shipping company. Complete ""Return to Sender"" on any difficulty."
https://www.trueachievements.com/game/Modern-Warfare-3/achievements,https://www.trueachievements.com/a157644/welcome-to-ww3-achievement,Welcome to WW3,"Save the US Vice President. Complete ""Goalpost"" on any difficulty.",08 Jan 12,(10),,"Welcome to WW3
Save the US Vice President. Complete ""Goalpost"" on any difficulty."
https://www.trueachievements.com/game/Modern-Warfare-3/achievements,https://www.trueachievements.com/a157673/5050-achievement,50/50,Complete a Special Ops Mission Mode game with the same number of kills as your partner.,03 Jan 12,(20),,"50/50
Complete a Special Ops Mission Mode game with the same number of kills as your partner."
https://www.trueachievements.com/game/Modern-Warfare-3/achievements,https://www.trueachievements.com/a157684/brag-rags-achievement,Brag Rags,Earn 1 star in Special Ops Mission Mode.,03 Jan 12,(10),,"Brag Rags
Earn 1 star in Special Ops Mission Mode."
https://www.trueachievements.com/game/Modern-Warfare-3/achievements,https://www.trueachievements.com/a157643/one-way-ticket-achievement,One Way Ticket,"Make it to Westminster. Complete ""Mind the Gap"" on any difficulty.",03 Jan 12,(10),,"One Way Ticket
Make it to Westminster. Complete ""Mind the Gap"" on any difficulty."
https://www.trueachievements.com/game/Modern-Warfare-3/achievements,https://www.trueachievements.com/a157642/up-to-no-good-achievement,Up to No Good,"Infiltrate the village. Complete ""Back on the Grid"" on any difficulty.",02 Jan 12,(10),,"Up to No Good
Infiltrate the village. Complete ""Back on the Grid"" on any difficulty."
https://www.trueachievements.com/game/Modern-Warfare-3/achievements,https://www.trueachievements.com/a157641/frequent-flyer-achievement,Frequent Flyer,"Defend the Russian President. Complete ""Turbulence"" on any difficulty.",02 Jan 12,(10),,"Frequent Flyer
Defend the Russian President. Complete ""Turbulence"" on any difficulty."
https://www.trueachievements.com/game/Modern-Warfare-3/achievements,https://www.trueachievements.com/a157640/carpe-diem-achievement,Carpe Diem,"Escape the mountain safe house. Complete ""Persona Non Grata"" on any difficulty.",02 Jan 12,(10),,"Carpe Diem
Escape the mountain safe house. Complete ""Persona Non Grata"" on any difficulty."
https://www.trueachievements.com/game/Modern-Warfare-3/achievements,https://www.trueachievements.com/a157680/i-live-achievement,I Live,Survive 1 wave in a Special Ops Survival game.,02 Jan 12,(10),,"I Live
Survive 1 wave in a Special Ops Survival game."
https://www.trueachievements.com/game/Modern-Warfare-3/achievements,https://www.trueachievements.com/a157639/wet-work-achievement,Wet Work,"Take back New York Harbor. Complete ""Hunter Killer"" on any difficulty.",02 Jan 12,(10),,"Wet Work
Take back New York Harbor. Complete ""Hunter Killer"" on any difficulty."
https://www.trueachievements.com/game/Modern-Warfare-3/achievements,https://www.trueachievements.com/a157638/too-big-to-fail-achievement,Too Big to Fail,"Destroy the Jamming Tower. Complete ""Black Tuesday"" on any difficulty.",02 Jan 12,(10),,"Too Big to Fail
Destroy the Jamming Tower. Complete ""Black Tuesday"" on any difficulty."
https://www.trueachievements.com/game/Modern-Warfare-3/achievements,https://www.trueachievements.com/a157637/back-in-the-fight-achievement,Back in the Fight,Start the Single Player Campaign on any difficulty.,02 Jan 12,(5),,"Back in the Fight
Start the Single Player Campaign on any difficulty."
https://www.trueachievements.com/game/DiRT-3/achievements,https://www.trueachievements.com/a151086/crash-proof-achievement,Crash Proof,You used a flashback to take you to victory after facing defeat.,01 Jan 12,(10),,"Crash Proof
You used a flashback to take you to victory after facing defeat."
https://www.trueachievements.com/game/DiRT-3/achievements,https://www.trueachievements.com/a151089/reputation-boost-achievement,Reputation Boost,You have completed 5 bonus Race Objectives,01 Jan 12,(10),,"Reputation Boost
You have completed 5 bonus Race Objectives"
https://www.trueachievements.com/game/Battlefield-3/achievements,https://www.trueachievements.com/a155858/shock-troop-achievement,Shock Troop,Survived the quake,01 Jan 12,(15),,"Shock Troop
Survived the quake"
https://www.trueachievements.com/game/Battlefield-3/achievements,https://www.trueachievements.com/a155859/not-on-my-watch-achievement,Not on my watch,Protected Chaffin from the soldiers in the street in Operation Swordbreaker,01 Jan 12,(25),,"Not on my watch
Protected Chaffin from the soldiers in the street in Operation Swordbreaker"
https://www.trueachievements.com/game/Battlefield-3/achievements,https://www.trueachievements.com/a155860/flashforward-achievement,FlashForward,Completed Semper Fidelis,01 Jan 12,(10),,"FlashForward
Completed Semper Fidelis"
https://www.trueachievements.com/game/DiRT-3/achievements,https://www.trueachievements.com/a151091/into-the-dirt-achievement,Into the DiRT,You have completed your first DiRT Tour race,25 Dec 11,(10),,"Into the DiRT
You have completed your first DiRT Tour race"
https://www.trueachievements.com/game/Night-at-the-Museum/achievements,https://www.trueachievements.com/a32848/rotor-router-achievement,Rotor Router,Completed the Autogyro Flight,18 Dec 11,(20),,"Rotor Router
Completed the Autogyro Flight"
https://www.trueachievements.com/game/Night-at-the-Museum/achievements,https://www.trueachievements.com/a32849/lady-lindy-achievement,Lady Lindy,Restored Power to Amelia Earhart's Plane,18 Dec 11,(10),,"Lady Lindy
Restored Power to Amelia Earhart's Plane"
https://www.trueachievements.com/game/Night-at-the-Museum/achievements,https://www.trueachievements.com/a32850/monkeyshines-achievement,Monkeyshines,Completed National Air and Space Museum: Able Chase,18 Dec 11,(30),,"Monkeyshines
Completed National Air and Space Museum: Able Chase"
https://www.trueachievements.com/game/Night-at-the-Museum/achievements,https://www.trueachievements.com/a32852/with-a-monkey-chaser-achievement,With a Monkey Chaser,Navigated the Vending Machine,18 Dec 11,(10),,"With a Monkey Chaser
Navigated the Vending Machine"
https://www.trueachievements.com/game/Night-at-the-Museum/achievements,https://www.trueachievements.com/a32854/in-orbit-achievement,In Orbit,Freed Able from her Restraints,18 Dec 11,(10),,"In Orbit
Freed Able from her Restraints"
https://www.trueachievements.com/game/LEGO-Star-Wars-3/achievements,https://www.trueachievements.com/a148530/got-a-bad-feeling-about-this-achievement,Got a bad feeling about this,Land on the Invisible Hand.,18 Dec 11,(10),,"Got a bad feeling about this
Land on the Invisible Hand."
https://www.trueachievements.com/game/LEGO-Star-Wars-3/achievements,https://www.trueachievements.com/a148504/okay-clankers-suck-lasers-achievement,"Okay clankers, suck lasers!",Complete Ambush.,18 Dec 11,(10),,"Okay clankers, suck lasers!
Complete Ambush."
https://www.trueachievements.com/game/LEGO-Star-Wars-3/achievements,https://www.trueachievements.com/a148503/the-pleasure-is-all-mine-my-dear-achievement,The pleasure is all mine my dear,Complete The Hidden Enemy.,17 Dec 11,(10),,"The pleasure is all mine my dear
Complete The Hidden Enemy."
https://www.trueachievements.com/game/Night-at-the-Museum/achievements,https://www.trueachievements.com/a32856/a-new-threat-achievement,A New Threat,Escaped Federal Archives,17 Dec 11,(20),,"A New Threat
Escaped Federal Archives"
https://www.trueachievements.com/game/Night-at-the-Museum/achievements,https://www.trueachievements.com/a32862/flashback-achievement,Flashback,Completed Tablet Tutorial at New York Museum of Natural History,17 Dec 11,(20),,"Flashback
Completed Tablet Tutorial at New York Museum of Natural History"
https://www.trueachievements.com/game/Red-Dead-Redemption/achievements,https://www.trueachievements.com/a60652/how-the-west-was-won-achievement,How the West Was Won,Reach the top rank for multiplayer experience.,27 Nov 11,(20),,"How the West Was Won
Reach the top rank for multiplayer experience."
https://www.trueachievements.com/game/Dragon-Age-Origins/achievements,https://www.trueachievements.com/a37921/bloodied-achievement,Bloodied,Completed an origin story without the main character ever falling in battle,20 Nov 11,(10),,"Bloodied
Completed an origin story without the main character ever falling in battle"
https://www.trueachievements.com/game/Dragon-Age-Origins/achievements,https://www.trueachievements.com/a37898/conscripted-achievement,Conscripted,Completed the City Elf origin story,20 Nov 11,(10),,"Conscripted
Completed the City Elf origin story"
https://www.trueachievements.com/game/Portal-2/achievements,https://www.trueachievements.com/a149571/you-saved-science-achievement,You Saved Science,Complete all test chambers in all courses of co-op,06 Nov 11,(100),,"You Saved Science
Complete all test chambers in all courses of co-op"
https://www.trueachievements.com/game/Portal-2/achievements,https://www.trueachievements.com/a149584/asking-for-trouble-achievement,Asking for Trouble,Taunt GLaDOS in front of a camera in each of the five co-op courses,05 Nov 11,(10),,"Asking for Trouble
Taunt GLaDOS in front of a camera in each of the five co-op courses"
https://www.trueachievements.com/game/Portal-2/achievements,https://www.trueachievements.com/a149570/obstacle-building-achievement,Obstacle Building,Complete all test chambers in the Excursion Funnels co-op course,05 Nov 11,(15),,"Obstacle Building
Complete all test chambers in the Excursion Funnels co-op course"
https://www.trueachievements.com/game/Portal-2/achievements,https://www.trueachievements.com/a149576/party-of-three-achievement,Party of Three,Find the hidden companion cube in co-op test chamber,05 Nov 11,(25),,"Party of Three
Find the hidden companion cube in co-op test chamber"
https://www.trueachievements.com/game/Portal-2/achievements,https://www.trueachievements.com/a149579/air-show-achievement,Air Show,Perform 2 aerial gestures before touching the ground in co-op,05 Nov 11,(20),,"Air Show
Perform 2 aerial gestures before touching the ground in co-op"
https://www.trueachievements.com/game/Portal-2/achievements,https://www.trueachievements.com/a149575/empty-gesture-achievement,Empty Gesture,Drop your co-op partner in goo while they are gesturing by removing the bridge under them,05 Nov 11,(25),,"Empty Gesture
Drop your co-op partner in goo while they are gesturing by removing the bridge under them"
https://www.trueachievements.com/game/Portal-2/achievements,https://www.trueachievements.com/a149573/gesticul8-achievement,Gesticul-8,Perform all 8 gestures of your own volition in co-op,05 Nov 11,(15),,"Gesticul-8
Perform all 8 gestures of your own volition in co-op"
https://www.trueachievements.com/game/Portal-2/achievements,https://www.trueachievements.com/a149577/narbacular-drop-achievement,Narbacular Drop,Place a portal under your co-op partner while they are gesturing,05 Nov 11,(25),,"Narbacular Drop
Place a portal under your co-op partner while they are gesturing"
https://www.trueachievements.com/game/Portal-2/achievements,https://www.trueachievements.com/a149569/bridge-building-achievement,Bridge Building,Complete all test chambers in the Hard-Light Surfaces co-op course,05 Nov 11,(15),,"Bridge Building
Complete all test chambers in the Hard-Light Surfaces co-op course"
https://www.trueachievements.com/game/Portal-2/achievements,https://www.trueachievements.com/a149574/cant-touch-this-achievement,Can't Touch This,Dance in front of a turret blocked by a hard light bridge in co-op,05 Nov 11,(10),,"Can't Touch This
Dance in front of a turret blocked by a hard light bridge in co-op"
https://www.trueachievements.com/game/Portal-2/achievements,https://www.trueachievements.com/a149580/portal-conservation-society-achievement,Portal Conservation Society,Complete Chamber 3 in the Hard-Light Surfaces co-op course using only 5 total portal placements,05 Nov 11,(20),,"Portal Conservation Society
Complete Chamber 3 in the Hard-Light Surfaces co-op course using only 5 total portal placements"
https://www.trueachievements.com/game/Portal-2/achievements,https://www.trueachievements.com/a149585/rock-portal-scissors-achievement,Rock Portal Scissors,Win 3 co-op games of rock-paper-scissors in a row,05 Nov 11,(20),,"Rock Portal Scissors
Win 3 co-op games of rock-paper-scissors in a row"
https://www.trueachievements.com/game/Portal-2/achievements,https://www.trueachievements.com/a149568/confidence-building-achievement,Confidence Building,Complete all test chambers in the Mass and Velocity co-op course,05 Nov 11,(10),,"Confidence Building
Complete all test chambers in the Mass and Velocity co-op course"
https://www.trueachievements.com/game/Portal-2/achievements,https://www.trueachievements.com/a149567/team-building-achievement,Team Building,Complete all test chambers in the Team Building co-op course,05 Nov 11,(10),,"Team Building
Complete all test chambers in the Team Building co-op course"
https://www.trueachievements.com/game/Red-Dead-Redemption/achievements,https://www.trueachievements.com/a60661/friends-indeed-achievement,Friends indeed,Complete a Co-Op mission without anyone dying.,05 Aug 11,(5),,"Friends indeed
Complete a Co-Op mission without anyone dying."
https://www.trueachievements.com/game/Red-Dead-Redemption/achievements,https://www.trueachievements.com/a60644/long-arm-of-marston-achievement,Long Arm of Marston,"Kill 500 enemies with any rifle, repeater, or shotgun in any game mode.",04 Jul 11,(20),,"Long Arm of Marston
Kill 500 enemies with any rifle, repeater, or shotgun in any game mode."
https://www.trueachievements.com/game/Red-Dead-Redemption/achievements,https://www.trueachievements.com/a60655/red-dead-rockstar-achievement,Red Dead Rockstar,Kill a Rockstar or someone with this achievement in a public multiplayer match.,04 Jul 11,(10),,"Red Dead Rockstar
Kill a Rockstar or someone with this achievement in a public multiplayer match."
https://www.trueachievements.com/game/Red-Dead-Redemption/achievements,https://www.trueachievements.com/a60619/that-government-boy-achievement,That Government Boy,"Complete ""Exodus in America"".",03 Jul 11,(10),,"That Government Boy
Complete ""Exodus in America""."
https://www.trueachievements.com/game/Red-Dead-Redemption/achievements,https://www.trueachievements.com/a60647/have-gun-will-travel-achievement,Have Gun Will Travel,Complete all Hideouts in a single public Free Roam session.,03 Jul 11,(20),,"Have Gun Will Travel
Complete all Hideouts in a single public Free Roam session."
https://www.trueachievements.com/game/Red-Dead-Redemption/achievements,https://www.trueachievements.com/a60665/bulletproof-achievement,Bulletproof,Complete a Co-Op mission without dying.,02 Jul 11,(5),,"Bulletproof
Complete a Co-Op mission without dying."
https://www.trueachievements.com/game/Red-Dead-Redemption/achievements,https://www.trueachievements.com/a60659/stake-a-claim-achievement,Stake a claim,Gold medal any Co-Op mission.,02 Jul 11,(5),,"Stake a claim
Gold medal any Co-Op mission."
https://www.trueachievements.com/game/Red-Dead-Redemption/achievements,https://www.trueachievements.com/a60656/well-done-achievement,Well done,Complete a Co-Op mission.,02 Jul 11,(5),,"Well done
Complete a Co-Op mission."
https://www.trueachievements.com/game/Army-of-Two/achievements,https://www.trueachievements.com/a19527/out-of-debt-achievement,Out of Debt,Heal your partner for the first time. Training does not count.,31 May 11,(15),,"Out of Debt
Heal your partner for the first time. Training does not count."
https://www.trueachievements.com/game/Army-of-Two/achievements,https://www.trueachievements.com/a19535/mission-1-complete-achievement,Mission 1 Complete,Completed Mission 1 as Contractor or higher.,31 May 11,(30),,"Mission 1 Complete
Completed Mission 1 as Contractor or higher."
https://www.trueachievements.com/game/Castle-Crashers/achievements,https://www.trueachievements.com/a25079/melee-is-best-achievement,Melee Is Best,Defeat any boss without using any magic.,06 Feb 11,(15),,"Melee Is Best
Defeat any boss without using any magic."
https://www.trueachievements.com/game/3-on-3-NHL-Arcade/achievements,https://www.trueachievements.com/a30785/super-speed-achievement,Super Speed,Score two goals with a Super Speed Powerup in one game,30 Jan 11,(10),,"Super Speed
Score two goals with a Super Speed Powerup in one game"
https://www.trueachievements.com/game/Trials-HD/achievements,https://www.trueachievements.com/a35340/strike-achievement,Strike!,Get a strike in a midnight bowling event.,30 Jan 11,(15),,"Strike!
Get a strike in a midnight bowling event."
https://www.trueachievements.com/game/Trials-HD/achievements,https://www.trueachievements.com/a35335/leave-nothing-in-one-piece-achievement,Leave Nothing in One Piece,The player has completely destroyed the motorcycle and broken every single bone in a single crash.,30 Jan 11,(5),,"Leave Nothing in One Piece
The player has completely destroyed the motorcycle and broken every single bone in a single crash."
https://www.trueachievements.com/game/Trials-HD/achievements,https://www.trueachievements.com/a35346/the-challenger-achievement,The Challenger,The player has unlocked the first tournament.,30 Jan 11,(10),,"The Challenger
The player has unlocked the first tournament."
https://www.trueachievements.com/game/Shrek-the-Third/achievements,https://www.trueachievements.com/a12978/novice-collector-achievement,Novice Collector,Collect 33% of all Souvenir Mugs in the game. (Any Difficulty),Offline,(30),,"Novice Collector
Collect 33% of all Souvenir Mugs in the game. (Any Difficulty)"
https://www.trueachievements.com/game/LEGO-Batman/achievements,https://www.trueachievements.com/a26261/hero-achievement,Hero.,Complete the first episode - Hero.,Offline,(25),,"Hero.
Complete the first episode - Hero."
https://www.trueachievements.com/game/LEGO-Batman/achievements,https://www.trueachievements.com/a26279/nice-outfit-achievement,Nice Outfit!,Collect all suits.,Offline,(20),,"Nice Outfit!
Collect all suits."
https://www.trueachievements.com/game/LEGO-Batman/achievements,https://www.trueachievements.com/a26285/shot-to-the-goon-achievement,Shot to the goon.,Defeat 8 goons in 8 seconds.,Offline,(20),,"Shot to the goon.
Defeat 8 goons in 8 seconds."
https://www.trueachievements.com/game/LEGO-Batman/achievements,https://www.trueachievements.com/a26278/super-builder-achievement,Super Builder.,Build 50 LEGO build-its.,Offline,(20),,"Super Builder.
Build 50 LEGO build-its."
https://www.trueachievements.com/game/LEGO-Batman/achievements,https://www.trueachievements.com/a26262/super-hero-achievement,Super Hero.,Complete the second episode - Hero.,Offline,(25),,"Super Hero.
Complete the second episode - Hero."
https://www.trueachievements.com/game/Call-of-Duty-4/achievements,https://www.trueachievements.com/a9616/dancing-in-the-dark-achievement,Dancing in the Dark,Kill the power,Offline,(20),,"Dancing in the Dark
Kill the power"
https://www.trueachievements.com/game/Call-of-Duty-4/achievements,https://www.trueachievements.com/a9611/death-from-above-achievement,Death From Above,Operate an AC-130 gun ship,Offline,(20),,"Death From Above
Operate an AC-130 gun ship"
https://www.trueachievements.com/game/Call-of-Duty-4/achievements,https://www.trueachievements.com/a9613/down-boy-down-achievement,Down Boy Down,Survive a dog attack,Offline,(20),,"Down Boy Down
Survive a dog attack"
https://www.trueachievements.com/game/Call-of-Duty-4/achievements,https://www.trueachievements.com/a9618/earn-a-winged-dagger-achievement,Earn a Winged Dagger,Complete 'F.N.G.',Offline,(20),,"Earn a Winged Dagger
Complete 'F.N.G.'"
https://www.trueachievements.com/game/Call-of-Duty-4/achievements,https://www.trueachievements.com/a9626/four-of-a-kind-achievement,Four of a Kind,Kill 4 enemies in a row with headshots in the single player campaign,Offline,(20),,"Four of a Kind
Kill 4 enemies in a row with headshots in the single player campaign"
https://www.trueachievements.com/game/Call-of-Duty-4/achievements,https://www.trueachievements.com/a9617/make-the-jump-achievement,Make the Jump,Infiltrate a cargo ship,Offline,(20),,"Make the Jump
Infiltrate a cargo ship"
https://www.trueachievements.com/game/Call-of-Duty-4/achievements,https://www.trueachievements.com/a9609/piggyback-ride-achievement,Piggyback Ride,Carry Cpt. MacMillian to safety,Offline,(20),,"Piggyback Ride
Carry Cpt. MacMillian to safety"
https://www.trueachievements.com/game/Call-of-Duty-4/achievements,https://www.trueachievements.com/a9615/rescue-roycewicz-achievement,Rescue Roycewicz,Save Pvt. Roycewicz on the stairs,Offline,(20),,"Rescue Roycewicz
Save Pvt. Roycewicz on the stairs"
https://www.trueachievements.com/game/Call-of-Duty-4/achievements,https://www.trueachievements.com/a9608/roadkill-achievement,Roadkill,Kill 2 enemies by blowing up a car in the single player campaign,Offline,(10),,"Roadkill
Kill 2 enemies by blowing up a car in the single player campaign"
https://www.trueachievements.com/game/Call-of-Duty-4/achievements,https://www.trueachievements.com/a9614/save-the-bacon-achievement,Save the Bacon,"Protect 'War Pig', the Abrams tank",Offline,(20),,"Save the Bacon
Protect 'War Pig', the Abrams tank"
https://www.trueachievements.com/game/Call-of-Duty-4/achievements,https://www.trueachievements.com/a9612/straight-flush-achievement,Straight Flush,Kill 5 enemies with one shot while in the AC-130 gunship,Offline,(20),,"Straight Flush
Kill 5 enemies with one shot while in the AC-130 gunship"
https://www.trueachievements.com/game/Call-of-Duty-4/achievements,https://www.trueachievements.com/a9610/wrong-number-achievement,Wrong Number,Find Al-Asad's safehouse,Offline,(20),,"Wrong Number
Find Al-Asad's safehouse"
https://www.trueachievements.com/game/DiRT-2/achievements,https://www.trueachievements.com/a35376/allstar-achievement,All-Star,You're an All-Star driver now!,Offline,(25),,"All-Star
You're an All-Star driver now!"
https://www.trueachievements.com/game/DiRT-2/achievements,https://www.trueachievements.com/a35373/arent-you-popular-achievement,Aren't You Popular!,You're pretty popular! You're true friends with four superstars.,Offline,(15),,"Aren't You Popular!
You're pretty popular! You're true friends with four superstars."
