achievement_game_url,achievement_url,achievement_name,achievement_desc,achievement_earned,achievement_score,ta_score,ta_ratio
https://www.trueachievements.com/game/Tom-Clancys-Rainbow-Six-Siege/achievements,https://www.trueachievements.com/a210315/accessorizing-achievement,Accessorizing,Equip 50 weapon attachments.,27 Jul 22,(5),,"Accessorizing
Equip 50 weapon attachments."
https://www.trueachievements.com/game/Tom-Clancys-Rainbow-Six-Siege/achievements,https://www.trueachievements.com/a210316/perimeter-secured-achievement,Perimeter Secured,Win a match of Secure Area in Quick Match Multiplayer.,27 Jul 22,(10),,"Perimeter Secured
Win a match of Secure Area in Quick Match Multiplayer."
https://www.trueachievements.com/game/Tom-Clancys-Rainbow-Six-Siege/achievements,https://www.trueachievements.com/a210317/that-bullet-pen-achievement,That Bullet Pen...,Eliminate 10 opponents through bullet penetration in Quick Match/Ranked Multiplayer,27 Jul 22,(10),,"That Bullet Pen...
Eliminate 10 opponents through bullet penetration in Quick Match/Ranked Multiplayer"
https://www.trueachievements.com/game/Tom-Clancys-Rainbow-Six-Siege/achievements,https://www.trueachievements.com/a210305/brain-surgeon-achievement,Brain Surgeon,Get 50 headshots in Quick Match/Ranked Multiplayer.,17 Jun 17,(20),,"Brain Surgeon
Get 50 headshots in Quick Match/Ranked Multiplayer."
https://www.trueachievements.com/game/Grand-Theft-Auto-V-Xbox-One/achievements,https://www.trueachievements.com/a199122/cant-touch-this-achievement,Can't Touch This,You completed a Heist Finale without taking any damage.,29 May 17,(30),,"Can't Touch This
You completed a Heist Finale without taking any damage."
https://www.trueachievements.com/game/Grand-Theft-Auto-V-Xbox-One/achievements,https://www.trueachievements.com/a195128/run-like-the-wind-achievement,Run Like The Wind,You survived for a day with a Bounty on your head.,27 May 17,(20),,"Run Like The Wind
You survived for a day with a Bounty on your head."
https://www.trueachievements.com/game/Grand-Theft-Auto-V-Xbox-One/achievements,https://www.trueachievements.com/a199116/in-the-name-of-science-achievement,In the Name of Science,You completed The Humane Labs Raid and Series A Funding as Heist Leader or Crew.,26 May 17,(30),,"In the Name of Science
You completed The Humane Labs Raid and Series A Funding as Heist Leader or Crew."
https://www.trueachievements.com/game/Ryse-Son-of-Rome/achievements,https://www.trueachievements.com/a181836/i-have-a-story-to-tell-achievement,I Have A Story To Tell,Complete The Beginning On Any Difficulty,05 Apr 17,(30),,"I Have A Story To Tell
Complete The Beginning On Any Difficulty"
https://www.trueachievements.com/game/Ryse-Son-of-Rome/achievements,https://www.trueachievements.com/a181870/its-just-a-flesh-wound-achievement,It's Just A Flesh Wound,Revive Another Player 3 Times,05 Apr 17,(10),,"It's Just A Flesh Wound
Revive Another Player 3 Times"
https://www.trueachievements.com/game/Ryse-Son-of-Rome/achievements,https://www.trueachievements.com/a181871/step-right-this-way-achievement,Step Right This Way!,Use A Trap To Kill An Enemy,05 Apr 17,(10),,"Step Right This Way!
Use A Trap To Kill An Enemy"
https://www.trueachievements.com/game/Ryse-Son-of-Rome/achievements,https://www.trueachievements.com/a181838/to-protect-and-to-serve-achievement,To Protect And To Serve,Meet Nero,04 Apr 17,(15),,"To Protect And To Serve
Meet Nero"
https://www.trueachievements.com/game/Ryse-Son-of-Rome/achievements,https://www.trueachievements.com/a181839/first-blood-achievement,First Blood,Perform Your First Combat Execution,04 Apr 17,(5),,"First Blood
Perform Your First Combat Execution"
https://www.trueachievements.com/game/Call-of-Duty-Black-Ops-III/achievements,https://www.trueachievements.com/a209630/battle-tested-achievement,Battle Tested,Reach Commander (Level 55) in Multiplayer while playing online.,25 Mar 17,(20),,"Battle Tested
Reach Commander (Level 55) in Multiplayer while playing online."
https://www.trueachievements.com/game/Call-of-Duty-Black-Ops-III/achievements,https://www.trueachievements.com/a209629/welcome-to-the-club-achievement,Welcome to the Club,Reach Sergeant (Level 10) in Multiplayer while playing online.,20 Mar 17,(20),,"Welcome to the Club
Reach Sergeant (Level 10) in Multiplayer while playing online."
https://www.trueachievements.com/game/FIFA-17/achievements,https://www.trueachievements.com/a221882/game-on-achievement,Game on,Play a women's football match,18 Feb 17,(15),,"Game on
Play a women's football match"
https://www.trueachievements.com/game/FIFA-17/achievements,https://www.trueachievements.com/a221869/a-shift-in-power-achievement,A shift in power...,Change your captain in FIFA Ultimate Team,19 Dec 16,(15),,"A shift in power...
Change your captain in FIFA Ultimate Team"
https://www.trueachievements.com/game/Grand-Theft-Auto-V-Xbox-One/achievements,https://www.trueachievements.com/a195122/making-moves-achievement,Making Moves,You reached Rank 50 in GTA Online.,18 Dec 16,(30),,"Making Moves
You reached Rank 50 in GTA Online."
https://www.trueachievements.com/game/Grand-Theft-Auto-V-Xbox-One/achievements,https://www.trueachievements.com/a199118/parole-day-achievement,Parole Day,You completed The Prison Break as Heist Leader or Crew.,16 Dec 16,(30),,"Parole Day
You completed The Prison Break as Heist Leader or Crew."
https://www.trueachievements.com/game/Grand-Theft-Auto-V-Xbox-One/achievements,https://www.trueachievements.com/a199119/shot-caller-achievement,Shot Caller,You invested your hard earned cash and set up a Heist.,16 Dec 16,(10),,"Shot Caller
You invested your hard earned cash and set up a Heist."
https://www.trueachievements.com/game/FIFA-17/achievements,https://www.trueachievements.com/a221862/trial-of-power-achievement,Trial of Power,Win all 4 matches in an Online FUT Draft session in FIFA Ultimate Team,13 Dec 16,(80),,"Trial of Power
Win all 4 matches in an Online FUT Draft session in FIFA Ultimate Team"
https://www.trueachievements.com/game/FIFA-17/achievements,https://www.trueachievements.com/a221853/100-achievement,100%,Win a penalty shoot-out without missing,12 Dec 16,(30),,"100%
Win a penalty shoot-out without missing"
https://www.trueachievements.com/game/Grand-Theft-Auto-V-Xbox-One/achievements,https://www.trueachievements.com/a199117/dead-presidents-achievement,Dead Presidents,You completed The Fleeca Job and The Pacific Standard Job as Heist Leader or Crew.,07 Dec 16,(30),,"Dead Presidents
You completed The Fleeca Job and The Pacific Standard Job as Heist Leader or Crew."
https://www.trueachievements.com/game/Grand-Theft-Auto-V-Xbox-One/achievements,https://www.trueachievements.com/a195088/welcome-to-los-santos-achievement,Welcome to Los Santos,You repo'd a car and raced it through the heart of a sun-soaked metropolis.,05 Dec 16,(10),,"Welcome to Los Santos
You repo'd a car and raced it through the heart of a sun-soaked metropolis."
https://www.trueachievements.com/game/Grand-Theft-Auto-V-Xbox-One/achievements,https://www.trueachievements.com/a195125/the-midnight-club-achievement,The Midnight Club,You used custom vehicles to win 5 races.,04 Dec 16,(20),,"The Midnight Club
You used custom vehicles to win 5 races."
https://www.trueachievements.com/game/Grand-Theft-Auto-V-Xbox-One/achievements,https://www.trueachievements.com/a195135/dialling-digits-achievement,Dialling Digits,You called for a Backup Helicopter for the first time.,27 Nov 16,(5),,"Dialling Digits
You called for a Backup Helicopter for the first time."
https://www.trueachievements.com/game/Grand-Theft-Auto-V-Xbox-One/achievements,https://www.trueachievements.com/a195121/threebit-gangster-achievement,Three-Bit Gangster,You reached Rank 25 in GTA Online.,25 Nov 16,(10),,"Three-Bit Gangster
You reached Rank 25 in GTA Online."
https://www.trueachievements.com/game/Grand-Theft-Auto-V-Xbox-One/achievements,https://www.trueachievements.com/a199115/be-prepared-achievement,Be Prepared,You completed a Heist Setup.,25 Nov 16,(10),,"Be Prepared
You completed a Heist Setup."
https://www.trueachievements.com/game/Grand-Theft-Auto-V-Xbox-One/achievements,https://www.trueachievements.com/a195133/crew-cut-achievement,Crew Cut,You completed a Job as a member of a Crew.,21 Nov 16,(5),,"Crew Cut
You completed a Job as a member of a Crew."
https://www.trueachievements.com/game/Grand-Theft-Auto-V-Xbox-One/achievements,https://www.trueachievements.com/a195116/pimp-my-sidearm-achievement,Pimp My Sidearm,You fully modded a weapon.,20 Nov 16,(10),,"Pimp My Sidearm
You fully modded a weapon."
https://www.trueachievements.com/game/Grand-Theft-Auto-V-Xbox-One/achievements,https://www.trueachievements.com/a195136/american-dream-achievement,American Dream,"You own an Apartment, Garage and an Insured Vehicle.",20 Nov 16,(10),,"American Dream
You own an Apartment, Garage and an Insured Vehicle."
https://www.trueachievements.com/game/Grand-Theft-Auto-V-Xbox-One/achievements,https://www.trueachievements.com/a195120/off-the-plane-achievement,Off the Plane,You completed the GTA Online Introduction.,20 Nov 16,(5),,"Off the Plane
You completed the GTA Online Introduction."
https://www.trueachievements.com/game/NBA-2K17-The-Prelude/achievements,https://www.trueachievements.com/a221828/the-clock-strikes-midnight-achievement,The Clock Strikes Midnight,"Complete your first college ""game.""",19 Nov 16,(50),,"The Clock Strikes Midnight
Complete your first college ""game."""
https://www.trueachievements.com/game/NBA-2K17-The-Prelude/achievements,https://www.trueachievements.com/a221827/higher-education-achievement,Higher Education,Choose which college you want to attend.,19 Nov 16,(50),,"Higher Education
Choose which college you want to attend."
https://www.trueachievements.com/game/NBA-2K17-The-Prelude/achievements,https://www.trueachievements.com/a221823/youve-got-the-look-achievement,You've Got The Look,Create Your MyPLAYER.,19 Nov 16,(50),,"You've Got The Look
Create Your MyPLAYER."
https://www.trueachievements.com/game/Dovetail-Games-Euro-Fishing/achievements,https://www.trueachievements.com/a217397/specimen-roach-hunter-achievement,Specimen Roach Hunter,Caught a specimen Roach,16 Nov 16,(50),,"Specimen Roach Hunter
Caught a specimen Roach"
https://www.trueachievements.com/game/Dovetail-Games-Euro-Fishing/achievements,https://www.trueachievements.com/a217404/lake-monster-hunter-achievement,Lake Monster Hunter,Caught a fish over 40 kg (90 lbs),16 Nov 16,(200),,"Lake Monster Hunter
Caught a fish over 40 kg (90 lbs)"
https://www.trueachievements.com/game/Dovetail-Games-Euro-Fishing/achievements,https://www.trueachievements.com/a217402/top-cat-achievement,Top Cat,Caught 50 Catfish,15 Nov 16,(150),,"Top Cat
Caught 50 Catfish"
https://www.trueachievements.com/game/YouTube/achievements,https://www.trueachievements.com/a185944/please-sir-may-i-have-some-more-achievement,"Please sir, may I have some more?",You subscribed to a channel! (This achievement won't show the name of the channel you subscribed to),14 Nov 16,(0),,"Please sir, may I have some more?
You subscribed to a channel! (This achievement won't show the name of the channel you subscribed to)"
https://www.trueachievements.com/game/Rocket-League/achievements,https://www.trueachievements.com/a217746/icing-the-cake-achievement,Icing the Cake,"In Snow Day, score a goal from your own side of the ice",13 Nov 16,(25),,"Icing the Cake
In Snow Day, score a goal from your own side of the ice"
https://www.trueachievements.com/game/Rocket-League/achievements,https://www.trueachievements.com/a223466/trifecta-achievement,Trifecta,"Score a Goal, Save a shot, and Assist a teammate in a single game",06 Nov 16,(25),,"Trifecta
Score a Goal, Save a shot, and Assist a teammate in a single game"
https://www.trueachievements.com/game/FIFA-17/achievements,https://www.trueachievements.com/a221881/instant-karma-achievement,Instant Karma,Gift an EA SPORTS Football Club Catalogue Item,04 Nov 16,(15),,"Instant Karma
Gift an EA SPORTS Football Club Catalogue Item"
https://www.trueachievements.com/game/FIFA-17/achievements,https://www.trueachievements.com/a221863/practice-run-achievement,Practice Run,Win all 4 matches in a Single Player FUT Draft session in FIFA Ultimate Team,03 Nov 16,(15),,"Practice Run
Win all 4 matches in a Single Player FUT Draft session in FIFA Ultimate Team"
https://www.trueachievements.com/game/FIFA-17/achievements,https://www.trueachievements.com/a221857/sweet-spot-achievement,Sweet spot,"During open play, score a long-distance goal with a defender (25 yards out)",02 Nov 16,(15),,"Sweet spot
During open play, score a long-distance goal with a defender (25 yards out)"
https://www.trueachievements.com/game/Tom-Clancys-Rainbow-Six-Siege/achievements,https://www.trueachievements.com/a210308/senseless-achievement,Senseless,Eliminate 10 opponents blinded by Stun Grenades in Quick Match/Ranked Multiplayer.,21 Oct 16,(10),,"Senseless
Eliminate 10 opponents blinded by Stun Grenades in Quick Match/Ranked Multiplayer."
https://www.trueachievements.com/game/FIFA-17/achievements,https://www.trueachievements.com/a221875/here-we-go-achievement,Here we go..,Win Division Title in Online Head to Head Seasons (must be obtained through game-play),17 Oct 16,(30),,"Here we go..
Win Division Title in Online Head to Head Seasons (must be obtained through game-play)"
https://www.trueachievements.com/game/YouTube/achievements,https://www.trueachievements.com/a185948/look-mom-im-on-tv-achievement,"Look Mom, I'm on TV!",You uploaded a video from your Xbox One!,17 Oct 16,(0),,"Look Mom, I'm on TV!
You uploaded a video from your Xbox One!"
https://www.trueachievements.com/game/FIFA-17/achievements,https://www.trueachievements.com/a221877/still-friends-achievement,Still friends?,Finish an Online Friendlies Season,17 Oct 16,(15),,"Still friends?
Finish an Online Friendlies Season"
https://www.trueachievements.com/game/Twitch/achievements,https://www.trueachievements.com/a182906/hipster-achievement,Hipster,Watched 1 hour of live video on Twitch channels that have less than 10 viewers.,16 Oct 16,(0),,"Hipster
Watched 1 hour of live video on Twitch channels that have less than 10 viewers."
https://www.trueachievements.com/game/FIFA-17/achievements,https://www.trueachievements.com/a221865/friendship-endures-achievement,Friendship endures,Win a Friendly Season in FIFA Ultimate Team,16 Oct 16,(15),,"Friendship endures
Win a Friendly Season in FIFA Ultimate Team"
https://www.trueachievements.com/game/Tom-Clancys-Rainbow-Six-Siege/achievements,https://www.trueachievements.com/a210309/meat-wall-achievement,Meat Wall,Eliminate an opponent with a Breach Charge in Quick Match/Ranked Multiplayer.,15 Oct 16,(20),,"Meat Wall
Eliminate an opponent with a Breach Charge in Quick Match/Ranked Multiplayer."
https://www.trueachievements.com/game/FIFA-17/achievements,https://www.trueachievements.com/a221852/cant-believe-you-fell-for-that-achievement,Can't believe you fell for that,Score a Penalty Kick after stuttering,14 Oct 16,(15),,"Can't believe you fell for that
Score a Penalty Kick after stuttering"
https://www.trueachievements.com/game/FIFA-17/achievements,https://www.trueachievements.com/a221889/the-best-is-yet-to-come-achievement,The best is yet to come,Finish The Journey,02 Oct 16,(90),,"The best is yet to come
Finish The Journey"
https://www.trueachievements.com/game/FIFA-17/achievements,https://www.trueachievements.com/a221866/the-science-of-fut-achievement,The Science of FUT,Apply your first Chemistry Style consumable in FIFA Ultimate Team,30 Sep 16,(15),,"The Science of FUT
Apply your first Chemistry Style consumable in FIFA Ultimate Team"
https://www.trueachievements.com/game/FIFA-17/achievements,https://www.trueachievements.com/a221858/they-did-their-homework-achievement,They did their homework,Score 2 goals from a corner in a match,30 Sep 16,(15),,"They did their homework
Score 2 goals from a corner in a match"
https://www.trueachievements.com/game/FIFA-17/achievements,https://www.trueachievements.com/a221847/exchange-student-achievement,Exchange student,Sign a Loan Player from the EASFC Catalogue,30 Sep 16,(15),,"Exchange student
Sign a Loan Player from the EASFC Catalogue"
https://www.trueachievements.com/game/FIFA-17/achievements,https://www.trueachievements.com/a221861/grouped-together-achievement,Grouped together,Complete your first Squad Building Challenges Group in FIFA Ultimate Team,29 Sep 16,(15),,"Grouped together
Complete your first Squad Building Challenges Group in FIFA Ultimate Team"
https://www.trueachievements.com/game/FIFA-17/achievements,https://www.trueachievements.com/a221868/champions-achievement,Champions!,Win a division title in FIFA Ultimate Team Seasons,29 Sep 16,(30),,"Champions!
Win a division title in FIFA Ultimate Team Seasons"
https://www.trueachievements.com/game/FIFA-17/achievements,https://www.trueachievements.com/a221860/first-exchange-achievement,First Exchange,Complete your first Squad Building Challenge in FIFA Ultimate Team,29 Sep 16,(15),,"First Exchange
Complete your first Squad Building Challenge in FIFA Ultimate Team"
https://www.trueachievements.com/game/FIFA-17/achievements,https://www.trueachievements.com/a221850/slotted-achievement,Slotted,Score a goal using a low shot,29 Sep 16,(15),,"Slotted
Score a goal using a low shot"
https://www.trueachievements.com/game/FIFA-17/achievements,https://www.trueachievements.com/a221846/make-it-count-achievement,Make it count!,"First appearance, Starting or Sub, of a player bought from the Transfer Market in FIFA Ultimate Team",29 Sep 16,(15),,"Make it count!
First appearance, Starting or Sub, of a player bought from the Transfer Market in FIFA Ultimate Team"
https://www.trueachievements.com/game/FIFA-17/achievements,https://www.trueachievements.com/a221878/just-warming-up-achievement,Just warming up,Complete and win your first Pro Club Seasons league match,29 Sep 16,(15),,"Just warming up
Complete and win your first Pro Club Seasons league match"
https://www.trueachievements.com/game/FIFA-17/achievements,https://www.trueachievements.com/a221880/team-spirit-achievement,Team Spirit,Join a club with your Online Pro and play your first match in Pro Clubs,29 Sep 16,(15),,"Team Spirit
Join a club with your Online Pro and play your first match in Pro Clubs"
https://www.trueachievements.com/game/FIFA-17/achievements,https://www.trueachievements.com/a221848/mine-achievement,Mine!,Purchase an EA SPORTS Football Club Catalogue Item,29 Sep 16,(15),,"Mine!
Purchase an EA SPORTS Football Club Catalogue Item"
https://www.trueachievements.com/game/FIFA-17/achievements,https://www.trueachievements.com/a221876/fancy-a-match-achievement,Fancy a Match?,Play a Drop-In Match in Pro Clubs,29 Sep 16,(15),,"Fancy a Match?
Play a Drop-In Match in Pro Clubs"
https://www.trueachievements.com/game/FIFA-17/achievements,https://www.trueachievements.com/a221879/upgraded-achievement,Upgraded!,Spend a skill point in Pro Clubs,29 Sep 16,(15),,"Upgraded!
Spend a skill point in Pro Clubs"
https://www.trueachievements.com/game/FIFA-17/achievements,https://www.trueachievements.com/a221856/aerial-threat-achievement,Aerial threat,Score a goal with a downward header,29 Sep 16,(15),,"Aerial threat
Score a goal with a downward header"
https://www.trueachievements.com/game/FIFA-17/achievements,https://www.trueachievements.com/a221849/telepathic-achievement,Telepathic,Assist a goal using a threaded through pass,29 Sep 16,(30),,"Telepathic
Assist a goal using a threaded through pass"
https://www.trueachievements.com/game/FIFA-17/achievements,https://www.trueachievements.com/a221886/top-of-the-class-achievement,Top of the Class,Finish all training drills in a week with an A in The Journey (without simming),29 Sep 16,(30),,"Top of the Class
Finish all training drills in a week with an A in The Journey (without simming)"
https://www.trueachievements.com/game/FIFA-17/achievements,https://www.trueachievements.com/a221887/hard-to-get-achievement,Hard to get,"Achieve a transfer value of £8,000,000 in The Journey",29 Sep 16,(30),,"Hard to get
Achieve a transfer value of £8,000,000 in The Journey"
https://www.trueachievements.com/game/FIFA-17/achievements,https://www.trueachievements.com/a221888/social-media-star-achievement,Social Media Star,"Reach 50,000 followers in The Journey",29 Sep 16,(30),,"Social Media Star
Reach 50,000 followers in The Journey"
https://www.trueachievements.com/game/NBA-2K17-The-Prelude/achievements,https://www.trueachievements.com/a221824/practice-achievement,Practice???,Complete a 2KU tutorial game.,10 Sep 16,(100),,"Practice???
Complete a 2KU tutorial game."
https://www.trueachievements.com/game/Tom-Clancys-Rainbow-Six-Siege/achievements,https://www.trueachievements.com/a210311/wrong-number-achievement,Wrong Number,Eliminate 10 opponents with Nitro Cells in Quick Match/Ranked Multiplayer.,09 Sep 16,(10),,"Wrong Number
Eliminate 10 opponents with Nitro Cells in Quick Match/Ranked Multiplayer."
https://www.trueachievements.com/game/Dovetail-Games-Euro-Fishing/achievements,https://www.trueachievements.com/a217403/specimen-catfish-hunter-achievement,Specimen Catfish Hunter,Caught a specimen Catfish,01 Sep 16,(150),,"Specimen Catfish Hunter
Caught a specimen Catfish"
https://www.trueachievements.com/game/Dovetail-Games-Euro-Fishing/achievements,https://www.trueachievements.com/a217392/big-haul-achievement,Big Haul,Caught 100 fish,01 Sep 16,(100),,"Big Haul
Caught 100 fish"
https://www.trueachievements.com/game/Dovetail-Games-Euro-Fishing/achievements,https://www.trueachievements.com/a217405/specimen-carp-hunter-achievement,Specimen Carp Hunter,Caught a specimen Carp,01 Sep 16,(50),,"Specimen Carp Hunter
Caught a specimen Carp"
https://www.trueachievements.com/game/Dovetail-Games-Euro-Fishing/achievements,https://www.trueachievements.com/a217391/carptastic-achievement,Carp-tastic,Caught 50 Carp,31 Aug 16,(50),,"Carp-tastic
Caught 50 Carp"
https://www.trueachievements.com/game/Dovetail-Games-Euro-Fishing/achievements,https://www.trueachievements.com/a217401/specimen-bream-hunter-achievement,Specimen Bream Hunter,Caught a specimen Bream,31 Aug 16,(50),,"Specimen Bream Hunter
Caught a specimen Bream"
https://www.trueachievements.com/game/Dovetail-Games-Euro-Fishing/achievements,https://www.trueachievements.com/a217394/im-hooked-achievement,I'm Hooked,Caught 50 fish,31 Aug 16,(25),,"I'm Hooked
Caught 50 fish"
https://www.trueachievements.com/game/Dovetail-Games-Euro-Fishing/achievements,https://www.trueachievements.com/a217393/mugged-right-off-achievement,Mugged Right Off,Lost 25 fish,30 Aug 16,(25),,"Mugged Right Off
Lost 25 fish"
https://www.trueachievements.com/game/Dovetail-Games-Euro-Fishing/achievements,https://www.trueachievements.com/a217395/what-a-beauty-achievement,What A Beauty!,Caught your first fish,30 Aug 16,(25),,"What A Beauty!
Caught your first fish"
https://www.trueachievements.com/game/WWE-2K16/achievements,https://www.trueachievements.com/a209229/feed-me-more-achievement,Feed Me More,Use the quick edit function in a move set.,22 Aug 16,(15),,"Feed Me More
Use the quick edit function in a move set."
https://www.trueachievements.com/game/WWE-2K16/achievements,https://www.trueachievements.com/a209231/bluechipper-achievement,Blue-Chipper,"Earn the online rank ""Blue-Chipper"".",20 Aug 16,(15),,"Blue-Chipper
Earn the online rank ""Blue-Chipper""."
https://www.trueachievements.com/game/WWE-2K16/achievements,https://www.trueachievements.com/a209233/teamwork-is-fun-achievement,Teamwork is Fun,Win a Team Up match.,20 Aug 16,(15),,"Teamwork is Fun
Win a Team Up match."
https://www.trueachievements.com/game/Tom-Clancys-Rainbow-Six-Siege/achievements,https://www.trueachievements.com/a210296/to-the-top-achievement,To the Top,Reach Clearance level 50.,19 Aug 16,(75),,"To the Top
Reach Clearance level 50."
https://www.trueachievements.com/game/Tom-Clancys-Rainbow-Six-Siege/achievements,https://www.trueachievements.com/a210295/jack-of-all-trades-achievement,Jack of All Trades,Win 1 round with every Pathfinder Operator in Ranked.,18 Aug 16,(50),,"Jack of All Trades
Win 1 round with every Pathfinder Operator in Ranked."
https://www.trueachievements.com/game/WWE-2K16/achievements,https://www.trueachievements.com/a209230/prospect-achievement,Prospect,"Earn the online rank ""Prospect"".",18 Aug 16,(15),,"Prospect
Earn the online rank ""Prospect""."
https://www.trueachievements.com/game/Tom-Clancys-Rainbow-Six-Siege/achievements,https://www.trueachievements.com/a210310/oh-yeah-achievement,Oh Yeah!,Destroy a reinforced wall with the Thermite Charge in Quick Match/Ranked Multiplayer.,14 Aug 16,(10),,"Oh Yeah!
Destroy a reinforced wall with the Thermite Charge in Quick Match/Ranked Multiplayer."
https://www.trueachievements.com/game/Tom-Clancys-Rainbow-Six-Siege/achievements,https://www.trueachievements.com/a210274/bang-achievement,Bang!,Eliminate 5 opponents with pistols.,13 Aug 16,(50),,"Bang!
Eliminate 5 opponents with pistols."
https://www.trueachievements.com/game/Tom-Clancys-Rainbow-Six-Siege/achievements,https://www.trueachievements.com/a210280/greaser-achievement,Greaser,Eliminate 5 opponents with SMGs.,13 Aug 16,(25),,"Greaser
Eliminate 5 opponents with SMGs."
https://www.trueachievements.com/game/Tom-Clancys-Rainbow-Six-Siege/achievements,https://www.trueachievements.com/a210281/full-auto-achievement,Full Auto,Eliminate 5 opponents with ARs.,12 Aug 16,(25),,"Full Auto
Eliminate 5 opponents with ARs."
https://www.trueachievements.com/game/Tom-Clancys-Rainbow-Six-Siege/achievements,https://www.trueachievements.com/a210282/ride-shotgun-achievement,Ride Shotgun,Eliminate 5 opponents with shotguns.,12 Aug 16,(20),,"Ride Shotgun
Eliminate 5 opponents with shotguns."
https://www.trueachievements.com/game/Tom-Clancys-Rainbow-Six-Siege/achievements,https://www.trueachievements.com/a210283/sureshot-achievement,Sureshot,Eliminate 5 opponents with DMRs.,12 Aug 16,(15),,"Sureshot
Eliminate 5 opponents with DMRs."
